5,عالی
4,در این رنج قیمت بهترین مدلی هست که میشه خرید
5,با پردازنده core i7 نسل 12 و حافظه گرافیکی 6 همه برنامه ها رو به راحتی اجرا می‌کنه  صفحه نمایش نسبتاً خوبی داره  تقریباً ۵ ساعت شارژ نگه میداره که با شارژر ۲۳۰ واتش سریع شارژ میشه 
4,"چند روزی میشه تحویل گرفتم بسته بندی دیجی‌کالا واقعا ضعیف بود چون همراه لب‌تاپ، کیف سفارش داده بودم، معلومه کارتن اندازش دوتاش نداشتن، به‌هم وَر کرده بودن. ولی کارتن اصلی لب‌تاپ کاملا سالم و پلمپ بود که ممنون از ای‌تی هوم مورد بعد اینکه چون دیدم بعضیا میگن نصب ویندوز و درایوها اذیت می‌کنه دستگاه رو دادم بیرون، یک ساعته برام اوکی کردن. تا الان هم مورد بدی ندیدم  فقط اینکه باتری معمولی داره و وقتی فن رو حداکثر توان کار می‌کنه صدای زیادی تولید میکنه، البته ناگفته نماند این حالت فقط برای استفاده طولانی مدت و گیم های سنگین اتفاق میفته که میشه تحمل کرد"
5,"من لپ تاپ رو با 2 سال گارانتی سازگار گرفتم .  تاریخ اسمبل اول 2023 هست و شروع گارانتی لپ تاپ از فروردین ماه شروع شده،سفارش خاورمیانه بود  چون صفحه کلید فارسی داشت،تبدیل برق هم داخل جعبه بود.فقط یک نکته موقع نصب ویندوز 11 رو سی پی یو های نسل 12 اینتل هست که هارد رو شناسایی نمیکنه مشکل از لپ تاپ یا شرکت لنوو نیست باید موقع نصب یک فایل جداگانه از سایت اینتل دانلود و نصب کنید تا هارد شناسایی شود و ویندوز قابل نصب شود ، بدون درایو کلا هیچ قسمتی از لپ تاپ مثل وایرلس و تاچ پد و بلوتوث و ....کار نمیکند. بهترین گزینه اپدیت ویندوز هست، چند گیگ دانلود میکند و تمام درایو ها رو نصب میکند و مشکل حل میشود و نیاز به سایت لنوو نیست. پیشنهاد میکنم ظرفیت هارد رو یک ترابایت انتخاب کنید"
5,از لحاظ قیمتی نسبت به فروشگاه های دیگه خیلی قیمت مناسب تر بود. کارتن لپ تاپ پلمپ بود و گارانتی هم دو سال داره که تقریبا دو ماه از تاریخ گارانتی گذشته بود موقعی که تحویل گرفتم. مشخصات لپ تاپ هم دقیقا مطابق توضیحات بود و هیچ کم و کسری نداشت. فقط نصب ویندوزش به شدت سخت بود و دو روز کامل درگیر نصب ویندوز و درایورهاش بودم. فایل شناسایی هارد هنگام نصب ویندوز هم توی سایت های داخلی چنتا پیدا کردم که بلاخره یکی به لپ تاپ من خورد. درایور ها رو هم از سایت لنوو دانلود کردم با این که فیلتر بود ولی اصلا بدرد نمیخورد و تاچ پدم به هیچ عنوان فعال نشد و مجبور شدم از ابزارهای نصب درایور استفاده کنم. در کل واسه نصب درگیری زیادی داشت ولی بعدش به راحتی بازی های سنگین رو اجرا کرد با بالاترین کیفیت. 
