5,جتسش خیلی خوب بود
5,سلام ممنون از دیجی کالا کالای مورد نظر به دستم رسید . خیلی خیلی خوبه و توصیه میکنم بخرید و اینکه تو تخفیف گرفتم ارزشش رو داره ✨️✨️✨️
5,ممنون از دیجی کالا 
5,سلام واقعا عالی من تو تخفیف خریدم ک واقعا ارزشش رو داشت بسیار محکم سبک و خوشگل هست حتما پیشنهاد میکنم بخرین 
5,واقعا محصول خوب و با کیفیتی هستش
5,عالی
5,کیفیت و ظاهر خوب
5,کاور خوبی  تازه خریدم و راضی ام 
4,در کل قاب خوبیه پیشنهاد میکنم 
5,معمولیه ولی خیلی شیک و خوشدسته
5,یکی از بهترین گزینه هاست چون این کاور نه کثیف میشه نه خراب میشه خیلی عالیه بنظرم هم زیباست هم محکم هم مقاوم خیلی راضیم خیلی جنس خوب و با کیفیتی داره بخوبی گوشیمو کاور میکنه و تو دست خیلی راحته. توصیه میکنم. و عکس هم میزارم.
5,من راضییم اثلا نه کسیف شد نه خراب شد توصیه میکنم بخرید
1,خیلی بد بود احتمالا قاب دیگه ای ارسال شده بود
3,خیلی گرون نسبت به کیفیت کالا...
5,جنس و کیفیتش خیلی خوبه. امیدوارم فقط به مرور زمان رنگش نره. من تو تخفیف گرفتم و با اون قیمت ارزش خرید بالایی داشت
3,در کل عالی بود
5,از نظر کیفیت و تو دست قرار گرفتم عالیه
5,عالی . زیبا
4,کیفیت خوبی دارد
5,"کاور با کیفیت و مقاوم و منعطفی به نظر می رسد  و ابعاد ان دقیق و درست طراحی شده است شباهتش هم کاملا دقیق مثل عکس سایت بود وبسیار محکم و مقاوم در مقابل ضربات درکل جنس خوبی هست توصیه میکنم"
5,ایقدر کیفیتش و سایزش عالی بود همین که انداختم رو گوشی فیت فیت شد و هم شبیه عکسش بود بسیار زیبا و قشنگ
5,"خیلی خوبه با این قیمت. خیلی تمیزه جنسشم خیلی خوبه محکم هست  قیمتش هم خیلی مناسب قسمت داخلی قابم یه لایه مخملی داره واسه محافظت"
5,منو شوهرم از همینو سفارش دادیم وقتی رسید دستمون راضی بودیم
