3,رنگ گوشه های کاور میره
5,ارزش خریدن داره
5,عالی چنسشم خبوه بخرید شک نکنید با ۳۰۰ تومن والا بیرون عمرا کاور بدن
5,با کیفیت 
5,نسبت به قيمت عالي
5,کاور خوبیه بسیار عالی و با کیفیت قیمتش هم مناسب جنسش هم بسیار مقاوم و با دوام پیشنهاد میکنم. رنگ بسیار جذاب داخلش لایه مخمل برای خش نیفتادن به پشت گوشی. من دوتا رنگشو گرفتم واقعا خوبه. و عکساشو هم میزارم..
5,خوش دست و با کیفیت و لک دست روش نمیمونه قیمتش هم که عالی. قبلا یکی ازش خریده بودم الان دوباره خریدم و بازم همون کیفیت بود خدایشش بسیار عالیه توصیه میکنم
5,"من که میگم در خریدش شک نکنید قیمتش عالیه ابعاد خوب برای گوشی. عالی وبا کیفیت توسیه میکنم خرید کنید"
5,خیلی کاور خوب و قشنگیه جنسش فوق العاده است محافظ خوبیم هست دوسش دارم و بهتون پشناد میکنم.....
