5,خیلی خوبه
5,عالی
5,خیلی خوبه و قدرت خنک کنندگیش عالیه 
5,قوی و سبک
1,"جنس متفاوت میفرستن !!!!!! مانیتور تنظیم دور فن نداره  بی احترامی به خریدار هست"
5,سلام من اینو الان یه هفته خریدم اوکیه ولی مانیتوری که توی عکسای دیجی کالا بود رو نداره
1,وقتی کالای که دستم میرسه با عکس‌ فرق داره از هزارتا فحش بدتره… یه محصول ارزون قیمت‌تر رو به جای چیزی که تو عکس هست فرستادن. تو عکس صحفه نمایش سرعت فن داره ولی این نداره. نوشته نور RGB ولی این نور تک رنگ هست هر قسمت که تغییر نمیکنه.
5,من اینو برای تبلت خریدم و خیلی هم عالی داره کار میکنه.
