5,"اگه خانم هستین رنگ قرمز رو بگیرین فک میکنم خوشگل‌تر باشه  من مشکی گرفتم خیلی دوسش ندارم برای آقایون مناسب تره ولی جنسش خوبه"
5,"واقعا جنس خوبیه چند ماه میشه دارمش هنوز هم کدوم مشکلی براش پیش نیومده بسیار عالیه و هم بسیار با کیفیته جنس شفافیت بالایی داره . و دارای دو کاربردی متفاوتی هست و هم محافظت کلی برای گوشیه . من رنگ قرمزشو خرید کرده بودم انقدر جنسش خوب بود و الان هم رنگ مشکیشو خریدم حرف نداره پیشنهاد میکنم. و عکس هم میزارم ."
5,قاب بسیار عالی و درجه یکی هستش. جنس و کیفیت
5,طراحی بسیار جذاب عالی بسیار با کیفیت قیمتش هم بسیار مناسب بسیار محکم و مقاومت دارد در مقابل ضربه بسیار نرم و سبک و هم نرم لطیف سایزش کاملا فیت گوشی و شباهتش هم دقیقا مثل خود عکسش واقعا ازش خرید زو داره پیشنهاد میکنمممم.......
5,دو رنگ متفاوت ، زیبا که این قاب و کامل کرده جذابیت بالا کیفیت عالی
