3,برای کارهای دم دستی خوبه فقط رمش پایینه
4,زیباست و قدرت خوبی داره
5,درکل انتظاراتمو رفع کرد
5,لپ  تاپ خوبیه از نسل ۱۲ اینتل هم قوی تره چون سری رایزن گرافیک داخلی قوی دارن
1,"با توجه به اینکه از جدید ترین نسل سی پی یو های AMD استفاده میکنه با حداقل استفاده از باتری قدرت قابل قبولی رو ارایه میکنه  اگر مصرف کم باتری براتون مهمه گزینه خوبیه ولی چون فقط ۴ گیگ رم داره و ideapad 1 رم آنبورد داره و قابلیت ارتقا نداره برای ویندوز رم کم میاد ولی اگر قصد داشته باشید برای لینوکس استفاده کنید فکر میکنم گزینه مناسبی باشه"
5,از نظر سرعت بی نظیر هست در این رنج و cpuچهار هسته‌ای دارد ولی صفحه نمایش بهتری می شده تو این رنج پیدا کرد ولی خب cpuضعیف تر میشه
