4,"برام مهم بود کیف شل و ول نباشه و خدارو شکر این طور نبود  عکسی که آپلود شده کیف خالیه اگه یه مقدار پر باشه احتمالا خوش فرم تر هم میشه"
5,"نسبت به قیمت و اطمینان از کیفیت بهتون پیشنهاد میکنم کارت اورجینال هم روش بود کابل هم داشت  خلاصه همه چیز تمام"
4,خوب بود خوب بود
5,کیفیت کار مناسب بودبرای سیم هدفون یک محفضه درست شده بود توی کیف . عرق گیر خوبی داره پشتش . کیفیتش مناسبه جای لب تاپ بنظرم اگه کمی ضخیم تر بود مناسب تر بود درکل عالی بود مرسی
4,به نسبت قیمتهای این روزها خوب و قابل قبوله. برای هدیه گرفتم، راضی کننده بود
5,کیفیت عالی.  
