4,من این مک‌بوک رو چندماه پیش از دیجیکالا خریدم. دستگاه با بسته‌بندی خوب و مطمئن دستم رسید و کاملا پلمپ بود. جعبه خود مک‌بوک هم تمیز بود، گرچه گوشه‌هاش کمی له شده بود. پارت نامبر LLA و کیبورد us و نات اکتیو بود. اما اون رو با ضرر فروختم! چرا؟ به دلیل سایز کوچک. سایز ۱۴ کوچک هست و خرید اون اشتباه هست، مگر جابه‌جایی بسیار زیادی داشته باشید و توانایی بدنی کم. سایز ۱۶ بهترین انتخاب هست و اتفاقا برعکس تصور سبک و خوش‌دست هست و وزن و سایزش از لپتاپ‌های ویندوزی ۱۵ اینچ کمتر هست. حتی اگر جابه‌جایی دارید یا با ماشین تردد میکنید ۱۶ اینچ بگیرید و اشتباه من را نکنید. این موضوع رو هرکسی به شما نمیگه. خرید سایز ۱۴ هیچ توجیه اقتصادی نداره.
5,خیلی قدرتمند و ظریف ساخته شده ک وزنش رو میاره پایین و حمل و نقلش راحته
5,لپ تاپ فوق العاده ای هست
5,"این لپتاپ عالی هست  من به عنوان یک برنامه نویس ios بهترین لپتاپ هست  من از بیرون خریدم  وبه شما پیشنهاد میکنم"
