5,تنوع رنگ بندی داشته باشد تخفیف داشته باشد قسطی هم قابل خرید باشد 
5,درست تو مشخصات ذکر شده بود
4,کاربری مطابق با سخت افزارشه هرکسی باید با استفاده ای که از آن دارد با مشخصات آن تطبیق بده
1,"متاسفانه لپ تاپ توسط فروشنده ها کاستوم شده که قید نشده، قیمت پایه با کانفیگ ۴گیگ رم و ۲۵۶ گیگ ssd حدود ۱۴/۵۰۰ میلیون هستش، و قیمت رم ۴ گیگ حدود ۸۰۰ تومن، قیمت این لپ تاپ حداقل ۱ میلیون بیشتره،  نکته دوم و خیلی مهم، من از دیجی کالا خرید کردم و کالا با بسته بندی بسیار ضعیف ارسال شد، از فروشنده والالند، وقتی به دستم رسید و متوجه کاستوم بودن لپ تاپ شدم درخواست مرجوعی را ثبت کردم، که بعد از چهار روز زنگ و پیگیری مداوم و بیش از ۱۰۰ بار تماس منجر به دریافت کد مرجوعی شدم بعد از دردسر فراوان کالا برای دیجی کالا ارسال شد بعد از ارسال برای دیجی ۸روز زمان برد بازگشت وجه، اونم با ۱۰۰۰ تا تماس و پبگیری، کل زمان خرید تا بازگشت وجه ۲۲روز زمان برد!!! دیجی کالا به امکان بازگشت وجه قدرت داشت، الان عملا دیگه خرید از دیجی کالا فایده نداره،"
4,خوبه 
5,نسبت به قیمت خوبه
4,سیستم خوبیه نسبت به قیمت
4,باتشکرازدیجی کالا
5,من سورمه ایشو گرفتم خیلی خشگله و از کارایشم راضیم کاراییشم خوبه و مشگلی نداره
