5,"این دستگاه خوبی هست  ولی متاسفانه از فروشنده والالند خرید کردم  کیف اورجینال لنوو رو از داخلش برداشته بودن  یک کیف بی کیفیت داخلش گذاشته بودن"
4,"اگه پورت لن و بدنه مات براتون مهمه این بهترین انتخابه، در غیر اینصورت slim 3 نسل ۱۳ بگیرید که با همین قیمت سرعت بالا و مصرف باتری کمتری داره. در ضمن برای اضافه کردن هارد ssd به کابل فلت مخصوص نیاز داره که اکه گیر بیاد حدود ۳۰۰ باید هزینه کنید. من هر دو مدل رو خریدم اما این یکی بیشتر بکارم میاد. البته یه رم ۸ از لپ تاپ قدیمیم برداشتم که سرعتش ۲۴۰۰ بود، گذاشتم روش. الان با رم ۱۲ کارکرد خوبی بهم میده"
3,برای خرید کمی دقت کنید لپ تاپ کار راه اندازی نیست 
5,در کل با این قیمت بهترین انتخواب هستش
5,عالی بود اولش شک داشتم چون هیچ نظری نداشت چون cpu نسل 12 هست عالی و پور قدرت
