5,"عالیه من قبلا یکی خریدم الان بازم سفارش دادم"
1,"بردم بیرون نشون دادم گفتن قبلا استفاده شده و برای همین غیراصل فروختن  دیدم جعبه درست و حسابی نداره شک کردم متاسفانه مرجوعی قبول نکردن  من دیگه خریدم ولی درست نیست اینجوری جنس بنجل میفرستن درسته مثل شما مهندس نیستیم خانه داریم ولی خدا داریم"
5,هم سرعتش خوبه و هم اینکه به دلیل اینکه تقسیم کردن فضای هارد رو خیلی خوب و کاربردی شده
5,"ممنون از دیجی کلا  سالم و با بسته بندی کامل بدستم رسید"
5,این محصول دو عدد هارد اکسترنال 500گیگ می باشد که برای ذخیره اطلاعات بسیار مناسب هست و به جهت اینکه میتوانید در دو عدد هارد ذخیره کنید از یک عدد هارد مطمئن تر میباشد.
