5,من برای خرید این کارت تمامی بنچمارک های کارتهای 3060 و 3060ti و 3070 رو بررسی کردم و با توجه به قیمت بهترین انتخاب هست
5,رازی هستم از خریدم و چون نسل جدید هست پک کامل و پلمپ دستم رسید که خیالم راحت هست باهاش ماین نشده.
5,عالیی
4,میتونید با این قیمت برید سراغ مدلالی قویتر نسل قبلیش
5,سری چهار هزار نسبت به سه هزار مصرف برق کمتری دارن و حرارت کمتری تولید میکنن. در کل نسبت به پولی که میدین عملکرد بی نظری داره در همه زمینه ها
5,ارزش خریدش از 3060 بالاتره در حال حاضر و تا حدودی هم قویتره تو گیم و جدیدتر و هم قیمت هم هستن تقریبا
