5,درکل مانیتور خوبیه و تنها ضعیفی که داره نداشتن تنظیم ارتفاع و نداشتن اسپیکر هست که اونم از نظر من توی صفحه نمایش جبران شده .
4,سلام خدمت دوستان گل . برای استفاده معمولی و روزمره مناسب هست . برای گیم هم تنظیمات داره که تا حدودی مناسب میشه واسه بازی . کلا یک دکمه داره واسه انجام همه کار ها که کیفیت خیلی جالبی نداره و میترسم فنر داخلش جدا شه . در کل راضی کننده هست .
4,۳سال گارانتی داره ولی نه کارت گارانتی موجوده نه هیچی،اصلا معلوم نیست گارانتیش کجا ثبت شده
5,کیفیتش خیلی خوبه. میشه پایه خودش رو جدا کرد و با پایه مهصوص به دیوار متصل کرد
5,باتوجه به قیمت خرید خوبیه ، من مدل VA رو هم استفاده کردم ، بغیر از استایل و ظرافتش تفاوت دیگه ای نداره ، برای گیم هم خوب هستش ولی نکته منفی مانیتورهای ۲۷ اینچ و FHD اینه که در فاصله نزدیک پیکسل ها مشخص هستند که البته طبیعی هستش
5,فوق العاده 
