4, قیمت بسیار  مناسب درشگفت انگیز
5,عالی عالی عالی
4,"گارانتی مال من یک ساله است عکس تست سرعت رو میذارم . ویندور هم روش نصب کردن سرعت سیستم عالی شد یکم قیمتش بالاست تو شگفت انگیز واقعا ارزش خرید داشت"
5,"بسیار راضی هستم برای ی سیستم ساتا ۲ گرفتم ک واقعا سرعت خوبی داره با توجه ب قدیمی بودن ساتا 2...."
5,"اندازش مناسبه بدنه بسیار محکم و با کیفیتی داره من چندین بار تا حالا از دستم افتاده ولی اتفاقی براش نیفتاده با اطمینان به گارانتی مادام العمرش خریداری کردم"
5,"سرعت لپ تاپمو خیلی بالا برده  قیمتش واقعا مناسب بود و گارانتی هم داشت  در کل از کیفیت کالا خیلی راضی بودم"
5,سرعت انتقال اطلاعاتش خیلی بالا بود و بسیار محصول با کیفیت و خوش ساختاریه
5,مناسب نسبت به مدلهای مشابه
4,گارانتی خوب بود
