2,خیلی زود پوست پوست شد.انتظار نداشتم
4,کمی لبه هاش دستو اذیت میکنه ولی در کل خوبه
4,بعد از ۲ سال میپوسه ولی جنس خوبی داره و اندازه بزرگی داره
4,کیفیتش بد نیست. من یکبار هم شستمش اما در جنسش تغییری ایجاد نشد.
3,زود پرز می شود
5,راضی
5,تو این رنج قیمت یه چیز باکیفیت هستش
5,عالی 
3,بعد از چند ماه پوسته پوسته میشه  در حدی که دیگه قابل استفاده نیست 
5,خوبه
5,چند وقتی هست دارم ازش استفاده میکنم، خیلی راحت موس روش سر میخوره و روانه. اینقدری هم بزرگ هست که حتی میتونید 2 تا موس روش بزارید و کار کنید باهاش
4,اندازش همون چیزی بود که میخواستم راحت با دوتا ماوس کار میکنم بدون اینکه مشکل کمبود جا واسه ماوس داشته باشم 
5,عالیه پیشنهاد میکنم
5,عالی
5,عالیه هنوز بعد از ۳ سال دارمش
5,من كاملأ راضي هستم از خريدم
3,بعد از یه مدت خراب میشه ولی سایز خوبی داره
1,بده
5,بهترین پد موس
5,کیفیتش خوبه و سایزش هم دیگه حرفی واسه گفتن نمیذاره
4,قیمتش عالیه و مثل عکسش زیبا و با کیفیته 
4,من برای گیمنتم گرفتم خوبه
5,خیلی خوبه راضیم
5,واقعا راضی هستم
5,واقعا خوبه و بزرگ و جنسش یک حس خوب میده
5,عالیه واقعا پیشنهاد میکنم
1,موس پد تسکو نسبت به قیمت خوب هستش.
5,عالی از همه لحاظ هم بزرگ و جاداره هم نرم و راحت موس روش حرکت میکنه در کل عالی
5,خوبهه فضاش زیاده
5,عالی
3,"این موس پد رو فکر میکنم 4 سال پیش گرفتم. این موس پد برای کسایی که حرفه شوتر بازی میکنن و نمیخوان خیلی خرج کنن پیشنهاد میشه ولی خیلی زود موس پد کند میشه.خود موس پد نرم هست و هنگام بازی کردن اصلا تکون نمیخوره.اما مشکل بزرگی که موس پد تسکو داره این هست که بعد از یه مدت استفاده زیر موس پد به میزتون میچسبه و از خود موس پد کنده میشه و یه افتضاح به بار میاره و این تجربه رو 3 تا از دوستان دیگه هم داشتن و همه ما از فروشگاه های مختلف موس پد تسکو رو تهیه کردیم. موفق باشید"
5,خوب بود
5,عالیه مثل محصولات دیگه تسکو اینم عالیه
5,با کیفیت  زیبا کاربردی
5,انتخاب اول واسه یک گیمر حرفه ای
4,کیفیت و اندازه خوبی داره واقعا رضایت بخشه
3,مطمین نیستم
3,کیفیت ساخت کاملا معمولی
5,بد نبود
5,قیمت و سایز مناسب
5,حرف نداره
3,بنظرم معمولیه کاشکی طرح های بهتری روش میزاشتن اندازش خوب بود
5,جنسش خوب بود ولی من در انتخاب اشتباه کردم 
5,جنسش خوبه پیشنهاد میکنم
4,موس بد خوبیه ولی ابعادش اصلا خوب نیس واسه موس اگر فقط باشه خیلی بزرگه کوچک تر هم میشه خرید جنس خوبی داشت
5,بسیار راضیم از این خریدم
5,جنس عالی بود و کاربردی 
5,عالی بود  بزرگ بود و مناسب برای بازی هست 
4,باعث میشه راحت از موس استفاده کنم
5,موس پد مناسبیه واسه گیم و ادیت پیشنهاد میشه
5,زیبا ، جنس فوق‌العاده عالی، 
5,دوخت و همچیش عالی بود بر خلاف بعضی از نظر ها . یک سال است که دارمش و برای گیم های فورتنایت و .... استفاده میکنم که یکی از بهتریناس
5,بزرگ و با کیفیت و بدون بو
4,موس پد خوبیه راضیم 
2,اگر بودجه کمی برای این کالا می گذارید این گزینه از کالاهای فیک بهتره
5,بسیار کارآمد 
5,من راضیم. خیلی باکیفیت هستش، برای گیمر واقعا عالیه و اندازس.
3,برای یکی از دوستان خریدم. خیلی راضی بود از جنس و راحتی حرکت موس و اندازه‌ی بزرگش
5,عالی از همه نظر
5,اندازش خیلی بزرگه و برای روی میز مناسبه....کیفیتشم نسبت به قیمتش خوبه واقعا
5,نسبت به ماوس پدهای خارجی که خیلی گرونن هم کیفیت خوبی داره و هم قیمت مناسبی  نسبت به مبلغی که میدین ارزش داره واقعا
4,چند ماه هست استفاده می کنم، خوب بوده. مخصوصا برای موس من که برعکس گفته شرکت A4Tech باید روی همه سطوح خوب کار کنه، روی سطح میز و ... اصلا کار نمی کنه. روی پد قبلی هم خوب کار نمی کرد ولی با این مشکلی ندارم .
4,جنس خوب و صفحه بزرگ
5,متاسفانه دور دوخت نیست ولی روونه سطحش
5,فقط باید دوتا بگیرید بهتره
5,خوبه راضی هستم.
4,نسبت به موس پد های قبلیم این خیلی دقیق تر و بهتر بود 
3,پد خوبیه به راحتی چند سال میشه از استفاده کرد
4,کیفیت خوب از نظر گیم
4,خیلی خوب و روانه این دومیه که میگیرم
5,درود دوستان، خیلی وقت بود دنبال موس پد میگشتم و هم از نظر راحتی حرکت موس و جنسش واقعا راضیم.
3,خوبه من 35 خریده بودم 
5,بسیار عالی
5,عالی
4,در کل بزرگ و خوبه  واسه کسایی که با سنس پایین بازی میکنن خیلی جوابه
5,هنوز بعد ۶ سال دارمش
5,برای گیم و طراحی عالیه.
5,بعد چند ماه پوست پوست میشه
5,با در نظر گرفتن قیمت میشه گفت بهترین گزینه ست. الان دقیقا ۱ سال و ۱ ماه هست که ازش استفاده میکنم ، درسته که اول تا اخر رنگش کم میشه و پوست پوست میشه ولی تو این یک سال خیلی شدتش کم بوده.
4,در حد پد های خوب گیمینگ خارجی هست با قیمت بهتر
5,خوبه
4,موس پد خوبی است و به راحتی موس روی آن حرکت می کند
4,جنس و سایز مناسب مثل سایت بود ولی وسط پد جای تاشدگی قدیمی داشت که روی عملکرد موس تاثیر میذاره مخصوصا تو بازی ها
4,با کیفیت و اندازه خوب
3,کار راه اندازه
5,درکل محصولات تسکو خوبن
5,نسبت به قیمت کاملا پیشنهاد میشه
4,در کل خوبه
4,به نسبته قیمتش خوبه.
4,خوبه به نسبت قیمت
3,زود کثیف میشه. نمیشه شستش
4,خوب
5,انازع خوبی داره و جنسشم با توجه به قیمتش نسبتا خوبه
4,خوب بود
5,از همه نظر عالی بود
5,نسبت به قیمت فوق العادس
4,بسیار عالی برای گیم
5,بزرگ و کاربردی
5,عالی
5,بزرگ و راحت
