5,خوبه
5,خوب بود
5,کیفیت ساخت و سرعتش عالیع
4,خوبه ولی اندازه اش کوچیکه
5,عالی برای ظبط ماشین خوبه به خصوص پایونر
3,کیفیت خوبی داره بد نیست جنس بدنه ضد ضربه هستش و فکر کنم ضدآب هم باشه
5,بسیار عالی
4,عالی و زیبا 
4,تنها مشکل فلشش اینه که USB2 هستش و من متاسفانه به این دقت نکرده بودم و سرعتش با فلش قبلیم که عین همین بود ولی USB3 بودش خیلی فرق میکنه
5,فلش خوبیه من راضی بودم از خریدم
4,به نظر من ارزش خرید بالایی دارد.
5,قشنگه
3,ممنون از دیجی کالا 
5,عالی بود .یه مدل دیگه هم سفارش داده بود متاسفانه بعد ۴ روز اونو کنسل کردن ومبلغ عودت .بنظرم کارزیبایی نیس
5,دوستان در یک کلام میگم واقعاً عالیه ب خصوص این مدلش که خیلیم با نمکه
4,رو حساب خریدهای قبل سفارش دادم سیلیکون پاور برند خوبیه 
4,خوبه ولی یکم قیمت فلش بالاست. اون مغز فندقی که به زنجیرش وصله برای اینه که درش رو بهش وصل کنی گم نشه. دربش گم بشه دیگه ضد آب نیست.
4,یه فلش زیبا
5,بسیار اقتصادی و با کیفیت است
5,برند سیلیکون پاور نیاز به تعریف نداره
5,عالی بود
5,عالی کوچک سبک نسبتا سریع
4,خوب بود
5,خوبه عالیه نسبت به قیمت
1,جنس بسیار بد، من کادو دادم و بعدا شنیدم کمتر از یک هفته خراب شده
5,خیلی عالی و کاربردی با قیمت مناسب و عالی
5,شک نکنید بهترینه ،من کارم همینه ممنون از دیجی کالا
5,خوبه توصیه میکنم
5,خیلی راضی ام
5,برای ماشین خریدم، طراحی جذاب، سایز مناسب فقط برای ضبط ماشین که بتونه بخونه یه سری تغییرات باید قبل ریختن آهنگ روش بدین وگرنه نمیخونه، فکر نکنید خرابه
5,همه جوره عالی بود
4,سیلیکون پاور نیازی به تعریف نداره واسه پخش ماشین گرفتم 
3,حالا  برای من براش ایرادی پیش اومد و خراب شد که نمی دونم مشکل  از من هست یا از فلش
4,خیلی زیبا و خوشبختانه سالم بود 
5,این فلش زیبا و خیلی بادوامه
5,کیفیت خوبی داره و سالم بود و رنگ مطابق تصویر
4,خیلی کوچیک نیست. من دنبال خیلی کوچیک بودم برای ضبط ماشین
4,خوب بود
4,بالا بودن هزینه ارسال کالاها موجب میشه که مثل گذشته اشتیاق به خرید نباشه و واقعا حیفه که برای همچین مجموعه موفقی این مورد باعث عدم خرید مشتری بشه حتی اگر کالای مورد نظر و نیازش تو دیجی کالا موجود باشه.
5,خیلی خوب و عالی بود تشکر از دیجی کالا که از تامین کنندگان خوب استفاده میکنه  شک نکنید بخرید واقعاً عالیه
5,"خیلی عالی هست خیلی دوشتش دارم   فقط یکم سفت درمیاد ."
5,سرعت و همه چیزش خوبه
1,سلام قبلاً از این مارک داشتم دوباره گرفتم البته ایندفعه این طرحش رو یه ۳۲ و ۱۶ فقط رنگش رو جابجا فرستادند 
4,برا دوستم سفارش دادم راضی بود ازش
4,سیلیکون پاور از برند های عالی هستش. من ۱۶ گیگش رو سفارش دادم، ولی تو لپ تاپ ۱۴ گیگ نشون میده
4,تازه به دستم رسیده هنوز استفاده نکردم ولی از لحاظ ظاهری قشنگه و با عکس مطابقت داره و باکیفیته
4,فلش ریز و جمع و جور و خوش دستیه.  و گارانتی معتبری داره. 
4,کیفیت خوب 
5,این مارک خیلی‌ خوب‌ و معتبره .. گارانتیشم خوبه
4,خوب و مناسب
4,رنگش قشنگه سایزشم خوبه فقط کمی تو انتقال اطلاعات سرعتش پایینه
5,یکی از زیباترین فلش های سیلیکون پاور
5,همجوره عاااالی و سخت جان. چون usb3 نیست سرعتش یکم کمه وگرنه همه چیزززش عاااالیه
4,فلش مموری با سرعت خوب و کوچک مناسب ماشین
4,بسیار عالی سرعت خیلی خوبی داره
5,عالییییییییی
4,فلش زیبا و کم حجم
4,احتیاج به تعریف نداره
5,خیلی خوبه.  
4,طراحی جالبی داره و جنسش خیلی خوبه
4,زیباترین فلشی که میشه خرید
5,همون چیزی بود که توی عکس هست. من راضی بودم. 
1,این فلش وقتی به دستم رسید ۲۰ مرتبه امتحان کردم .حافطه نداشت .کلا خراب بود
5,برای ضبط ماشین عالی است
4,من آبی گرفتم. یو اس بی ۲ هست و قاعدتا پرسرعت نیست. من یو اس بی ۳ میخواستم و نمیدونم چرا آخرش اینو گرفتم. نسبت به قیمت راضی کننده اس
5,کاربردی. طراحی زیبا. انداره مناسب
5,عالی سرعت قدرت
4,همجوره عاااالی و سسسسگ جونه این فلش. سرعتش یکم کمه که من برای افرادی که سرعت بالا دوست دارن، فلش های sandisk رو پیشنهاد میکنم.
3,من برای ظبط ماشین گرفتم وخیلی راضیم
2.8,خوبه .کار راه انداز
4,مثل اکثر محصولات سیلیکون پاور خوبه 
5,عالی یعنیپیشنهاد میکنم من برای خواهرم خریدم عالی بود
5,حتما بخرید 
4,برای هدیه سفارش دادم. به نظرم خوب بود
5,خوب بود مرسی 
4,خوب و زیبا و بامزه
0,خیلی راضیم
5,عالیه تاحالا دوتا ازش خریدم.
5,فلش بسیار قشنگ و با مزه من که خیلی حال کردم صد در صد راضی هستم دمتون گرم از بچهای دیجی کالا
0,راضی کنندس 
4.9,خیلی خوشگله ممنون از دیجی کالا
5,یکساله استفاده میکنم و از خریدش راضیم
5,مناسب برای خودرو
2.4,"مزخرف ترین فلشی که تو عمرم خریدم.به پخ ماشین که میزنی بعد از هر بار خاموش و روشن کردن ماشین فلش شناسایی نمیشه.به ریسور زدم دفعه بعد که زدم کلا فرمت شد در کل اشغال محضه"
5,زیبا  و جنس خوب 
4,"خیلی خوشگله فعلاً که خوبه انشاءالله کارکردش هم در دراز مدت خوب باشه. اما الان دوماه نشده خریدم روی هیچ دستگاهی شناسایی نمیشه موندم چیکار کنم"
5,عالیه خوبه بنظر  
4,خوب بود. ممنون از دیجی کالا
5,کیفیت و سرعت انتقال اطلاعات عالی. ممنون از تولیدکننده و تمامی عوامل دیجی کالا
5,عاااالی بود و سرعت خوبی داشت، من رنگ برنز رو گرفتم که زیبا بود، در کل راضی هستم
5,با سلام من سفارش دادم کارتون اون خیلی داغون بود و کیفیت  خوبی برخوردار نبود ولی خود کالا آکبند بود و بسیار توصیه میکنم بخرید خوب هست ارزش پولی رو که میدید رو داره
5,قیمتش از بازار پایین تره و خوبه
4,خوب و بدرد بخور
5,فلش خوبیه هر چقدرم به زمین برخورد کنه هیچیش نمیشه الان ۲ ساله دارم سرعتش یه کوچولو هم افت نکرده
4,فلش خوبیه ،  کوچیکه واسه ماشین خیلی خوبه
3,"از بیرون ارزون تر بود کیفیت فلش های سیلیکون عالیه"
2.8,الان نزدیک ۳ ماهه خریدم تو این ۳ماه نزدیک به ۴ دفعه مجبور شدم فرمتش کنم واسه تو ماشین گرفته بودم یه مدت که میگذشت دیگه پخش نمیکرد به لپ تاپ میزدم باز نمیکرد مجبور بودم فرمت کنم.
5,ممنون از دیجی کالا 
4.4,فلش با کیفیتی همیشه میخرم راضی هستم 
3,من قبلا یکی از این مدل را داشتم این را برای هدیه خریذم عالی بود ارسال زمان مناسب بدستم رسید
