3,خیلی داغ میشه
5,عالی
1,خوب نیست .توصیه نمیکنم 
5,خرید عالی ولی کاش یه بند میزاشتن براش
3,حیف حافظش ۵۶ گیگه تقریبا و اینکه باتوجه به اینکه فلزیه اسرانگشت سریع روش میفته و براقیتش کم میشه
3,این برند همیشه خوب بوده
5,عالی بود
2,مدت گارانتی روی محصول نوشته پنج سال و در سایت شرکت گارانتی نوشته مادام العمر به معنای تا هنگام تولید آن محصول توسط شرکت سازنده می باشد و وقتی شماره سریال محصول را استعلام گارانتی در سایت می زنی می نویسد بدون گارانتی و کیفیت فلش هم جنس خشک و بی کیفیت و میزان حافظه پنجاه و هفت گیگ قابل استفاده است و در کل جالب نبود .
4,بد نیست
5,خیلی خوب بود دوباره منتظر تخفیفم سفارش بدم
5,"عالیهههه. من مشکیشو گرفتم. ای دیتا حرف نداره."
1,"سرعت انتقال به فلش بطور میانگین ۱۰ مگ بر ثانیه هست(با نوسان خیلی زیاد) و بیشترین سرعتی که من دیدم ۱۷ مگ بود سرعت خوندن از فلش هم به طور متوسط ۳۰ مگ هست و نوسان کمی داره اگه سرعت و داغ نشدن براتون مهمه این فلش رو نخرید."
4,سرعت انتقالش خوبه
5,کیفیتش عالیه ۵سال گارانتی داره سرعتش عالیه
4,هنوز دارمش ولی چون سرعتش خیلی کم شد زیاد استفاده نمیکنم ...بعد حدود دوسال دارم نظر مینویسم
5,بسیار عالی بود
5,دوتاشو باهم گرفتم .آخ نگفتن بعد یکسال . هر روزم استفاده می کنم.
5,ظاهر قشنگی داره و سرعتش هم خیلی خوبه
4,عالی 
5,"به طور کلی به نظرم برند خوبیه و اگر در خارج کردن فلش از دستگاه پس از استفاده، در کامپیوتر از Eject استفاده بشه و در پلیر ها دستگاه خاموش بشه، ماندگاری حافظه و اطلاعات را تضمین کردید. دمورد ظرفیت حافظه هم باید بگم که ظرفیت اسمی ۶۴ گیگ هست، اما ظرفیت قابل استفاده ۵۷.۷ گیگابایت هست، که در همه حافظه های ذخیره سازی و حتی حافظه موبایل ها هم این موضوع طبیعی است. در کل ارسال به موقع بسته بندی خوب، و راضی بودم"
4,در کل فلش خوب و مقاوم و با سرعت بالا
4,رو بسته بندی  سرعت3.2 درج شده ولی واقعی نیست
4,من تیتانیومی خواستم..مسکی برام فرستاده این تامین کننده......
5,فلش خوبیه همین که برندش معتبرِ کافیه
5,همیشه همین مارک میگیرم ضمانت مادام العمر
4,خوبه محکم و سرعت خوبی داره دو،باره سفارش میدم
5,من تز خرید راضی بودم ،کیفیت ساختشم خوب بود
3,بعد از یه سال استفاده این نتیجه اش بود
5,"فلش خوبیه واسه چنتدا از دوستان هم سفارش دادم همشون راضین"
4,اینکه گارانتی مادام العمر داره خب خوبه  مشکل خاصی نداره 
5,خوب است 
4,فلش سرعتش بالاس/گارانتی مادام العمر داره/فقط عدم اتصال به گوشی اذیت کننده است
4,منلسبه
5,سرعت خیلی بالا و خیلی عالی داره خیلی هم خوشرنگ و زیباست ولی چون بدنه براق داره رد انگشت میمونه و چون تا لبه پورت یو اس بی همین نوع فلز و رنگ ادامه پیدا کرده بعد یه مدت استفاده رد پورت یو اس بی روی بدنش رو خط میندازه و ممکنه رنگ رو پاک کنه
5,"بنده این فلش رو در تاریخ ۱۴۰۲/۰۷/۳۰ خریداری کردم و سرعت کپی به فلش ۱۱ مگ و متغیره و سرعت کپی از فلش به سیستم ۳۰ مگ متغیره و فلش خوشگلیه و فقط و فقط بخاطره گارانتی خوبشه که فقط ای دیتا میخرم. ضمنا این محصول رو هر جوری امتحان کردم اصلا گرم و یا داغ نشد از حجمش هم ۵۷ گیگ رو نشون داد که طبیعیه. فلش بسوزه و یا ایرادی داشته باشه در جا بدون چون و چرا فورا تعویض میکنن گارانتی آونگ عالیییییه"
5,جنس پرسرعت عالیه
5,خیلی خوب بود 
5,محصولات ادیتا عالی هستش 
1,دوتا ازش سفارش دادم هر دو بعد از چند بار استفاده سوختن
4,سرعت خوبی دارد
4,فلش خوبیه ،سرعت انتقال اطلاعات مناسب و یکنواخت هست بدنه هم زیاد داغ نمیشه اندازه فلش جمع و جور هست و ریز نیست
2,من رنگ نقره ای سفارش داده بودم که قیمتش گرونتره ولی برام مشکی فرستادن که قیمتش هم کمتر از نقره ای هستش
5,۱ساله خریدمش و سرعتش عالیه
1,"سلام فریب بدنه فلزی فلش رو نخورید،کاملا فلش آشغالی هستش."
5,بهترین
3,ارزش خرید داره
5,بسیار خوب. به تلویزیون که وصل می‌کنیم همه فایل‌ها رو میخونه
3,"بعد از چند بار استفاده دیگه نشد ازش استفاده کنم... نه میشد چیزی داخلش ریخت نه پاک کرد ولی بردم گارانتی یکی دیگه بهم دادن که خوب کار میکنه"
5,جنسش خوب بود و نسبت به قیمت از همه لحاظ عالی بود
5,من که همجوره راضیم دیگه باید ببینید چی مد نظرتونه روی پخش ماشین هم به خوبی ساپورت کرد
2,"داخلش فیلم زدم و به ال سی دی که وصل کردم هنگام پخش مشکلی نداشت ولی وقتی فیلم رو جلو یا عقب میزدم هنگ میکرد الان هم دیگه بالا نمیاد و زمان فیلم که مثلاً دو ساعت نیم هست بعد دو ساعت رو نشون نمیداد و قطع میشد و از فیلم خارج میشد نمی‌دونم شاید اینکه برای من فرستادن این مشکل فنی رو داره خودم شهرستان هستم فروشنده گفته گارانتی فقط در تهران هست  با تشکر از دیجی کالا"
3,با اینکه USB3 هست اما سرعتش جالب نیس
4,نسبتا خوب هست در بین گزینه های موجود
4,با توجه به قیمت خوبه...و ظاهر زیبایی داره.
4,برای هدیه گرفتم خوبه ولی یکم سرعتش پایینه که چون زیاد نیست پیشنهاد میکنم
5,راضی ام هیچ مشکلی نداره سرعت خوبی هم داره    بخرید
5,جنس محکم و سرعت خوبی دارد
5,این‌مارک عالیه
5,کلا فلش های Adata خوبن
3,نسبت به قیمتش بد نیست ولی خیلی نوسان سرعت داره و خیلی داغ میکنه 
4,انصافا فلش های adata با گارانتی اونگ خوبه
1,سرعتش خیلی پایین و شدیدا نوسان داره در سرعت پیشنهاد میکنم سن دیسک بخرید جدیدا ای دیتا مثل قبل نیست
4,یه فلش عمری
5,سرعت خوبی داره ، از خریدم راضیم  
5,ای دیتا حرف نداره  سرعتش خوبه
3,با چند تا پورت usb 3.1 و usb3.2 امتحان کردم و سرعت انتقال متوسط داره
5,فلش خوبیه نسبت به قیمت 
5,دارای سرعت مناسب (انتقال فیلم به روی فلش محدوده سرعت 30 مگابایت) و ظاهری زیبا. 
1,افتضاح
5,خوب وقیمتش مناسب بود
5,جنسش خوبه
4,جزو فلاشهای خوب محسوب میشه
5,عالی
1,بعداز ۸ ماه از کار افتاد مزخرف بود 
5,عالی بود
4,در خصوص ظاهرش فلش خودش دست و خوبیه ولی بخاطر بدنه‌ی استیلش خیلی زود داغ میشه و اثر انگشتم زیاد روش میمونه‌ درمورد سرعتشم بد نیست و قاعدتا متناسب با دستگاهتون سرعتش میتونه متغیر باشه ولی برای من حدودا همین ۱۲۰مگ برای انتقال از فلش به دستگاه و برای من نمیدونم چرا سرعتش برای انتقال از دستگاه (ssd) نوسان داشت و میانگین بین ۱۰ تا ۱۵ مگ بود
3,"من یه فلش patriot دارم مال فکر کنم ۷ سال پیشه شایدم بیشتر اون سرعت نوشتنش وقتی فایل رو میریزم داخلش ۳۰ تا ۴۰ مگابایت به صورت معمول. دیدن اون برند جایی دیگه نیست ۶۴‌گیگش این فلش رو گرفتم. الان دیدم سرعت نوشتن روش بین ۸ تا ۱۷ مگابایت هست. نوشته usb 3.2 آدم فکر میکنه از اون patriot ۷ سال پیش قطعا بهتره اما سرعتش واقعا خیلی خیلی معمولیه. فقط کمی از usb 2 بیشتر."
4,خوبه
4,خوب بود، فقط مشکل فلش های بدنه فلزی اینه هنگام اتصال به تلویزیون، بدنه فلش داغ میشه.
4,سرعت عالی در انتقال فایل ها
4,جنس بدنه خوب
4,خوبه بدک نیست
3,هم خیلی داغ شد موقع استفاده و تو همون روز اول دیگه برای سیستم قابل دسترسی نبود فرستادمش گارانتی آونگ! :(
5,عالیه جنس اصلی و اورجینال
4,خوب و با کیفیت
4,چندین ساله به صورت خانوادگی مشتری ای دیتا هستیم، پشتیبانی تا الان بسیار خوب بوده
4,خوبه بدک نبود       
2,خط و خش زیادی روش می‌افته از نظر فنی هم چندان قابل قبول نیست
4,با کیفیت و سرعت مناسب هست. سرعت انتقال بالایی نداره ولی راضی کننده هست
4,کیفیت خوب و قیمت مناسب
4,فلش ۶۴ گیگ هست و چون بالای ۳۲ گیگ هست برای متصل کردن بدون مشکل به tv باید با برنامه فرمتش رو fat32 بکنید درکل خوبه 
4,قیمت و ظاهر و کیفیتش خوبه فقط موقع استفاده داغ میکنه
5,سرعت مناسب و کیفیت خوب
5,سرعتش خوب بود
5,خیلی خوبه سرعت قابل قبولی داره 
4,سرعت انتقال داده بد نبود،ولی گارانتی مادام آونگ خیلی خوبه.
4,کیفیت مناسب و سرعت خوب
4,کیفیت راضی کننده بود
5,سلام، این فلش با توجه به این که usb3/2 هست ولی سرعت انتقال اطلاعاتش کم هست
4,در کل خوبه فقط یکم موقع استفاده داغ کرده بود
