5,چون نظرم را بیش از یکسال پس از خرید نوشتم میتونم بگم کیفیت و طول عمر عالی 
4,خوبه ولی قیمتها بسیار بالاست  
5,این دستگاه رو از دیجی کالا خریدم و هنگام استفاده داغ میکرد و صدا میداد، بردم گارانتی حامی و بعد از چند روز عوضش کردند، سپاس از بزرگواران در شرکت حامی بابت تعهد در ضمانت کالا.
5,هر کِی بخری بردی...
5,کیفیتش خوبه،سرعت انتقال اطلاعات با usb3 بین ۱۰۰تا ۱۲۰ مگه،،،
5,عالیه دقیقا چیزی بود که میخوام،مشکلمو حل کرد
4,خوبه
4,با توجه به قیمت های بالای بازار قابل قبول است
5,ممنون از دیجی کالا 
2,پیشنهاد میکنم
5,بهترین هارد ممکن
5,با سلام،لطفا موجود کنید.
5,از هر نظر عالی 
5,عالی
2,بسیار عالی و خوب
4,اگر ثابت نگهش دارید نسبت به قیمتش واقعا کارایی خوبی داره
1,به درد نخور
2,هنوز یکماه نشده خریدیمش بریا بک اپ گرفتن از کیس ها. بعد از بک اپ هم تو کمد قفل میشه و شاید جمعا 30 ساعت به سیستم وصل نبوده. از امروز وصل میکنیم بیت اتصال میده و تو دیوایس منیجیر نشونش میده ولی هاردش بالا نمیاد ! وقت گرفتیم ببریم سازگار ارقام برای گارانتی فعلا 
5,این هارد ظرفیت و سرعت خوبی داره . با این حجم بیشتر به درد آرشیو فیلم و سریال می خوره .
4,خوبه... قیمت فقط بنظرم باید چند درصدی پایین تر باشه
5,هم قیمت و هم کیفیت عالی خرید به دوستان پیشنهاد میکنم 
5,هارد عالی مناسب ارشیو اطلاعات هست و باید مراقب باشید چون سطح بالاش باز هست 
5,همه چیز عالی بود ممنون از عوامل دی جی کالا
4,یکی از بهترین ها 
5,در مجموع بسیار کار راه بنداز
5,هارد خوبیه
5,یک‌ترابایت لولو برد هارد ۷ترابایت ولی سرعت انتقال اتصالش خوبه با اینکه از وسترن خاطره بد دارم ولی دل زدم دریا دیگه
5,فوقالعاده 
5,موجودش کن که بدجور لازمش دارم
3,"در قسمت مشخصات فنی گفته سرعت انتقال داده ۵ گیگ بر ثانیه اما در بهترین حالت usb 3 نهایت سرعت به ۸۰ مگ بر ثانیه فایل ۳۸ گیگ با ۱۸۰۰۰ فولدر در ۳۵ دقیقه در usb 3 و فایل ۸۵۰ گیگ با ۲۱۰۰۰ فولدر در ۸ ساعت با سرعت ۲۷ مگ بر ثانیه در usb 2 که سرعتش نوسان هم دارد و این ها سرعت نهایی هستن  مشخصات فنی را اطلاح کنید"
5,راضی هستم ازش
5,من واقعا راضی بودم
5,خوب
5,دیجی کالا عالیه فقط مشگل زودرسوندن مرسوله داشت که اونم برطرف شده سریع می‌رسونن
4,صدا میده
4,کیفیت و کارایی مناسبی داره
5,خوب بود ممنون
3,سرعت انتقال اطلاعات کمه
3,"این یه هارد 3.5 اینچی 7200 دوره که به شما حجمی حدود 7.27 ترابایت میده. این هارد همون هارد داخل کیس هست که داخل یه داکت تبدیل جاسازی شده و به همراهش یک کابل USB 3.0 بطول یک متر و یک عدد آداپتور برق 12 ولت قرار داده شده. در حقیقت شما اگر یه هارد 3.5 اینج هم داشته باشید میتونین یه داکت تبدیل بخرین و همین کار رو بکنین. برای آرشیو خیلی عالیه. در مجموع کارراه بنداز و خوبه. چند نکته درباره وصل کردن و جدا کردن این هارد به سیستم کامپیوتری هست که باید رعایت بکنین: برای اتصال به سیستم : 1- یکسر کابل رو به سیستم بزنین 2-سر دیگه کابل رو به هارد متصل کنین 3- دوشاخه برق آداپتور به پریز برق بزنید 4- سوکت آداپتور رو به هارد متصل کنین. برای قطع اتصال هارد هم مراحل زیر رو برید: 1- اتصال نرم افزاری هارد رو در ویندوز یا سیستم عاملتون جدا کنین (Safely Remove Hardware) 2- کابل usb اتصال رو جدا کنین 3- سوکت آداپتور رو جدا کنین 4- دوشاخه آداپتور از پریز برق جدا کنین. این روش امن برای اتصال این مدل هارد اکسترنال پیشنهاد میشه"
5,"چون اداپتور داره سرعت بالا و دونوع تبدیل داخل پک فقط حتما پارتیشن بزنین تا اگر به tv زدین بشناسه"
4,عالی
3,نمی دونستم باید با شارژر استفاده بشه
5,فعلا مدت زیاد نیست خریدم
4,به موقع رسید
5,عالی و حرفه ای
5,من تازه خریدم بسته بندیش خوب بود خوب هم کار میکنه
5,عالی و زیبا و بی صدا
5,فوق العاده
5,راضی ام
2,"فرمت پیشفرض exFAT بود که به NTFS تغییر دادم. به نظرم اینطوری بهتره."
5,این دومین هاردیه که من خریدم فوق العاده راضیم جفتشو برای بازی پلی ۴ خریدم عالی کار میکنن
5,وسترن عالیه مخصوصا با گارانتی سازگار
4,خوب بود 
5,فوق العاده خوب و پرسرعت
1,لطفا زمان کد تخفیف را بیشتر کنید که بشود از آن استفاده کرد
5,عالی 
2,من دوتا خریدم  این قدر صدا با ضربه که زیاد بود که بردم نمایندگی گفتن رو پایه نزار به صورت افقی بزارش لرزشش کمتره ولی خب خیلی صدا میده و گرم میشه درکل سالم بود و مشکلی نداشت ولی خب برند دیگه ای هم نیست که با این حجم بخرین. ولی شرکت پشتیبانیش سازگار بیشتر شهر ها پشتیبانی دارن و خیلی سریع جواب دادن
5,عالی
5,هارد بسیار عالی و باکیفیت هستش و عمر بسیار خوبی داره من قبلا چندتا گرفتم و الان هم دو تا دیگه تهیه کردم 
4,خوب بود ولی قیمتش نسبت به بقیه بیشتر بود
5,"بخاطر ۷۲۰۰ دور بودنش سرعت بسیار بالایی داره و بخاطر آداپتور مجزا، برقی از usb دریافت نمیکنه و سرعت این هارد نسبت به هارد های بدون آداپتور بیشتره از نظر ظاهری هم زیبا و شیک میباشد و در کنار هارد نرم افزار خوبی برای مدیریت بک آپ و عیب یابی و امنیت وجود داره به طور کلی هارد بسیار عالی میباشد  و در آخر از دیجی کالا بخاطر تحویل زودتر از موعد انتخابی تشکر میکنم"
5,هارد 
5,از خریدش راضی هستم 
4,عالی
5,من سه سال هست که 6 ترابایت دارم خیلی راضی هستم ازش اینبار هم 8 خریدم . ممنونم از دستندرکاران دیجی کالا 
5,نسبت به قیمتش خوبه
5,عالیه
4,"دستگاه خوبیه ولی هدش یکم زیادی سر و صدا میکنه موقع فایل حجیم  من میخواستم این و برای انتقابل فایل های خیلی مهمم بکیرم که جواب کارم و داد ، اما در کل انتظار این و داشته باشید که یه هارد اینترنال حجیم و گذاشتن تو یه باکس اکسترنال"
5,عالی
5,نسبت قیمت عالی 
5,من خریدم خوب در اومده
5,خیلی خوبه
5,خوب بود
0,عالی
5,برای بکاپ‌گیری منظم اطلاعات خریداری کردم. به یک سیستم همیشه‌روشن وصله و هر ۱۲ ساعت روی این هارد بکاپ گرفته میشه. این ۴ ماه خیلی خوب بوده. امیدوارم سال‌ها بدون مشکل کار کنه.
5,عالی و بسیار کاربردی 
5,اندازه بسیار خوبی داره. تقریبا یک ساله که کاملا با ظرفیت پر داره کار میکنه و 24 ساعته اطلاعات از روش خوانده میشه و تا الان مشکلی پیدا نکرده.
5,هارد اکسترنال خیلی خوبیه. لطفاً شگفت‌انگیز کنین بتونیم بخریم.
3,خوبه خیلی کاربردی
5,عالی بود
3,اگه جنس خوب  با برند برتر باشین بنظرم این خوبه من اینو با کلی تحقیق گرفتم و خیلی عالی هست 
3,"قبلا از همین خانواده 6 تراخریده بودم، کمی تحقیق و بررسی و البته موضوع نیاز تصمیم گرفتم این بار 8 ترا بخرم. سرعت انتقال داده با کامپیوتر در  ترا از این بهتر بود همچنین این هارد صدای بیشتری نسبت به قبلی داره البته صدای هد نیست صدای سیلندر هارده"
4.7,توی 25 سال کار با هارد های مختلف اگه آرشیو و امنیت اطلاعات برات اولویت هست فقط وسترن ضمنا نوع کاربریشو حتما بررسی کن یه گاوصندوقیه برا خودش با ابهت شیک
0,کیفیت عالی
5,خیلی کیفت و سرعت خوبی داره
0,به نسبت حجم قیمت نسبتا مناسبی داره به نظرم
0,"این کالا بر خلاف ادعای فروشنده فقط ۱۱ ماه گارانتی داشت. باید مرجوع میکردم ولی دلار گرون شده و هارد افزایش قیمت داشت"
4,سرعت خوب، قیمت خوب و حجم خوب 
4,سرعت نقل و انتقال خوبی داره،کلا هارد وسترن همه جورش خوبه،تو خریدش شک نکنید
4.1,ممنون از دیجی که این کالا رو واسه من فرستاد. واسه آرشیو عالی هست
3,کلا محصولات WD نیازی به تعریف نداره. عالیه 
0,خوبه پیشنهاد میکنم
3,سلام.این هارد رو به هیچ عنوان به صورت ایستاده استفاده نکنید.دلیل تقه زدن و صدا و همینطور لرزش زیاد که بعضی دوستان اشاره کردن به همین خاطر هست.این هارد دقیقا همان مدل اینترنال پی سی هستش. پیشنهاد میکنم که بالای هارد رو به سمت نور بگیریدو از روزنه هاش جای هارد رو داخل باکسش تشخیص بدید و هارد رو به شکلی که قسمت فلزیش بالا باشه بخوابونید دقیقا مثل وقتی داخل پی سی قرارش میدین.من چندین سال هست که انواع مختلف هارد ها رو استفاده میکنم واین بهترین راه برای استفاده از هاردهای 3.5 اینچی هست.موفق باشید
5,بسیار عالی و چشم گیر
3,با سلام،هارد معمولی هست،زود داغ میشه،لرزش دارن،تقه میزنه که میز را میلرزونه،بنده دو عدد هارد اکسترنال از برند دیگه هم دارم که بعد از سه سال نه صدای عجیب میدن نه مثل این هارد تقه میزنن و نه اینجور داغ میشن،در کل اشتباه کردم و با توجه به نظرات مثبت کاربران خریدم،که شاید اونا تجربه در مورد هاردهایه دیگه نداشتن که این مدل را خوب میدونن
5,دمتون گرم نزدیک دو ساله دارم استفاده میکنم تا الان که راضی بودم خداروشکر
3,ظاهرا هارد بدی نیست...فقط دما در حالت کارکرد بعضا حتی با انجام کارهای سبک و حجم پایین هم بالا میره...در حالت بدون کارکرد در مدت ۱.۵ ساعت ۲۰ درجه افزایش از ۳۷ به ۵۷ درجه...با کار سنگین تا ۶۶ هم رفته...بردم نمایندگی  گفت هم صدا و هم  دما طبیعیه...پوسته کیس خیلی خیلی بد و خفه ای داره که باعث میشه هارد داغ کنه خیلی راحت میتونست با افزایش مسیر های گردش هوا و فن مشکل دما را حل کنه که انجام نشده...مجبور شدم ۳ تا فن ۴×۴×۲ را با چسب بچسبونم به هم سری کنم به یه اداپتور ۱۲ ولت و بگذارم روی سر هارد...دما در این حالت حتی با کار سنگین از ۳۷ بالاتر نمیره...
4.8,هارد خوبیه و نسبت به هارد های اکسترنال دیگه عملکرد بهتری داره اولش میخواستم یه هارد 3.5 اینچی بخرم با داک ولی این خیلی به صرفه تره و کار رو راحت راه میندازه تنها بدی که داره اینه که وقتی در حال کاره میلرزه و صدا میده البته نسبت به هارد سیگیت نسبت به هارد های دیگه رو نمیدونم. نرم افزار خوبی هم داره امنیت هارد رو تضمین میکنه ولی نمیذاره که هارد رو پارتیشن بندی کنیم. در مجموع نسبت به قیمت بسیار عالی هست و پیشنهاد میکنم.
4.6,برای آرشیو و نگهداری اطلاعات بسیار مناسب است. خرید از فروشنده محترم رایان تجارت نابغه را توصیه می کنم. هارد ارسالی از لحاظ مشخصات، گارانتی و مدل دقیقا مطابقت می کرد و بصورت پلمب به دست من رسید.
5,هارد خوب و پرقدرتیه ، تا حالا پنج تا ازش داریم. خوب و سالم به دستم رسید.
