5,خیلی کوچک خوش رنگ پر سرعت
4,رنگ طلایی زیباست فقط کمی سرعتش پایینه
4,خوبه
4,تشکر از دیجی کالا
4,بدک نیست خوبه ..........
5,در کل خوب بود 
4,ابعاد کوچک و بدنه فلزی که باعث میشه نشکنه و یه فایل ۱ گیگی رو تقریبا ۱ دقیقه و ۱۵ ثانیه طول کشید که کپی بشه داخلش و ۳۰ ثانیه که ازش کپی بشه داخل کامپیوتر
5,مقرون بصرفه نسبت به قیمت بازار
4,فلش خوبیه تقریبا
3,اگه بهش فشار بیارید زود میسوزه
4,خوبه نسبت به قیمتش
2,سلام من از این فلش مموری به تعداد 3عدد به قیمت 80000تومان به رنگ طلایی از پروتاچ خریدم این فلش مموری در مشخصات زنجیر داشت ولی اینی که برام ارسال شد ندارد از فروشنده دیگر بخرید
5,عالی  
5,عالیه باکیفیت
3,خوب بود نسبت به قیمتش
1,اشتباه در خرید
5,عالی
5,عالیه وظریف
4,سلام من این فلش مموری رو از پروتاچ خریدم به رنگ طلایی و اینکه گارانتی مادام العمر داره خوبه فقط زنجیر نداشت که جالب نبود 
2,فلش ارسال شده ظرفیتش 16 گیگه نه 32 گیگ در کل ک نسبت ب قیمتش بد نی و اینکه من واس تو ماشین میخواسم نیازیم ب 32 ندارم ولی اینکه زدین 32 گیگ این بدههه
5,در کل خوبه از خریدش راضیم
5,دوستان اگه قصد خرید فلش با کیفیت دارن،انتخابشون همین باشه 
3,خوب بود
0,خوب بود 
5,فلــش قشنگیه عالیه
4,تنها مشکل این فلش سرعتش هست خیلی سرعت پایین داره یک گیگ رو سه، چهار دقیقه طول میده اگه به ای ۱۰ گیگ بریزی داخل فلش، قشنگ ۳۰ الی ۴۰ دقیقه طول میکشه.
5,کیفیت خوب و عملکرد عالی
3,در مجموع اگر درست ارسال می شد، فلش خوبی است.
0,پیشنهاد میشه
5,گارانتی مادام العمرش خیالتو از هر چیزی راحت میکنه.
0,من ازشکل ظاهری آن بسیارخوشم آمده است.امیدوارم کیفیت آن هم مطلوب باشد.
3,عالیه زیبا محکم
4,قیمت مناسب و زیبا
0,با کیفیت و کوچک و زیبا
4,خوب بود و کارمو راه انداخت
4,خیلی خوب و قیمت مناسب
5,سریع تر از چیزی هست که باید باشه(۲هست ولی خوب واقعا سرعتش بالاست) به مقدار کمی داغ میکنه
3,کیفیت و سرعتش عالیه
3,در هنگام تخفیف ارزش خرید داره
3,همان چیزی بود که در عکس دیدم عااالی
3,نسبت به قیمتش خوب هست ولی ۲۹ گیگ هست داغ میکنه کند هم هست
3,مموری خوب ودارای گارانتی مادام العمر
1,فلش خوبی نسیت سعی کنید طلایی نخرید 
3,همونی برام ارسال شد که سفارش دادم
0,خوبه اما سرعت کمی کمه
3,من برای پخش خودروام که jvc هست گرفتم ولی متاسفانه نشناخت بقیه جاها مشکلی نداره 
3,فلش خوبیه سرعتشم معمولیه. ولی خیلی داغ میکنه. و خوب جای خالی بندش یکم تو ذوق میزنه. برای ضبط ماشین همش میپره و ارور میده! بعد یک ماه استفاده.
1,از این برند هیچی نخرید تمام
4,جنس خوب کیفیت خوب،قیمت خوب دوست دارم بیشتر خرید کنم لطفا تعدادشون بیشتر کنید ممنون از دیجی کالا
4,مد نظر داشته باشید که بسیاری از ضبط های ماشین قادر به باز کردنش نیست ولی برای من jvc بود راحت باز کرد
4.4,عالی و خیلی خوب بهتر از همه زود رسید
0,خیلی خوب
5,من تازه به دستم رسیده این فلش .کمی که ازش استفاده کردم دیدم سرعت انتقال و دریافتشم عالیه راضی کنندس .من طبق نظردوستان سفارش دادم و الان کاملا ازخریدم راضیم ممنون دیجی کالا بهترینی
5,من برای بازی ps2 خریدم خوب جواب داد خیلی خوب بود
4,فلش 32گیگ با این قیمت خیلی خوبه، امیدوارم خوب هم کار کنه
3,کیفیت خوب
3.3,"ظاهرش خوبه تو ۳۲ گیگ ها هم قیمتش نسبتا خوبه"
3.5,"کیفیت مکناسب فلزی یودن"
0,"واسه ماشین خوبه هم کوچیکه هم اگه ناگهانی چیزی بهش بخوره محکمه پیشنهاد میشه"
2.1,از نظر قیمت عالی هست . ولی از کیفیت نمیدونم خوبه یا بده . و اون حلقه ای که برای زنجیر وصل کردنه خیلی ضعیفه و راحت میشکند.
4.4,به خاطر کووچک بوودد برای  ماشین خوبه
5,خوبه با توجه به قیمتش نباید انتظار سرعت بیشتر ازش داشت
3,سلام- من قبلا از پروتاچ خریده بودم زنجیر هم داشت اما ایران اقتدار خریدم اینبار که متاسفانه زنجیر رو برداشته بودن انگار- کار بسیار زشت
2,تو شگفت انگیز خریدم ۱۰۰ تومن.یه مدت بعد دیدم زده ۹۵ تومن.واقعا چرا مردم رو گول میزنید
5,چهار تا فلش و سه تا مموری کارت دارم از این برند. از همشون راضی هستم
0,"زیبایی جذاب و سرعت انتقال فایلها "
2.4,چون همه ازش راضی بودن گارانتی خوبی هم داره رنگش هم زیباست توصیه به خریدش میکنم
1.6,"حافظه ش 29 گیگ  سرعت خوندنش تقریبا 18، سرعت نوشتنش از 1تا10 متغیره و اصلأ ثبات نداره اگه میانگین حساب کنیم حدودا 5 که یعنی افتضاح  یه فایل 3گیگ تو 9 دقیقه توش کپی کردم درحالیکه تو یه فلش معلولی usb2 دیگه که مقایسه کردم تو 5 دقیقه کپی شد تنها نکته مثبتش ظاهر و اندازه کوچیکه شه که کاملاً هم با سرعتش تناسب داره و نصفه فلش های دیگه بازاره"
3,تعجب میکنم دوستان نوشتن سرعت خوبه،اصلا سرعت ثابتی نداره
3,کیفیت عالی قیمت مناسب 
5,فقط میتونم بگم عالیه
5,کیفیت و سرعت عالی و زیبایی
5,هم کیفیت هم سرعت و هم قیمتش عالی 
3,فلش خوب و پر سرعتی هستش
0,بسیار شکیل و زیباست و باکلاس. پیشنهاد میشه 
4,به نسبت قیمتش خوبه
4,زیبا و با کیفیت است
3,نمدونم چرا میان نظر مثبت میزارن و ادم رو قول میزنن ایقدر سرعتش پایین که اصلا گیر میکنه
0,قیمت و کاربری با هم هیچ وقت در این بازار برابری نمی کنند
3,ظاهر زیبا و کیفیت قابل قبول
3,اگر کوچیک و طریف و زیبایی براتون مهمه پیشنهاد میکنم بخرید
5,فلش کوچیک وپرکاربردیه. خیلی راحت توی لپ تاپ جا میخوره و هیچ خشیم روش نمیوفته خیلیم ظریف و خوشگله ضد آب و ضد ضربه هم هست که فوق العاده ترش میکنه
5,خیلی مقرون ب صرفس
3,ظاهر زیبا و کیفیت نسبتا خوب. کلا خیلی خوبه
4,هم سرعت و هم کیفیت بالایی داره
0,کیفیت مناسب قیمت مناسب
0,تو فلش های با این قیمت کیفیت خوبی داره.
3,خوبه ولی سرعت کم
