4,یک تا دو سال کار میکنه و بعد کلیدهاش ضعیف میشه و درست کلیک نمیکنه و با تمیز کردن درست نمیشه. 
5,سلام دوستان من همسرم به دلیل شغل IT مدت زمان زیادی در طول روز با موس کار میکنند و همین باعث شده بود تا مچ دستش دچار مشکل بشه. خدا رو شکر بعد از دو هفته استفاده از این موس به دلیل اصلاح قرارگیری زاویه و مچ دست مشکل کاملا برطرف شد. من برای همه عزیزانی که به صورت طولانی از موس استفاده میکنند این مدل را پیشنهاد میدم و در خریدش شک نکنید
5,عالي
5,بهترین موس موجود
5,عالی 
5,عالی. برای استفاده طولانی مدت عالیه. فقط بعد از چندسال استفاده ضامن کلیک چپش خراب میشه و‌خودتون باید درستش کنید که بستگی به خلاقیتتون داره این موضوع درغیر این صورت باید بندازیدش دور
4,"کیفیت ساخت این ماوس پایین تر از انتظار شما از برند مایکروسافت است و بعد از گذشت مدت زمانی نوشته‌های قسمت‌ پلاستیکی محو می‌شود و بعد از گذشت مدتی بیشتر کلید‌ها دیگر خوب کار نمی‌کنند. متریال استفاده شده به‌شدت اثر انگشت جذب می‌کند.  برای افرادی که از درد مچ ناشی از استفاده‌ی طولانی مدت با ماوس رنج می‌بردند این ماوس از نظر ارگونومی مناسب است و به مرور این درد تخفیف پیدا می‌کند."
4,برای مج دست خیلی خوب و راحته مخصوصا برای کسانی که ساعت های طولانی پشت رایانه می شینن. اما دانگلش خیلی بزرگ و لوهور هست. روی سیستم نمی شه بذارید بمونه چون ممکنه یک چیزی بهش گیر کنه و بشکنه. من چند ساله دارم ازش استفاده می کنم و کلا راضیم.
5,عالی
5,بهترین تجربه خرید ماوس بدون شک
0,به جز قیمت همه چی عالی
3,به نظرم عالی هست
5,"سال ۹۳ این ماوس رو از دیجی خریدم ۲۰۰ تومن بعد از ۷ سال هنوز کاملا مثل روز اولش کار میکنه یکی از بهترین هاست اما فکر میکنم گیمر ها باید رو گزینه دیگری فکر کنن تمرکز این محصول روی خسته نشدن دست و کیفیت ساخته تا روی تاخیر. امیدوارم یه روزی یا قیمت ها اصلاح شه یا حقوق ها..."
0,"بدرد کار طولانی مدت در روز نمیخوره ، عکسش به خوبی حجم و اندازه موس را نشون نمیده. توجه هم داشته باشین قبلا بسته بندیش باز نشده باشه."
3,خیلی خوب و با کیفیته
4,کار کرد این ماوس عالیه
3,یک موس خیلی خوب برای افرادی که در دستشون عارضه ای پیدا شده. بالای سه ساله استفاده می کنم.
4,"کلا ماکروسافت یچیزی می‌سازه که مثل مال مردم نیست خلاقن"
5,من سه سال پیش این موس رو خریدم. اون موقع خیلی قیمتش خوب بود، هنوز که هنوز موس ارگونومیک مثل این مورد داخل بازار ندیدم. فقط یه نکته اش اینه قابلیت کاستومایز مثل موس های گیم نداره ولی بازم هم حالت ارگونومیک خریدم رو لذت بخش کرد. دیزاین و طراحی موس هم کلا با موس های دیگه متفاوته و همین جذاب ترش میکنه. اگر برای گیم یا برنامه نویسی میخواین، باید بین کاستومایز و ارگونومیک بودن یکی رو انتخاب کنین، من ارگونومیک بودن رو انتخاب کردم، چون دیدم مچ دوستانم با موس های هم رده یا حتی بالاتر بعد از یه سالی استفاده مداوم درد گرفت.
5,من سه ساله پیش ۲۳۰ تومن خریدم  الان خیلی گرون شده.ولی در مجموع کیفیت خیلی خوبی داره و بدرد اشخاصی میخوره که دست بزرگی دارن.برای من که عالی بوده تا الان.
4.9,"بسیار خوش دست ، سنگین ، خوشگل ، تودل برو و دوست داشتنی مناسب استفاده طولانی مدت صدای کلیک نرم و کم کیفیت ساخت عالی حال میکنید باهاش..."
3,ارگونومی عالی ولی  دانگل موس خراب شد و غیر قابل استفاده ، دانل های این برند یونیک هستند و در صورت خراب شدن شما نمیتونید دانگل دیگه رو باهاش مچ کنین متاسفانه
5,"الان۳ساله که این موس و دارم و کاملا راضی ام ازش واقعا به نظر من عالیه و ارزش قیمتش و داره  مخصوصا برای کسایی که دستشون مثل من بعد از کار با موس و اینجور چیزا درد میکنه خیلی مناسبه چون دست من موقع کار باهاش درد نمیکنه"
5,"در کل خیلی عالیه. خدمات پس از فروش  و گارانتی فوق العاده ای هم داره"
5,"در یک کلام، فوق العاده من در طول روز به مدت خیلی زیاد، حدود ۸ یا ۹ ساعت با موس کار میکنم و در طول این مدت به مچ دستم هیچ فشاری نمیاد و خستم نمیکنه  و این که من این موس رو به مدت ۴ ساله دارم و تا الان عملکرد خودش رو از دست نداده  و قطعا به افرادی که قصد. خرید موس دارن این وسیله رو توصیه میکنم هر چند که در این چند وقت قیمتش خیلی زیاد شده."
4.5,قیمت بسیار گران هست. اما مناسب امثال من هست که پای رایانه از موس استفاده زیاد دارند. مثلا طراحان گرافیک. اوایل استفاده از این موس چون عادت نداشتم کمی برام مشکل بود. اما رفته رفته عادت کردم و دستم کمتر احساس خستگی می‌کنه
4,منظورم ازین که برای طراحی یا بهتره بگم کار های حساس تو سیستمتون مناسب نیست اینکه موس از دقت پایینی برخورداره در حد کار های معمولی مناسبه، و حتی طراحا با فرمی که موس داره برای حرکات زاویه دار به مشکل میخورن، من خودم کراپ کردن باهاش تو فتوشاپ برام خیلی سخته. اینم بگم که خیلی سنگینه و خستتون می‌کنه، ولی در کل دوست داشتنیه
5,من گرافیست و طراح هستم و قبل این محصول همیشه دست درد داشتم اما از زمان خرید این وسیله جذاب دوست داشتنی و کاربردی هم از طراحی بیشتر لذت میبرم هم اصلا دست درد ندارم
4.9,"ماوس بسیار خوبیه  همه دکمه هاش قابل برنامه ریزی هست و کار باهاش راحته  اما متاسفانه نهایت تا 2-3 سال براتون کار میکنه بعد آروم کلیک سمت چپ دقتش پایین میاد و از کار میافته"
4.4,به نظرم میتونه بهترین موس برای همه‌ی گروه‌های سنی و انواع کاربری‌ها باشه.. طی یک هفته گذشته عالی کار کرده واسه من
0,برای فردی مثل من که بخاطر فعالیت‌های گرافیکی مجبور به رسم اشکال مختلف و ادیت است، و همینطور فعالیت طولانی مدت، این ماوس بسیار مناسب است اما برای کسی که فعالیت معمولی با ماوس دارد، صرف این هزینه مقرون به صرفه نیست.
5,واقعا ماوس راحت و خوش دستیه،بسیار باکیفیت  شاید بنظر گرون بیاد ولی نسبت به قیمت واقعا می ارزه.
0,اولش کار کردن باهاش سخته ولی برای کسایی که مدت طولانی موس دست میگیرن مثل طراح ها موس خیلی خوبیه
4.5,از لحاظ کارایی و راحتی حرف نداره
3,من ۱ ساله این ماوس رو دارم و از خریدش خیلی راضی ام حتما به کسانی که طولانی پشت کامپیوتر میشینن توصیه میکنم
3.7,برای کاربرانی که زیاد از موس استفاده میکنند و درد مچ دست دارن بسیار خوبه ولی عمر بالایی نداره
4.5,"فوق العاده عالی و اعتیادآوره اگه عادت بکنی بهش دیگه بقیه موس ها مسخره بازیه حتما بخرید"
4.7,با توجه به قیمت فعلی، خرید این مدل توجیه‌پذیر نیست و بهتر است مدل‌های ارزان‌تر مایکروسافت و ... خریداری شود
4.9,"این موس محشره. من به همراه کیبوردش پارسال خریدم و واقعا عالیه. عکسی که دیجی کالا از نحوه در دست گرفتن موس کاملا اشتباهه و طراحی موس طوری است که موقع گرفتن موس باید کنار دستتون (لبه سمت راست دست راستتون) کاملا روی زمین باشه و از کنار سمت راست موس رو بگیرید. روی زمین بودن کناره دست باعث میشه فشاری روی مچ دستتون نیاد که بسیار عالی است. از اون بهتر کیبوردشه که واقعا با آرگونومی دستتون همخونی داره و برای من که برنامه نویسم واقعا عالیه. اولش ممکنه سخت باشه براتون تایپ 10 انگشتی ولی بعد از یه مدت که باهاش کار کنین دیگه کیبورد دیگه ای بهتون مزه نمیده  تا الان 4 سری موس و کیبوردش رو خریدم برای همکارام و همه راضی بودن. تنها مشکل اینه اینقدر گرون شده دیگه نمیشه موس و کیبوردش رو خرید"
1.7,"کیفیت ساختش در عمل به‌هیچ‌وجه خوب نیست. کلیدهای چپ و راستش به‌زودی از کارکرد دقیق می‌افتند و از هزینه‌ای که بابتش متحمل شده‌اید پشیمانتان می‌کند."
4.8,بعد از 4 سال و نیم استفاده واقعا ازش راضیم. مثل روز اول کار میکنه. بدون شک ماوس بعدی که قرار باشه بخرم همین مدل خواهد بود. البته من با قیمت خیلی کمتر (199ت) گرفتم ولی الان قیمتش نجومیه!
3,دوسال پیش خریدم و بینظیره، مشکل  دردم رو حل کرد و روی هرسطحی میشد باهاش با دی پی آی بالا کرد. ولی چندماه پیش دانگلش خراب شد و دیگه کار نمیکنه. نمیدونم چیکارش کنم
3,از هر نظر موس خوبیه به معنای واقعی.....البته من بازی نمیکنم و نمیدونم برای بازی چطوره ولی برای سایر کارها عالیه...تنها مشکلی که داره دانگلشه که قدری زیادی از لپ تاپ بیرون میزنه و اگر دانگل روی لپ تاپ باشه و لپ تاپ رو تو کیف بزارید ممکنه دانگلش بشکنه...اتفاقی که برای من افتاد...و به هیچ وجه هم دانگلش درست نمیشه گارانتی هم شکستگی رو پشتیبانی نمیکنه...الان فقط بخاطر دانگل مجبورم کل موس که تازه خریدم رو بندازم دور...در صورتی که بعضی موسها که بولوتوثی هستند این مشکل رو ندارن....در نتیجه از طرف یک دلسوخته توصیه میکنم این موس رو بخرید ولی خیلی خیلی مراقب دانگلش باشید
4.8,همونجوری ک گفتم واقعا موس بی نظیریه اگ برات هزینش مهم نیس حتما بخرید من حدود 3سال خورده ای دارمش ولی اون زمان من مبلغی ۱۸۰-۱۶۰ تومن خریدم خیلی خیلیییی خوبه حرف نداره
5,سلام من قبلا موس logitech داشتم با وجود این که عملکردش خوب بود وقتی ازش چند ساعت استفاده می کردم مچ دستم رو خیلی اذیت می کرد ولی این موس واقعا عالیه و بعد چند ساعت استفاده مداوم اصلا احساس خستگی نکردم ولی اصلا برای بازی های کامپیوتر مانسب نیست
5,"من یکساله این موس رو دارم. علت خرید این موس هم این بوده که به خاطر کار و درسم مجبورم مدت طولانی و تقریبا شبانه روزی از موس استفاده کنم که این موضوع بعد از مدتی باعث شد مچ دستم درد مزمن داشته باشه. سرچ کردم و تنها موس استانداردی که در رابطه با این موضوع پیدا کردم این موس بود! وقتی شرکتی مثل مایروسافت موسی طراحی میکنه مطمئنا کلی آزمایش و تحقیق انجام شده براش که این موضوع تو عمل هم اثبات میشه به واسطه ی تجربه ی استفاده ی طولانی مدت از این موس. من این موس رو باوجود قیمت بالاش به هرکسی که زیاد کار میکنه با موس و سلامتیش براش مهمه توصیه میکنم. تنها نکته ای که یکم تو ذوق زد اولش، موقع خرید موسی که داخل جعبه آکبند بود خیلی کثیف و پراز لک و خش بود که انگار قبلا استفاده شده! که البته من اینو به دیجیکالا گزارش دادم و اونام موسو برام عوض کردن، که جای تشکر داره  تو این مدت یکبار هم دکمه back موس خراب شد که گارانتی اون برام تعویض کرد وبسیار خوب پاسخگو بودن. مسئله خش و لک رو موس ظاهرا تو همه این نوع موس مایروسافت هستش که من علتشو نمیدونم ولی عمده شون حتی با اینکه جعبه شون آکبنده این خش و لک رو دارن که عجیبه!"
4.4,"سلام خدمت همه ی دوستان . من این موس رو حدودا 3.5 ساله که دارمش . البته از دیجی کالا نخریدم . از قیمت که بگذریم موس عالی ایه .... روزای اول به دستتون نمیشینه ولی به مرور بهش عادت میکنید .... موسیه که هرجا ببرید توجه همه رو به خودش جلب میکنه .... تا حالا 4 یا 5 بار از دستم افتاده و فکر کردم دیگه نابود شد ولی هیچیش نشد و سالم موند .... غلطکش به چپ و راست کلید داره و استفاده های متفاوتی ازش میشه کرد . من کارم طراحیه و روزی بیشتر از 10 ساعت با موس  کار میکنم.... زیر دست من دووم آورده واقعا راضیم .... جدیدا غلطکش ایراد پیدا کرده که نمیدونم شاید از گرد و خاکیه که ممکنه رفته باشه داخلش .... درپوش باطریش مگنتیه و جالبه .... طراحی عجیبیه از شرکت ماکروسافت .... اگر قیمتش اومد پایین بخریدش حتما .... با این قیمت توصیه نمیکنم .... که البته به خاطر بالا رفتن دلاره ..."
4.5,"من این ماوس رو یه بار از بیرون گرفتم و چون دانگلش شکست گارانتی ساپورت نکرد و حتی با دریافت پول هم عوض نکردند چون این کار در ایران امکانش نیست و مجبور شدم یکی دیگه بگیرم. این دفعه برای اینکه دانگلش بلایی سرش نیاد یه محافظی  براش درست کردم که هم از فرسودگی و آسیب محافظت میکنه و هم به دلیل بزرگیش از گم شدن دانگل جلوگیری میکنه. مهمترین ویژگی این ماوس ارگونومی اون هست و من با اینکه سندرم کارپال تو مچم دارم، با این ماوس راحت هستم و یکسره باهاش کار میکنم. با ماوسهای دیگه بیشتر از یک روز نمیتونم کار کنم. و توصیه میکنم کسانی که با ماوس فعلیشون مشکل دارند و در دستشون ناراحتی و خستگی حس میکنند قیمت اینو نادیده بگیرند و ابتیاع کنند. فقط یادتون باشه از یک ماوس پد هم استفاده کنید تا مچتون رو اونقدر بالا نگه داره که بتونید اکثر مواقع دستتون رو بصورت مایل برروی ماوس قرار بدین تا منطبق بر ماوس بشه و شصت در اون گودی قرار بگیره. هر چند که بنده به شخصه در مواقع کلیک های دقیق نمی تونم شصتمو اونجا قرار بدم و مجبور میشم مثل یک توپ بگیرمش و این یکی از ایرادهای این ماوسه. در ضمن با گارانتی بگیرین چون اکثرا نمیتونن تعمیرش کنند و یکی دیگه به جاش میدن. من بعد از یک سال  استفاده چون دکمه برگشتش خراب شد بردم یکی دیگه بهم دادند. بنابرین بهتره با گارانتی دو ساله بگیرین تا یک ساله. نکته ی دیگه اینکه دکمه استارت رو با وسط انگشت اشاره فشار دهید نه با نوک انگشت. هرچند که جاش باز هم نامناسبه."
4.9,"در ابتدا شاید استفاده از آن برایتان نا آشنا و نا مانوس باشد ولی پس از استفاده تدریجی ، به شدت به آن علاقه مند شده و یقین بدانید ، ماوس دیگری را پسند نخواهید کرد . با تصحیح زاویه دست و مچ ، به کارآیی وطراحی  خوش تراش ارگونومی آن پی خواهید برد. هرچه زاویه دستتان را به سمت راست بیشتر  و نرمه سمت انگشت راست  کوچکتان به ماوس پد تکیه بیشتری داشته باشد ، آن گاه خودتان به بی نظیری این ماوس اذعان خواهید نمود .  اگر راست دست هستید ، لحظه ای در خرید این ماوس درنگ نکنید . از همه عزیزان حرفه ای ، با اخلاق و زحمتکش  مجموعه دی جی کالا ممنونم."
4.7,"1.5 ساله دارمش، کارم جوری که با موس زیاد کار میکنم. ابعاد بزرگش، بزرگترین مزیت از بابت کارکرد و بدترین عیبش از لحاظ حمل. بارها خواستم یه جایگزین براش پیدا کنم نشد. هر موسی رو تو دستم میگرم برام کودکانه بنظر میاد، و چون نمیشه با خودم بگردونمش مجبورم بیشتر کارامو بیارم تو خونه انجام بدم."
4.2,موسی بسیار زیبا و راحت و کار کردن باهاش عالیه، هرگز خریدی به این خوبی نکرده بودم
4.9,"قبلا یه کامنت مفصل راجع به این موس گذاشتم. حالا بعد از 1.5 سال استفاده میخوام تجربه های جدیدی رو مطرح کنم. این موس واقعا از لحاظ بزرگی و سنگینی خوبه اما دقتش واقعا پایین و پرش های ریزی داره که تو وب گردی واقعا اذیت میکنه از بس باعث میشه رو لینک اشتباه کلیک کنی. فکر کنم برای گیمرها که سرطان باشه. اما من گیمر نیستم و 90 درصد نیازهام رو رفع کرده و راضی ام. یعنی راضی بودم تا اینکه یه اتفاق عجیب افتاد. یه روز دیدم دیگه کلیک چپش کار نمیکنه. ولی یه طور عجیب! یعنی فقط روی یک پنجره کار میکرد و به جز اون پنجره هیچ جای دیگه ای کار نمیکرد تو ویندز. روی 5 تا سیستم مختلف با ویندوز های مختلف تست کردم.  بعد از کلی گوگل کردن یه راه حل عجیب برای این مشکل تو فروم مایکروسافت پیدا کردم: تو ویندوز Ctrl+Alt+Delete رو بزنید. بعد روی دکمه Cancel دو بار کلیک کنید (چون کلیک اول کار نمیکنه). اولش فکر کردم مسخره بازیه ولی بعد که دیدم کار میکنم خیلی بیشتر تعجب کردم.  به هر حال اگر به چنین مشکلی برخوردید که ماوس مایکروسافت مدل Sculpt Ergonomic کلیکش کار نمیکرد، راه حل بالا رو تست کنید. البته اگر گارانتیش تموم شده. چون برای من هنوز گارانتی داشت. بردم شرکت گارانتیش که پانا هست، برام عوض کرد و یه دونه نو بهم داد. الان همه چی خوبه تا سال دیگه ببینیم چه اتفاقی می افته."
3,متاسفانه اصلا خوب نیست
5,من این موس رو خریدم و واقعا راضی هستم. پیشنهاد میکنم حتما خریداری کنید.
5,"ممنون از دیجی من معمار دکوراسیون داخلی هستم این موس واقعا برای کار کردن با اتوکد و مکس عالیه خیلی خوش دست و خوش ساخته بعد از دو هفته کار کردن موسهای دیگه براتون خیلی بچه گانه بنظر میرسه  دقیقا مثل پراید و بنز میمونه"
4.4,این محصول کاملا عالیه اما از نظر کیفیت ساخت، ضعیف واقع شده.
2.8,متاسفانه برخلاف چیزی که در تبلیغات این محصول وجود داره اصلا برای دست خوب نیست مگر آنکه دستتون بزرگ باشه. من بعد از دو هفته استفاده دچار دست درد شدید شدم طوری که کلا گذاشتمش توی جعبش و برگشتم به استفاده از تاچ پد. خلاصه اینکه با توجه به قیمت زیادش واقعا ضرر بزرگی هست اگه همینطوری ندیده خرید کنید. حتما قبلش سعی کنید یکیشو دستتون بگیرید.
4.7,"برای کاربرانی که در طول روز بسیار با کامپیوتر سروکار دارند توصیه می کنم که از محصولات ارگونومی خریداری کنند تا شددت خستگی کم شود موس خریداری شده بسیار مناسب می باشد."
4.5,"بعد از مدتی استفاده دیگه نمی تونین با موس دیگه کار کنین. من برنامه نویس هستم و مچ درد (سندرم تونل کارپال) دارم اما با این موس احساس راحتی می کنم، به همین خاطر پیشنهاد می کنم حتما برای سلامتی هزینه کنین!"
4.6,"2 ساله که هر روز 8 ساعت باهاش کار می کنم بسیار ارگونومیک و زیباست و هیچ لگی نداره  واقعا ارزش هزینشو داره با باتری دوراسل 6 ماه کار می کنه از گارانتی پانا خرید کردم بعد از 16 ماه خراب شد و  به راحتی عوضش کردن و یه  نوش رو دادن"
