5,"موس فوق العاده و عالی... من یک ساله این موس رو از دیجی کالا خریدم و توی این مدت از درد مچ دست خلاص شدم... طول عمر باطری موس تقریبا 7 ماه با استفاده روزانه حدود 10 ساعت...گاهی حتی یادم میرفت شلها موس رو خاموش کنم ولی با این حال 7 ماه باطری عمر کرد. برای دستهای کوچیک اصلا توصیه نمیکنم ولی برای دستهای متوسط و بزرگ فوق العاده است.من این موس رو برای محل کارم خریدم و قصد دارم یکی هم برای منزل تهیه کنم.نظرات بعضی از دوستان رو خوندم و در بینشون بعضی از خریدشون گلایه میکردن.توصیه میکنم که حتما توجه داشته باشید اولا این موس برای دستهای کوچیک اصلا مناسب نیست و درثانی درد مچ تنها برای استفاده از موس نیست گاهی سبک نشستن و گذاشتن مچ دست روی میز باعث درد مچ میشه پس بیخود از موس شکایت نکنیم. قیمت موس نسبتا زیاده ولی برای کسانی که زیاد با کامپیوتر کار میکنن و مچ درد دارن بسیار عالیه... عمونطور که خیلی از دوستان هم گفتن خیلی از افراد بعد از دیدن این موس تعجب میکنن و اولین سوالی که ازتون میپرسن اینه که این دیگه چیه؟؟؟ ولی خدایی من ازش خیلی راضیم و اگه مایکروسافت این موس رو نزده بود نمیدونم الان باید چیکار میکردم چون با مچ دردی که داشتم اصلا نمیتونستم با موسهای معمولی کار کنم.تنها مشکل این موس دی پی آی پایینشه که میشه باهاش کنار اومد... با تشکر از دیجی کالا..."
4.7,من این موسو خریدم از بازار با همین قیمت.واقعا کیفیت خوبی داره و بسیار خوش دسته.آهنربایی بودن قسمت نگه دارنده دانگل و باطریش خیلی عالیه و باعث میشه راحت باز و بستش کنی و نگران خرابی و گم شدن قطعاتش نباشی.یک مقدار دانگل یو اس بیش بزرگه که از لپ تاپ زده بیرون.کیف مخملی هم هست که نگه داری میکنه ازش و خیلی زیباست. از نظر کاربردی بودن کلید ها واقعا خوبه.من برنامه نویس هستم و بیشتر از روزی 12 ساعت با لپ تاپ کار میکنم.اما دستم اصلا خسته نمیشه. درد مچ و کتفم از بین رفته که قبلا به شدت اذیتم میکرد.کسانی که برای سلامتیشون ارزش قائل هستن باید هزینه کنن و بخرن این موسو چون که واقعا ارزششو داره.درباره باطری هم نمیتونم نظر خاصی بدم چونکه هنوز به ماه نرسیده که خریدم.اگه دیجی کیف مخمل محافظشو میداشت حتما از اینجا میخریدم.
4.7,"حتما بعد از خرید تلاش کنید تا تمام کف دستتون رو روی موس قرار بدین تا عادت کنین بعد از مدتی استفاده به شدت معتادش میشین فوق العاده خوب و با کیفیت با محفظه ی نگهداری دانگل و درب با اهنربا"
2.7,این موس طراحی ارگونومیک داره و هنگام دست گرفتن باعث میشه مچ شما در زاویه صحیح قرار بگیره و دچار دردهای ناحیه مچ نشید اما یه مشکل اساسی داره و اون اینکه باید سایز دستتون خیلی بزرگ باشه وگرنه کف دستتونو رو پر نمیکنه و مجبورید از پنجه هاتون واسه کار باهاش استفاده کنید که این روش گرفتن موس برای مچ دست اصلا خوب نیست. من که یه مرد 29 ساله هستم با دست های استاندارد و کمی هم کشیده تر از استاندارد نمیتونم به درستی موس رو کف دستم جا بدم چون خیلی بزرگه.
