5,خوبه بخرید 
3,بد نیست خیلی خوب هم نیست 
5,من از این کلا راضیم
5,خیلی بود برا بازی کردن
5,حواستون باشه برای گواشی بزرگ طراحی شده
5,عالی بود کیفیت کار
3,ممنون از دیجی کار راه انداز 
5,برا آهنگ گوش کردن خیلی خوبه چون بیس قوی ای داره. میکروفونش هم برا مکالمه و گیم خوبه. میشه گفت تو این رنج قیمت بهترینه. ممنون از دیجیکالا.
5,هدفون عالی با قیمت عالی
5,نسبت به قیمتش مناسب هست 
5,بیست بیسته حرف نداره
4,خوب بود بیسش ووو وزوه صدا
1,ماله من از همون اولش خراب بود هی  صداش قطع و   وصل میشد  
4,از نظر قیمت کیفیت خوبی داره و لوازم جانبی
5,من سه بار ازین کالا خریدم عین سه بارم راضیم حداقل سر ماه خراب نشده قیمتش بیرون بین ۳۲۰ تا ۳۶۰ تومنه مس واقعد خریدش ازینا میارزه
4,نسبت به قیمتش خیلی خوبه و می ارزه
5,عالی و با کیفیت
4,نسبت به قیمت عالیه
5,صدا عالی ولی سیمش ضعیفه و زود قطع میشه
5,من تا حالا هندزفری با قیمتهای خیلی بالاتر داشتم ولی این خیلییی خوبههه،الکی خرج نکنید همینو بخرید
5,عالی عالی حرف نداره 
5,بهترین هندزفری که تا حالا داشتم هست
4,زیباست وفقط کاش بی سیم بود
5,خیلی با کیفیت و شیک
5,از هر نظر عالیه
5,از خریدش پشیمون نمیشید
5,فرم جالب صدایه خوب بیس خوب کیفیت عالی
3,نسبت به قیمت خوبه 
4,این هندزفری بغیر از طرز جدید گوش انداختن کیفیت خوب صدا داره برای فیلم دیدن و بازی کردن عالیه ولی در روی حرف س تو آهنگ ها یا وقتی آهنگ اوج میگیره خش خش میشه . برای موسیقی گوش دادن انتخاب اولتون نباشه! 
5,عالی
5,الان یسالی هست از دیجیکالا خریدم و هنوز داره کار میکنه درحالی که بیشتر هندزفری هایی که داشتم سیمش قطع شده و از یکی از گوشی هاش صدا نمیاد
4,سلام دوستان کالای مورد نظر ظاهر زیبایی داره و نسبت به قیمت،ارزش خرید رو داره.
4,نسب به قیمتش خوبه
4,نه اونقد بده نه اونقد خوبه معمولی روب خوبه
5,نسبت به قیمت عالیه بین رقباش 
5,تا حالا واسه خودم و دو نفر دیگه سفارش دادم حالا دو تای دیگه هم باید بگیرم عالیه
4,"برای یه نفر دیگه سفارش دادم که می‌گفت کیفیت صداش خیلی خوبه وبرای دومین بار بود که میخریدش بنده خدا به هوای تخفیف هفته گذشته خرید که باید بگم همه شون تخفیف داشتن غیراز این یه دونه سپاس"
5,کیفیت خوب 
5,صدا اطراف را شما نمیشنوید
4,فعلا خوبه 
4,نسبت به قیمتش واقعا خوب و کار راه اندازه،فقط کمی حساسه،زیاد بهش فشار نیارید،زود پاره میشه
5,درکل خیلی خوبه
5,از هر نظر بهترین هست توصیه میکنم بخرید
5,عالی حتما بخرین
4,در حد همین قیمت خوبه و زیبایی داره 
1,اگه از هنذفری زیاد استفاده میکنین اصلا این مورد مناسب نیس
5,عالیه اصلا صدای بیرونو نمیشنوید و کامل کیپ میشه گوشتون  صداشم خیلی با کیفیته
5,عالی برای دومین باره خرید کردم از همه نظر اکی بشدت ارز خرید بالاست 
4,بنظر من هدفون خوبیه با این رنج قیمت
5,کیفیت صداش عالیه فقط یکم سایزش بزرگه برای گوش اذیت میکنه 
3,ظاهرا خیلی از دوستان هندزفری با کیفیت استفاده نکردن که انچنان نظر میدن و انگار با هندزفری های داخل مترو مقایسه کردن  صداش خیلی معمولیه ارگونومی خوبی داره نسبت به قیمت خوبه
5,فعلا که عالی بوده به شکلش هم عادت میکنید و واقعا از هندزفری های عادی راحت تره و کیفیت و بیسش نسبت به قیمت عالیه
5,عالی 
3,خیلی معمولیه
4,من راضی ام خراب بشه بازم میخرم
5,من سه ساله استفاده میکنم عالی، صدا و میکرفن و بیس و جنس و همه چیزش راضی هستم
5,از خرید این محصول اصلا پشیمون نمیشید 
5,عالیه پیشنهاد میکنم 
5,عالی اصن ارزش بیشتر از این حرفا
5,جنس سیم خوب کیفیت صدا قابل قبول
3,کار راه اندازه صداش شاهکار نیست ولی برای روزمره خوبه میکروفونش رو تست نکردم. 
5,بسیار صدای جالب و بیس بالا
5,عالی
5,اقلام همراه کیف،گوشی ها در سایز مختلف گیره برای بستن به لباس و همچنین پلاستیک برای دور هندزفری صدا هم که نگم
2,شاید مال من خراب بوده
5,من ازش راضیم چند تا دیگه از دوست هامم گرفته بودن و اونا هم راضی بودن در کل پیشنهاد میشه
5,کیفیتش خیلی خوبه
5,هندزفری صدای خیلی خوبی داره
5,شک نکنید یه هدفون ا تمنی بلوتوسی گرفتم کیفیت صدای همین بهتره.
4,شیکه کار راه اندازه
5,از هر نظر عالیه
5,درکل خوبه
4,خوب و خوش قیمت
5,راضی ام ، عالیست ، جنس خوبی دارد
5,کیفیت صدای عالی. کاش بی سیم بود!! با این قیمت در نوع خودش توصیه میشه
5,نیاز به تعریف اضافه نداره دفعه چندمه ازین مدل میخرم برا بقیه همه راضی بودن
5,خیلی خیلی خوب
3,ظاهر خاص و قشنگی داره کیفیت صدا هم با توجه به قیمتش مناسبه اما کیفیت سیمهاش یکم پایینه و باید خیلی مراقبش باشید تا آسیب نبینه
5,کیفیت خوب
4,در قیمتی که داره بهترینه و عملکرد خیلی خوبی داره
5,عالیه عالیییی
1,انقدر نظرات خوبی براش نوشته بودن که بدون شک کردن خریدم. ولی کیفیت صدا به شدت افتضاحه و باس پایینی داره. یاد بچگیام افتادم یه نخ به دو تا لیوان وصل میکردیم تو یکیش حرف میزدیم که که صدامون به نفر بعد برسه. کیفیت در اون حده!!!
5,خیلی خوبه حتما بخرید
5,با توجه به قیمت هدفون مناسبیه و صداشم عالیه
4,به نظر من خیلی خوب و عالی و بادوام
3,جنس بدنه خوبه پلاستیک باکیفیت ولی صداش اصلا کیفیت نداره برای فیلم خوبه ولی بدرد موزیک گوش کردن نمیخوره
4,این دومین هندزفری هستش خریدم هندزفری خوبیه درکل فقط بعد از یه مدت خشک میشه پلاستیک های سیم هاش (هندزفری قبلیم برای همین خشکی سیم داخل کیفم بد قرار گرفته بود و اتصالی پیدا کرد)
5,به طور عجیبی کیفیت و حجم صداش و بیسش عالیه نسبت به قیمتش فقط مشکلم اینجاست که من واسه گوشیم گرفتم و به گوشی بدون تبدیل تایپ سی نمیتونم وصل کنم که اونم نخوند ولی وقتی مستقیم با جک ۳.۵ به لپتاپ وصل کردم عااالی بود
4,کیفیت خوبی داره و کمی بد روی گوش وای میایسته. جعبه پلاستیکی برای خودش داشت که بد نبود ولی برند ریمکس هم گرفتم جعبه فلزی خیلی خوبی داشت که حس خوبی بهم منتقل کرد و کیفیت قرارگیری در گوش و صدا هم عالی بود. پس ترجیح میدم اون رو بگیرم نه این.
2,من راضی نودم چون سیمش خراب بود اما خودش نسبت به قیمت خوبه
5,عالی راضیم 
5,عالی و با کیفیت
4,کیفیت صداش بالاست. طراحی‌‌ای که انجام دادن برای ایستادنش روی گوش خیلی خوبه و گوش رو به مدت ۲ ساعت حداقل اذیت نمیکنه. فقط نکته‌ی منفی طراحیش این هست که رنگ پلاستیک پشت گوشش شفافه و شبیه یه سمعک هست...
5,خیلی هندزفری خوبیه بیس خوب و پانچی داره و تفکیک خیلی خوبی داره ارگونومیش خیلی خوبه و اصلا از گوش نمیوفته حجم صداش هم زیاده سیمش با کیفیته و به سختی پاره میشه البته اگه مثل من با کاتر نیوفتید به جون هندزفری در کل چیز خیلی خوبیه ولی دست کسی مثل من بیشتر از ۲ ماه دووم نمیاره 
5,دو بار خریدم عالیه
2,پول بیشتری هزینه کنید ولی بهترش رو بخرید مدت طولانی براتون کار کنه اگر هم از اون کسایی هستین که ماهی یه هندزفری عوض میکنید این خوبه
3,کیفیت متوسطی دارد
5,بی نظیر 
5,اصلا شک نکنین عالیه 
2,درسته قیمتش پایینه ولی بازم خوب نیست،سیمش زود قطع شد،استفاده ازش راحت نیست زیاد باید سه ساعت تو گوش فیکسش کنید
