5,عالی
4,به قیمت ۸۰۰ ، با توجه به بیسیم بودن  ارزش خرید بالایی دارد  کیبورد و موس کیفیت ساخت خوبی دارد در مجموع از خریدن رضایت زیادی دارم 
4,تو این قیمت خوبه
5,عالی
4,خوب بود. می ارزه
1,"عنوان نکردن نداشتن حروف فارسی که اگر مبنوشت ادم برچسب فارسی کنارش میخرید"
5,از این ماوس و کیبورد شیائومی خیلی راضی ام. جمع و جور و عالی
5,توصیه میکنم
5,حتی یک دقیقه شک نکنین تو خریدش
4,خیلی خوب کار کرده تا الان حدود 1 ساله.
5,Nice.             Vv
2,حدود 1 سال از این مدل استفاده کردم؛ پیشنهاد نمی کنم. غلطک موسش خیلی زود خراب میشه و حسابی اذیتتون می کنه.قیمتشم که دیگه به صرفه نیست
3,در ظاهر قیافه داره و شیک هست کیبورد دیگه مث همه کیبورد ها فقط یه ذره خوشگل تر
5,بورد نسبتا خوب و عمر باتری بالایی داره ولی حروف فارسی نداره باید برچسب بگیرید .کلیدای نرم و خوبی داره .  
3,بعد از یک سال کار ضعیف عمل میکنه
1,کیبورد موس ضمانت دار بگیرید بوردش به شدت ضعیفه مصرف باتریش به شدت بالا ضمانت نداره بعد چند ماه استفاده بدون اینکه حتی قطره ای آب روش بریزه بردش سوخت و کلیداش کار نمیکرد 
4,خوبه من دنبال ی کیبرد و ماوس کم صدا بودم که گزینه خیلی خوبیه
5,دوسش دارم
5,عالیه
5,کیبورد و موس خیلی خوبیه فقط تنها بدیش اینه که زیر کیبورد ال ای دی نداره
4,خوب
5,خوب
3,"ماوس سایلنت نیس. نسبت به جنیوس، باتری زودتر تموم میکنه"
4,استفاده از کیبورد بسیار احساس خوبی میده، ماوس صدا میده و کاملا سایلنت نیست و برای افرادی که دست بزرگی دارن پیشنهاد نمیشه، درکل برای کار های روزمره و یا تایپ، و جاهای اداری پیشنهاد میشه، برای برنامه نویس هاهم بستگی به نیازشون داره
1,بعد از تقریبا ۱ سال استفاده از محصول دارم نظر میدم من هم اولش با تمام دوستان هم نظر بودم ولی به مرور نظرم عوض شد  اصلا گول برند رو نخورید واقعا بی کیفیته
5,کیبورد بسیار کم صدا و‌ نرم هست متریال استفاده شده هم راضی کننده هست با توجه به قیمت
4,نسبت به قیمت عملکرد خوبی داره 
4,خیلی عالی کیبورد نرم و بدون صدا
4,تازه به دستم رسید بررسی کردم یه اشتباهی که من داشتم این بود که فکر میکردم ماوس و کیبورد رو میشه جدا از هم استفاده کرد ولی الان که وصل کردم متوجه شدم هر دو با یک دانگل کار میکنن و نمیشه مثلا کیبورد رو برای یه سیستم دیگه استفاده کنی کیبورد از لحاظ کیفیت بدنه خوبه،کلیدهاش بی صدا هستن اما نرمی که میخواستم رو ندارن یعنی شاید برای تایپینگ یکم خسته کنه،باید بیشتر بررسی کنم اولین چیزی که تو ذوقم زد صدای جیرجیر سمت راست کیبورد بود در کل راضی کنندست تو این رنج قیمت اگر مورد خاصی دیدم بعدا ویرایش میکنم تا عزیزان مطمئن باشن از خریدشون
5,من بعد از سه ماه موس خراب شد و از کار افتاد
4,من برنامه نویسم و این کیبورد و موس رو توی شرکت دارم. خودم هم تهیش کردم عالی و جمع و جور و شیک فقط شاید مصرفش توی ماوس و کیبورد ها بیشتر از بقیه باشه... توی شیش ماه اخیر که کارم روزی ۸ ساعت با این سیستم بوده تاحالا مشکل یا قطعی نداشتم و بخاطرهمین خودم جدا خریدم برای سیستم خونه
5,الان چند ماهه دارم استفاده میکنم کیفیت خوبی داره و ازش راضیم اما اگه کار حرفه ای میخوایین بکنین شاید از ی موس بهتر استفاده بکنین در کنار کیبورد بهتر باشه 
5,خیلی کیبورد شیکی هست
4,در این رنج قیمتی انتخاب مناسبی است اما قطعا می‌توان با هزینه بیشتر انتخاب بهتری داشت، موس به خوبی کیبورد نیست اما در حالت کلی ظاهر و کیفیت خوبی داره
3,"پس از یکسال استفاده، هربار موقع روشن کردن کامپیوتر، سه چراغ کیبورد شروع به چشمک زدن میکنه و اتصال برقرار نمیشه. که هر دفعه باید چندین بار باتری و دانگل رو جدا کنم و دوباره جا بزنم تا اتصال برقرار بشه. (ویرایش: مشکل از ضعیف شدن باتری بود و با تعویض باتری درست شد. عجیبه چون کیبورد چراغ مخصوص هشدار باتری ضعیف داره. و اتفاقا دفعه قبلی خیلی شیک با اون چراغ ضعف باتری رو نشون داد.اما اینبار همه چراغ‌ها روشن میشدن به غیر از چراغ باتری!)  کیبورد شیک و خوش دستیه. باتری های خودش خیلی خوب بود به طوری که با وجود استفادهٔ زیادم از کیبورد، باتریش رو اولین بار بعد از ۹ یا ۱۰ ماه عوض کردم و باتری جدیدی که انداختم هنوز داره کار میکنه. باتری ماوس ولی زود به زود تموم میشه، مخصوصا اگه کلیدش رو همیشه روشن بزارید. تقریبا هر ماه/یکماه و نیم برای ماوس باتری جدید لازمه. البته باتری داخل جعبه‌، ۳ یا ۴ ماه روی ماوس کار کرد.  اصلا نمیشه گفت کم صداست. مخصوصا ماوس که حتی موقع حرکت دادنش هم صدا میده، چون پوسته‌ی روش یکم لق میزنه و باعث تولید صدا میشه. اول که به دستم رسید موقع اسکرول کردن صدای قیژقیژ میداد که با تزریق چند قطره روغن سفید برطرف شد.  با همه‌ی اینها، به نظرم یه محصول متوسطه. نه رو به بالاست، نه رو به پایین؛ متوسط. و خریدش رو به کسانی که میتونن بیشتر هزینه کنن اصلا توصیه نمیکنم. اما در غیر اینصورت میتونه گزینه‌ی خوبی باشه."
5,موس خیلی خوبی داره ولی کیبوردش میتونه بهتر باشه در کل عالیه
5,بسیار خوش دست و با کیفیت
4,قیمت خوب جنس مرغوب
4,انتخاب این ماوس و کیبورد برای من صرفاً به واسطه‌ی اعتمادم به برند شیائومی و ظاهر ساده‌ی این پکج بود. خیلی ناراضی نیستم، اما بهتره که این نکات رو بدونید:  کیفیت این پکج (به ویژه ماوس) چندان خوب نیست؛ پلاستیک استفاده شده تو هیچ‌کدوم از این محصولات به هیچ‌ عنوان حس باکیفیتی نداره، البته خیلی هم بد نیست، ولی معمولیه، خیلی معمولی.   من دانگل رو به لپ‌تاپ وصل کردم و بین لپ‌تاپ و کیبورد و ماوس چوب قرار داره. اتصال ماوس بد نیست ولی کیبورد بگیر نگیره که یکم عجیبه. کانکشن این پکج به مراتب ضعیفه.   نکته‌ی آخر هم key travel کیبیورده، که یکم کوتاهه، و علاوه بر اون صدای دکمه‌ها اصلاً لذت‌بخش نیست.   در کل اگر این پکج رو برای ظاهر زیبا تهیه می‌کنید انتخاب بدی نیست، به ویژه اینکه حروف فارسی نداره (البته که برای بعضی‌ها خیلی مهمه و به این موضوع توجه داشته باشید)، اما اصلاً توقع یه تجربه‌ی لذت‌بخش رو نداشته باشید. فقط یه ماوس و کیبورد زیبا با کیفیتی معمولیه، حتی یکم کمتر. 
5,کیفیت عالی از همه نظر عالیه
4,عالی و با کیفیت
4,نحوه موس گرفتن خیلی مهمه چون موس راحته اگر کف دست رو بهش نچسبونی  کیبورد هم راحته هم قشنگ  ممنونم از دیجیکالا و فروشنده 
5,با توجه به قیمت کیفیت و طراحی خوبی داره
1,بعد از 1ماه دکمه بک اسپیس و 3تا از دکمه ها در کنار بک اسپیس از کار افتادن
4,"موس و کیبورد خوبیه بعد از خرید متوجه شدم که متناسب با ویندوز ۱۰ طراحی شده ولی با ویندوز ۷ هم مشکلی نداشت."
5,واقعاً با کیفیته
1,"این نظر رو بعد از 3 ماه استفاده دارم ثبت میکنم دکمه کنترل بعداز 3 ماه از کار افتاد. و مصرف باتری هم زیاد هست.  در ضمن دستگاه فاقد گارانتی هست و عملا پولتون رو ریختید دور."
4,"با سلام، من ۳ تا از این کیبورد خریداری کردم. به نسبت قیمت و مقایسه با دیگر برندهای بازار در این رنج قیمت حالا یکم پایین بالاتر ارزش خرید دارد.  کیبورد خیلی خوب هستش و راحت میشه تایپ کرد جنسش حسی می ده که موقع تایپ انگار انگشتان به کلیدها می‌چسبد و به همان راحتی با برداشتن انگشت سریع جدا می‌شه، اما موس شاید برای هر دستی مناسب نباشد، اگر در تایپ فارسی ضعیف هستید یک برچسب کیبورد هم نیاز می‌شود، دوتا باتری نیم قلم هم داخل پک موجود هستش و مصرف باتریش به نظرم بالا هستش. در کل قابل قبول هستش."
1,من وصلش کردم به مک بوک اصلا کارایی مناسب نداره
2,خوب
3,بعد ۲ ماه غلتک ماوسش خراب شد. بردم تعمیر باز بعد ۳ هفته خراب شد. پیشنهاد نمی‌کنم.
5,خوب بود
2,بنده این کیبورد و موس رو حدود 4 ماه پیش خریداری کردم پس از یک ماه کارکردن کلید های F9-F12 از کار افتاد  موس بر روی هر سطحی جواب نمی دهد Wheel موس پرش دارد و بی دقت است موس راحت نیست در کل اگر جنسی می خوای که راضیت کنه پیشنهاد نمیکنم
4,این محصول واقعا خوبه ولی دو تا مشکل داره 1- ارگونومی موس انگار برای خانم ها طراحی شده و اون قوسی که باید داشته باشه رو نداره 2- کیبورد فارسی نداره که البته این موضوع برای خودم مشکلی نبود ولی اگر تایپتون ضعیفه یا جای کلمات رو نمیدونید به نظرم کنار این کیبورد باید یک برچسب فارسی هم بخرید.
4,در قیمت زیر یک میلیون تومان جزو بهترین کیبرد بیسیم بازاره
1,دوستان بعد از یکسال نظرم رو دارم میگم به شدت اشغاله اولاش خوبه ولی با این قیمت اصن توصیه نمیکنم جنس خوب بخرید همیشه واستون کار کنه .بنظرم این بسته اقتصادی ارزش خرید نداره ماوسش بعد چند بار استفاده ک کلا داغون شد اشغال خالص بود کیبوردشم شاید بعد یکسال هفته ای یکبار قاط میزنه واسه چند دقیقه از کار میفته ربطی به باطری هم نداره بنظرم جنس خوب بخرید در ضمن ماوس قبلی منم شیاومی سایلنت بود که اونم ۱.۵ ساله خراب شد خورد تو ذوقم واقعا امیدوارم سری بعد تو خریدم دقت کنم
5,کیبوردش واقعا حس خوبی میده با اینکه سخت پسند هستم از نظر خوب بودن متریال کالای خریداری شده. هم بدون صدا هست و زمان لمس مقداری حس نرم بودنش حس میشه که انگار متریال خوبی استفاده شده. موسش فقط یک مقدار بزرگ هست از نظر طولی که برای دست های کوچیک فکر کنم زیاد مناسب نباشه اما بصورت کلی خریدش رو پیشنهاد میدم از همه نظر.
5,کیبوردش خیلی راحت و روان هست ولی شاید موسش برای دست بزرگ جالب نیست. یک دانگل داخل موس داره که هم موس و هم کیبورد با اون کار میکنن و دوتا باتری نیم قلم آلکالاین داره یکیش میخوره به موس و یکیش هم میخوره به کیبورد. خودتون میتونید با باتری قابل شارژ تعویضش کنید
5,روان فقط فارسی نداره
5,هم خوش دست بود و هم خوش قیمت. هنوز زوده واسه نظر قطعی ولی تا اینجا که راضی بودم
5,به نسبت قیمت مناسب و خوب است 
4,به نظرم در مقایسه با کیبوردها و موس هایی که از طریق سیم متصل می شوند، مزیت های زیادی دارد. برای امور روزمره و معمولی خوب و کار راه اندازه. میشه برای کامپیوتر یا تلویزیون هوشمند ازش استفاده کرد.
4,"روی دکمه ها کیبورد حروف فارسی نیست کیبورد دکمه های نرم و روانی و ارتفاع مناسبی جهت تایپ داره موس ی خورده خشکه یعنی وقتی کلیک میکنید صدا میده حالا اگه تو گیم باشید و پشت سر هم کلیک کنید شاید صداش اذیتتون کنه نسبت به قیمت و کیفیت و امکاناتی که داره ارزش خرید داره"
3,انتظار بیشتری داشتم
5,تو این رنج قیمت واقعا عالیه هم شیکه هم خوش دست  من که خیلی راضی هستم .موسش هم صدای کلیکش خیلی تو مخ نیست واسه کسایی که شبها تا دیر وقت کار میکنن پای سیستم انتخاب مناسبیه
5,کاملا خوش ساخت و ظریف
4,تو این رنج بودجه گزینه ی مناسبیه
5,خوب بود.      
5,عالی و خوش دسته هم اندازه خوبی داره سبک و شل و ول نیست موسش هم و اقعا عالی و خوش دسته
5,بسیار خوب و با کیفیت
5,من که خیلی راضی بودم
5,آقا برای هر کاری مناسبه و باهاش عشق میکنید و اصلا خستتون نمیکنه.
4,به نسبت قیمت خوب بود
5,یکی از بهترین ست کیبرد و ماوس هایی که تو این رنج و بالاتر هم میتونید تهیه کنید همینه کاملا قابل قیاس با محصولات دو سه برابر قیمت لاجیتک هست  برای چندمین بار از این ست خریداری میکنم و راضیم
5,سه ماهه دارم حد اقل ۵ ساعت در روز استفاده میکنم و باتریش هنوز تموم نشده. هر دوش یک دانگل داره که امتیاز خوبیه. در کل تجربه استفاده خوشایندی ازش دارم
5,کیبورد خوبی است ولی اگر تایپ زیادی دارید مناسب نیست
3,ببینید در کل خرید خوبی برای من نبوده، از کیبوردش راضی ام ولی غلطک اسکرول موسش بعد از 2 ماه درست کار نمیکنه، که خیلی آزاردهنده است
1,بعد از سه ماه بعضی از کلیدهای کیبرد با تاخیر کار میکنه و بعد از چهار ماه چند تا از کلیدها از کار افتادن. ضمن اینکه این کالا گارانتی هم نداره.
4,خیلی عالیه سایز موسشم برای دست من اوکی بود
4,خوش دسته فقط فارسی نداره بده
5,عالیه
4,همون روز اول نوشابه رفت داخلش مجبور شدم باز کنم کمی باز کردنش سخت بود چند تا پیچ زیر نگه دارنده های لاستیکی بود بعد به زور باز شد. چند تیکه پلاستیک هم داخلش مربوط به گیره ها شکست یک کیت کوچک در سمت راست بالا داره حدود دو سانت در سه سانت بخش بالایی کلید ها به راحتی میشه کامل با اب شست بر خلاف کیبورد های قدیمی کلید ها جدا نمیشه در بخش زیرین  سه لایه ورق شیشه ای وجود داشت که اولی کلید های کوچک در اون قرار داشت دومی فقط یه ورق جدا کننده بود و سومی مدارها قرار داشت نوشابه بینش رو پاک کردم و تست گرفتم دیدم کلید شیفت ها قاطی دارم حروف میزنه با دقت با یه دستمال کاغذی و یه نمه اب رو روقه اخر مدار ها رو تمیز کردم خدا شکر مشکل حل شد و کیبورد کار کرد. یک تیغه فلزی هم داخلش بود که فکر می کنم به خاطر استحکامهه بر خلاف نظر بقیه دوستان موس خوبی داره. لیزر نیست و اصلا نوری نداره 
5,عالی
5,برای بهبود عمر لب تاب تو خریدش شک نکنید
5,کیفیت قابل قبول کیبورد و بی صدا بودن دکمه ها
5,من از فروشگاه فیزیکی گرفتم ، کیفیت دکمه ها و کیبوردها خیلی خوبه و برای تایپم با کیفیت طراحی شده ، نسبت به قیمت واقعا میرزه
5,ممنون از دیجی کالا 
3,برای یکی از دوستان تهیه کردم در استفاده اول ظاهر قشنگی داره و قفط تنها مشکل برای من ماوس بود که اون هم سلیقه ای هست 
4,به نسبت قیمتش خیلی خوبه و راضیم 
3,موسش خوبه و حساسه ولی ارتفاع کیبورد برای من یکم بلنده و آنچنان هم بی صدا نیست . دوس داشتم مثه کیبورد لپ تاپ صاف و کم ارتفاع و بی صدا باشه
5,خیلی خوب و عالی
5,برای کسانی که کارهایی چون تایپ و اینا انجام میدن توصیە میشه، برای گیم مناسب نیست
5,عالیه
4,خوبه به نسبت به قیمت
5,خوب بود، فقط کاش واسش برچسب فارسی هم میذاشتن‌ 
2,من نظرم رو بعد از یکسال استفاده میگم. در کل زیبا هست اما مشکل من با موسش هست که واقعا خوب نیست،صدای عجیب ازش در میاد،خود به خود قطع و وصل میشه و … اما کیبوردش مناسب هست و مشکلی نداشته تا حالا فقط انتظار نداشته باشید دکمه هاش خیلی نرم و روان باشه،اما مناسبه.
5,در کل کیبورد خوبیه و برای شمایی که برنامه نویسی و یا حتی هم برنامه نویسی هم گیم خیلی جواب میده فقط موسش اذیت میکنه
4,دو روز قیمت اومد پایین ۸۸۰ خریدم که از قیمت راضی ام. کیفیت کیبرد هم واقعا خوبه باید ببینم مصرف باتریش چطوره
5,"به محض باز کردن پک حس خوب کیفیت رو بهت میده اصلا قابل مقایسه با محصولات هم قیمت خودش نیست من سایر برندها رو داشتم اما این حس خوبی داره مخصوصا کیبوردش"
2,کیبرد قشنگیه، موسش که کلا هیچی بی صداست کیبرد اما دکمه هاش سفته و بعد از 2-3 ساعت کار اذیت میکنه دست و انگشتارو اصلا روی تایپ بلد مدت حساب نکنید. ممنون
