1,کالا خراب است و هیچ داده‌ای رو باز نمی‌کند
1,بدردنخور بود
5,خیلی عالی
1,فلش برای من ارسال نشده با اینکه هزینه فلش و پرداخت کردم ولی توی جعبه محصولات نبود
4,مارک معتبر و خوب . در طولانی مدت مشخص میشه که تا چقدر کار میکنع
1,نا مناسب
5,ممنون
5,فعلا که خوبه
4,خوب بود به موقع به دستم رسید
4,خوبه
5,سرعت بالا عمربالا  کیفیت ساخت عالی  حتما بخرید 
5,خوب پر سرعت گارانتی
1,همه ی فایل هام حیف شد گارانتیش انقدر جای پرتیه ک ترجیح میدید نرید نخرید افتصاحه
5,سرعت انتقال فایل عالی
5,سرعت عالی کیفیت عالی  ظاهر عالی 
4,فلش خوب و با کیفیت
1,بعد از يک ماه از کار افتاد
3,من دیر به دیر از فلش استفاده میکنم فقط برای ارشیو یه ورتی 64 خریدم خوب بود و خواستم دوباره ار همون بخرم اما فروشنده ش خیلی منفی گرفته بود برای همین دلو زدم به دریا و اینو گرفتم که فروشنده ش مثبت 90 درصدی داشت از ورتی که سرعتش بهتر بوده و کمتر داغ میکنه ببینم عمرش چقدره
5,کار راه اندازه، سرعتش معمولیه، مقاومه
4,"این برند امریکایی هست قبلا وایکینگ من ساخت تایوان بود که هنوز کارت حافظه هاش را دارم بعدا گفتن برای دور زدن تحریم رفته چین شده ویکو من چینی !! ولی بازم برند خوبی هست و مهم گارانتی مادام از طرف شرکت معتبره سگال هست ، من برند وایکینگ من  را قبلا برای شرکت فرستادم سریع برام تعویض و ارسال شد قیمتشم بنظرم مناسبه من صدو پنجاه و پنج خریدم"
3,عالییییییی
3.3,خود فلش مموری به خودی خود عالیه اما اینکه گارانتی مادام العمر داره عالی ترش هم میکنه
4.9,کیفیت خوب نسبت به قیمت
5,با این قیمت ارزش خرید دارد.
4.7,من خیلی گشتم با این قیمت خیلی مناسبه 
4,سرعت انتقالش خوبه  من برای عکس و فیلم میخواستم ولی دوتا ضعف داره  یکی زود داغ می‌کنه و دیگری حجم واقعیش ۵۸ گیگ نه ۶۴ تا در کل بدنبود تا ببینم بعداً موقع استفاده چطوره
4,پیشنهاد خرید می دهم. محصولات ویکومن مناسب هستند
5,ویکو مارک خوبیه مخصوصا گارانتی داره
3,انچنان قابل قبول نبود
4,سرعتش خوبه، به تلویزیونم نخورد
5,نسبت به قیمتش واقعا به صرفه است. ممنون از دیجی کالا 
5,سرعت خوبی داره
4.9,"خیلی خوبه- بخرید - فلش 32 در محدوده 100 مناسب و کارا گیر میا  و این قیمت  برای 64  مناسبه و عاقلانه "
