4,خوبه بخرید 
4,تشکر از فروشنده محترم
3,با توجه به قیمتش خوبه
4,عالی
5,"میز تلویزیون ساده و اسپرت است  پایه ها بسیار کوتاه"
4,طراحی خیلی خوبی داره و محصول هم بدون ضربه دستم رسید فقط اینکه جنس بسیار معمولی هست و و اگر مستاجر هستید و هی جا به جا میشید خیلی پیشنهاد نمیشه بهتره ام دی اف بگیرید البته حداقل باید 6 ت پولش رو بدید
1,سلام،از فروشگاه وودمن دکور خرید نکنید،میزی متفاوت از میزی که تو عکس هست ارسال میکند،نمیدونم چرا به شعور خریدار توهین میکنند وهر چیزی که خودشون دارن ارسال میکنن
5,خیلی جذاب و شیکه فقط ارتفاعش بنظرم کمه ولی بازم اونقدر قشنگه که وقتی دیدمش عاشقش شدم و برخلاف حرفای بقیه که میگفتند از دیجی کالا نخر اشتباه میکنی اصلا اشتباه نبود این کارم و نسبت به بیرون خیلی قیمت بهتری داره محصولات دیجی کالا مرسی از دیجی کالا و فروشنده عزیز
0,نسبت به قیمتت واقعا خوبه ‌. رنگ مشکی خریدم که رنگ مشکی از فروشنده ای که من خریدم مشکی مات بود
5,عالی و زیباست
1,بعد از 10 روز یک کالای شکسته تعمیری تحویل دادن الان هم یک هفته است میخواهند مرجوع کنند هیچ کسی پاسخگو نیست
1,من مدل تو عکس رو میخواستم ولی یه چیز دیگه فرستادن واقعا که
5,خوب
4,روی هم رفته بعد از حدود یکسال استفاده از این میز راضی بودم 
4,خوب‌ بود
5,بسیار عالی یراق آلات عالی و درب ها ارام بند داشت. بسیار خوب بسته بندی شده بود
1,خیلی  بی کیفیت هست 
5,ممنونم
4,خوبه زیبا شیک 
4,خیلی باید درهاشو با احتیاط بازو بسته کرد ، لولاش خیلی ضعیفه
3,"دوستان طول کار ۱۸۰ هستش برا تی وی ۶۵ اینچ عالی ی چندجایی زدگی داشت که عکسشو گذاشتم  ولی در کل راضی خیلی قشنگ ست شد"
3,در کل توصیه میشه
4,قرار بود تقریبا بعد ۸ روز تحویل بگیرم دقیقا روز ارسال تماس گرفتن که آماده نیست تازه چند روزم تعطیل بود بعدشم هی گقتن امروز هی فردا. خلاصه این پروسه بالای ۲۰ و خورده ای روز طول کشید
5,نسبت به قیمتش عالیه
2,ایراداتی داره ولی خوب به قیمت می ارزه
5,در کل به نسبت قیمت، مقرون به صرفه است. مطابق با عکس محصول بود. 
4,سالم رسوندن
4,با توجه ب قیمتش ب صرفه است
3,کیفیت چندان بالایی نداشت ولی قیمتش خوب بود و کارمو راه انداخت .
4,من راضی بودم خوبه
5,قشنگ و زیباست
5,بسته بندی مناسب و سالم بودن کالا
5,دقیقا طبق عکسای نمونه ساخته شده
1,خراشیدگی و زدگی داشت و فروشنده به تعهداتش عمل نکرد و متاسفانه میز تلویزیون رو با یک لایه سلفون تحویل داد و مرجوع کردم ممنون از دیجی کالا
5,هم زیبا هم با کیفیت
4,نسبت به بازار به صرف تر بود،وسالن
5,خوشگله و راضی بودم
4,با تشکر از دیجی کالا
1,دوستان نخرید
5,"مهمترین ویژگی مثبت این خرید، تحویل یک و نیم روزه بود کاش بقیه تولید کننده ها و فروشنده ها هم یاد بگیرن!"
2,محصول ارسال شده با عکس آگهی فرق داره
5,خوبه راضیم 
4,خرید این محصول را توصیه میکنم 
5,عالی
5,دقیقا مثل عکس بود تمیز و محکم بسته بندی شده بود فقط دیر رسید
5,من خیلی راضی بودم خیلی عالی و شیک تمیز بود ، تحویلش به موقع بود لطف کرده بودن بسته بندی کرده بودن ، با تشکر از دیجی کالا 
5,خوبه  بخرید و لذتش رو ببرید
5,خیلی عالی بود واقعا عالی بی نقص و ایراد ب دستم رسید و حتما حتما پیشنهاد میدم بااین قیمت و کیفیت خوبه واقعا.
5,خیلی زیاد راضی بودم از خریدم زودتر هم برام ارسال شد
4,در کل خوبه
4,پسند شد با توجه به قیمت مناسب کیفیت قابل قبول و شیک بود
1,خوب بود
5,خیلی زیبا و با کیفیت بسته بندی عالی تحویل طبقه سوم در کل همه چیزش عالی بود
4,برای دوستنای ک براق میخوان اینکار مات هستش درکل خوبه
4,میز بسیار زیبایی است و قیمتش هم خیلی مناسب است
1,اولا کالا رو خیلی دیر آوردن.دوما دم در گذاشتن و برای یک طبقه هزینه جدا گرفتند
4,با کیفیت نسبت به قیمت
4,قسمت جلوی میز رنگ ان آسیب دیده است
5,"من کالا های چوبی دیگه ای هم از دیجی خریدم قبلا، اما این میزخیلی خوب بسته بندی شده بود و علاوه بر چند لایه پلاستیک و ضربه گیر ،گوشه های میز هم ضربه گیر هایی از جنس پلاستیک سخت گذاشته بودند تا آسیب نبینه و همچنین خود میز هم کیفیت خوبی داشت جنس ملامین و رنگ سفید مات بود برچسب کنترل کیفیت هم داشت.  در ضمن درب باکس های میز از سمت بالا به پایین باز میشود  در کل ممنونم از دیجی و فروشنده کاکتوز."
5,نسبت به قیمتش عالی بود
5,خوب بود ....
5,خیلی تمیز و دقیقا مطابق عکس بسته بندی هم عالی بود
5,عالییی تمیز
5,خیلی عالی و قشنگ بود قیت مناسبی هم داشت 
5,خود کالا که زیباست و ساده،، قبل ارسال هم دو رنگ برای مقایسه و انتخاب نهایی فرستادن ،تا درب واحد طبقه اول هم زحمت حمل و نقل رو کشیدن
5,جنس محکم و اصل ظاهر شیک جا دار  درکل راضی بودم
4,من از خریدم راضی هستم.یه مقدار شاید میتونست تمیزتر و دقیق تر کار بشه ولی با توجه به قیمت در کل کیفیتش خوبه.
5,این نوع میز بیرون با قیمت بالاتر میفروشن ، حدود دوماه دنبال یه میز ساده و بزرگ بودم و تو مغازه ها خیلی کم بود که تو دیجی کالا پیدا کردم فقط تنها سختی ای که برای من داشت این بود که ارسال به کرج نداشتن و مجبور شدم تهران تحویل بگیرم و دوباره هزینه باربری بدم بیارم کرج
4,رنگشو خيلي دوست داشتم، دودي. ميز ساده و شيكيه.
4,فعلا که خوبه
5,تمیز و خوش قیمت
3,میز لق میزنه رو سطح صاف!! درش باز میکی گیر میکنه به زمین!
3,عجیبه من دوماه پیش گرونتر خریده بودم! درکل خوبه میارزه
5,"مطابق انتظار و مثل عکس خیلی شیک و ساده سالم پرسنل تحویل دیجیکالا لطف کردن یه طبقه اضافی هم کمک کردن آوردن  فروشنده کاکتوز محصول رو بدون ایراد و به موقع برامون فرستاد"
5,واقعا نسبت به پول خیلی عالیه
5,"من از خرید این میز راضی هستم  رنگ طوسی شیک و تمیز"
2,بهتره درکارتن قرار داده شورد پلاستیک کافی نیست
5,عالی قیمت مناسب
5,بسته بندی عالی بود ،بدون زدگی و عیب به دستم رسید
5,"تو نعمت آباد قیمت بالاتر بود و زیبایی چندانی نداشت در نهایت از دیجی کالا خریدم و راضی ام اقوام هم که دیدن خیلی تعریف کردن ساده و در عین حال شیکه"
4,فقط پایش شکسته بود و پشتش یکم ترک داشت ولی من راضیم
5,من از فروشگاه کاکتوز خریدم بسته بندی عالی و با دقت بود و اشنتیون هم گذاشته بودن و کیفیت خوده میزرهم قابل قبوله و بسیار شیکه خیلی ارزش خرید داره با این قیمت
2,من از فروشنده کاکتوز سفارش دادم، جنسش برخلاف چیزی که گفته بودن اصلا کیفیت نداره، معلوم نیست با گچ یا رنگ بعضی جاهاش رو درست کردن، توی عکس کاملا مشخصه، من خودم اصلا راضی نبودم از خریدم، قرار بود تا در واحد بیارن ولی فقط تا پارکینگ آوردن و خودمون دو طبقه آوردیم بالا، در کل من این فروشنده رو توصیه نمیکنم، میخواستم از نفیس صنعت سفارش بدم چون خیلیا ازش راضی بودن ولی به دلیل عدم امکان ارسالشون مجبور شدم از فروشنده کاکتوز بگیرم که الان راضی نیستم
5,خرید این کالا با توجه به قیمت مناسب و ظاهری زیبایی که داره بسیار مناسب و مقرون به‌صرفه هست اما به نظرم توی حمل و نقل بخاطر صرفه‌جویی اقتصادی فروشنده،   بارگیری و تخلیه اصولی انجام نشده بود و کالا هنگام تحویل دچار آسیب دیدگی جزئی
5,جنس فوق العاده ای داره خیلی خوب ساخته شده اما متاسفانه فروشنده برای حمل به تعهداتش عمل کرد و خیلی مشکلات بوجود آورد
5,زیبا جنس خوب تمیز کار‌ شده بود
5,خیلی ساده و شیک بود و من از خریدم خیلی راضی هستم قیمتش هم عالی بود در مقایسه با بازار
5,خیلی خوب بود
5,در کل راضیم و به عنوان هدیه که نگران بودم خیلی راضیم
5,یکساله استفاده کردیم خیلی راضی هستیم
2,"سلام  اگر ابعاد و اندازه میزها قید شود انتخاب راحت تر انجام میشود این که مشخص نیست برای چه تلویزیونی با چه ابعادی مناسب است نمیشود انتخاب کرد یا حداقل قید شود برای چه نوع تی وی مثلاً  29 یا 32 یا 40 یا 43 یا 50 یا 55 یا 65 یا 75 یا 85 یا  مناسب است  الان بنده برای ،lED.  سایز75  میز لازم دارم چون ابعاد مشخص نیست نمیشود انتخاب کرد یا حداقل شماره تماس برای این نوع لوازم اعلام می‌شد که جنس ارسالی مناسب با درخواست باشد و عودت نشود   ممنون"
5,واقعا عالی هست به  کسانی که سبک مدرن رو میپسندند پیشنهاد میکنم
3,بنظرم بد نیست نسبت به قیمتش 
0,بدون آراد بود ممنون
3,میکن امکانات ظاهری پایه پلاستیکی والا ما پایه ندیدیم شما دیدید به ماهم اطلاع بدید
3,میز زدگی داشت فروشنده با تاخیر فرستاد و من خودم دم در تحویل گرفتم و میز به اون سنگینیو خودم بردم بالا!
5,واقعا به نسبت قیمت فوق العادس
0,بسیار راضی هستم
4,زیبا وشیک ممنون از تولید کننده
5,"همون  که تو عکس بود رنگ طوسی"
