4,خوب و با کیفیت
1,کیبورد کار نمیکند
5,کیفت عالی داره نسبت به قیمتش یه خوبی داره ک وقتی کامپیوتر خاموش میشه کیبرد و موس هم خاموش 
5,تسکو حرف نداره  از خریدم راضی هستم
3,مال من زود خراب شد ممکنه بچم خرابش کرده باشه یا اینکه مشکل خود کیبرد بوده
5,کارایی بالا دکمه روان  در مجموع نسبت به قیمت عالی بود
5,مارک معتبر و کیفیت بسیار خوب
5,عالی
1,کیبرد محصول به شدت بی کیفیت هست و تقریبا غیرقابل استفاده می باشد. حروف با تاخیر بسیار زیاد تایپ می شوند و گاهی اصلا کار نمی کند.
4,موس با کیفیتی داره، مصرف باتری کم، خریدش ارزش بالایی داره
5,با توجه به قیمت محصول، عالی بود
5,     خوبه.         
4,خوب بود
4,تسکو محصولاتش خوبه
4,خوبه بد نیست
5,قطعا از خریدش پشیمون نمیشی
3,با توجه به قیمت یه کیبورد معمولی کار راه اندازه
5,"*فلش یو اس بیش تو موس جاساز شده  برام یکم طول کشید پیداش کنم در کل توصیه میشه"
4,تمام کلید هاش سالم بود اما گارانتی اش تاریخش گذشته بود
4,با تخفیف خریدم راضی بودم
1,"کیبوردی که دریافت کردم اصلا خوب نبوده مرجوع هم زدم چون اصلا نمی خواستم  ولی دوباره بهم برگردانده شده"
5,ممنون
5,"پیشنهاد میکنم بخرید.من قبلا این مدل رو داشتم عالیه"
5,عالییی حتماً بخرید عالی
3,خیلی عالی عستش
5,حتما پیشنهاد میکنم خیلی عالی هستش مخصوص گیمینگ
5,عالی
2,"من این موس و کیبورد رو دوساله که دارم استفاده میکنم.. کیبوردش هم از نظر تفکیک دکمه ها و هم از نظر نرمی خیلی خوبه ولی ایرادی که داره دکمه هاش موقع تایپ خیلی صدا میدن.  موسش خوش دسته و دکمه هاش هم نرمه.  ولی ایراد بزرگش بی کیفیت بودن غلطک وسطش هست. غلطک وسط موس چند وقتیه که از کار افتاده و کلی مکافات دارم. مصرف باتری موسش هم زیاده تقریبا ماهی یه باتری قلمی آلکالاین میندازم روش. ولی مصرف باتری کیبورد کمتره."
5,"اگر میخواید یه جنس داغون که دیجیکالا هم حاضر به پس گرفتنش نیست بخرید حتما این کیبورد رو بخرید و تو سطح اشغال بندازید واقعا ممنون از دیجیکالا بابت خدمات مرجوعیش، سه بار مرجوع زدم تایید کرد اما نیومد ببره بی نظیری دیحیکالا بی نظیر حتما به همه توصیه ت می کنم"
5,عالی
5,عالی
1,"با سلام کیبورد و موس رو با توجه به دیدگاهها ،قیمت و تجربه استفاده از محصولات این شرکت خریدم. اینو گرفتم دیدم کارتونش پاره شده. همونجا حدس زدم مرجوعیه. باز کردم یه ذره کار کردم دیدم مشکلی نداره. بعد رفتم تایپ کنم که ببینم چطوره. یه کلمه رو دیلیت کردم، بیست تا اینتر زد. دوباره یه کلمه دیگه رو پاک کردم. بیست تا اینتر زد. ورد رو بستم، خودش یه نرم افزار دیگه رو باز کرد. برنامه جدید رو بستم. خودش سیستم رو ری استارت کرد... سریع سوکتشو درآوردم. حالا نمیدونم همین یه دونه شانس من اینجوری بود،یا با ویندوز من که ۷ بود همخونی نداشت. در نهایت مرجوع کردم. قیمتش و نرمی دکمه هاش مناسبم بود. اما نتونستم استفاده کنم. از دیجی عزیز خواهش میکنم جنس مرجوعی رو دوباره برای دیگران ارسال نکنه.دوستان حتما کیبورد رو تو تایپ کردن تست کنید. ممنونم."
5,کارایی خوبی داره و کلا برند مطمینی است.
5,خوب
5,کاملا راضیم خوبه برای گیم بدنیست برای تایپ خیلی عالیه موس عالیه مکم مصرف
4,خوب و محکم و عالی و با قیمت مناسب
3,کیفیتش معمولیه ولی خوب کار میکنه
5,نسبت به قیمت عالی 
5,عالیه
5,جنس عالی داشت تو تخفیف خریدم بلوتوثی هم هست
2,به طور کلی کیبوردی نبود که مورد پسند من باشه، کار کردن با کیبورد برای من راحت نیست و کیبورد لقی زیادی داره. برای فشردن کلیدها فشار بیشتری باید وارد بشه.
5,من از بیرون گرفتم و خیلی راضیم تا الان که مشکلی نداره تا فاصله دو متری برای من راحت جواب میده رو جعبه تا ۱۰ متر نوشته اما من تست نکردم فاصله ده متری رو
3,به نسبت قیمت خوب است
4.3,"اگر دنبال محصولی هستید که با قیمت مناسب، کاملا نیاز شما به ماوس و کیبورد رو رفع کنه این محصول رو پیشنهاد میکنم. برای دفتر کار خریدم و کاملا راضی ام. "
0,اگر ماوسش دکمه دابل کلیک هم میداشت خیلی خوب بود
3.9,تسکو حرف نداره
3,کیفیت تسکو خیلی نسبت به قبل پایین تر اومده 
5,خرید کالای ایرانی حس خوبی داره
4,کلیدهای نرم و با دوام 
0,خوب بود
3,"دانگل usb ارسال نشده بود  رنگ کیبورد دورنگی داشت"
0,واقعا عالیه
5,خوبه پیشنهاد می کنم
0,قیمت مناسب
