4.3,"بسته به نیاز خودم، من از خرید خودم بسیار راضی هستم. درایور این دستگاه به راحتی روی ویندوز 10 از طریق دیسک همراه آن نصب خواهد شد، همچنین داخل دیسک نرم افزار total media و سریال آن موجود است که با نصب آن نیاز نرم‌افزاری شما نیز برای جست‌وجو و پخش شبکه‌ها رفع خواهد شد. جهت استفاده از دستگاه داخل لینوکس هم فقط کافی است نرم‌افزار kaffeine را نصب کنید و پس از جست و جوی شبکه‌ها به راحتی از دستگاه استفاده کنید؛ لینوکسی که من روی آن تست گرفتم ubuntu 18.04.3 بود. البته نتوانستم با نرم‌افزارهای DVB-T روی گوشی اندروید از دستگاه استفاده کنم چون هیچ یک از نرم‌افزارهایی که من تست گرفتم درایور این دستگاه را پشتیبانی نمی کردند که البته مورد نیاز من نبود و فقط بررسی کردم. علی‌رغم عکس‌ها، داخل بسته‌بندی دسنگاه یک آنتن بسیار ساده و ضعیف هم وجود دارد که با توجه به منطقه مسکونی من و طبقه دوم بودن اصلا سیگنالی دریافت نکرد (البته من از آنتن قوی تر هم انتظار سیگنال داخل ساختمان نداشتم) اما بعید میدانم این آنتن برای محیط بسته عملیاتی باشد؛ این دستگاه به راحتی و بدون نیاز به تبدیل، با اتصال به آنتن هوایی ساختمان، سیگنال عالی دریافت می‌کند."
0,تو پیشنهاد ویژه خوبه ولی اگه گیرنده خودش قوی می‌بود بهتر بود
3,ممنون از فروش محصولات خوب.
0,اگه دنبال یه گیرنده خوب میگردی که ارزون باشه همینه ولی فعالسازیش کمی سخته به خاطر اینکه برنامه کد لایسینس میخواد که نزده هیچ جا باید از توی سرزمین دانلود پیدا کنی برنامشو
3,با برنامه های prog dvb و dvb wiver ست نمیشه
3.5,در نظر داشته باشید که حتما می بایست آنتن دیجیتا داشته باشید و اینکه ظاهرا نمیشود روی لینوکس خروجی گرفت.
3,من این وسیله رو دارم اگر میخواین روی گوشیتون شبکه های تلویزیون رو ببینین بخرین
2.7,انتن قوی می خواد
3,با سلام این گیرنده از کیفیت خوبی برخورداره.
4.1,سلام چندروزپیش خریدم اگه ازلوازمی که باید داخل جعبه باشه ونبود (شامل کنترل وسی دی راه انداز وپخش کننده) کیفیت خوبی داره وبرای خرید گزینه خوبیه.من قبلا یه مارک دیگه داشتم پایه انتنش جنسش ظریف بودزودمیشکست ولی این خیلی بهتره.
4.9,به نظرم یک وسیله بسیار کاربردی و با کیفیت هست و کاملا ارزش قیمتش رو داره
4.6,گیرنده کوچک ولی با کیفیت
4,از خرید کاملاً راضی هستم و پیشنهاد میکنم در خریدش تردید نداشته باشید
4.8,من گرفتم خیلی خوبه
4.2,"سلام این گیرنده یک روز هست که بدستم رسیده،اول از همه باید بگم که روی سیستم من (ویندوز 10) با نرم افزار total media که همراه گیرنده ارسال شد کار نکرد و مشکلش هم این هست که موقع کانال یابی از نرم ازار میپره بیرون،اگر شما هم مثل من این مشکل رو دارید برای استفاده از این گیرنده پیشنهاد میکنم جدیدترین نسخه نرم افزار DVBViewer Pro رو نصب کنید که خیلی از total media بهتره (توفیق اجباریه) چون هم EPG فارسی داره و هم تلتکس فارسی،ابتدا درایور موجود در سی دی همراه گیرنده رو نصب کنید بعد نرم افزار DVBViewer Pro رو بصورت کرک شده نصب کنید،هم نسخه کرک شده نرم افزار و هم آموزش کار کردن باهاش در اینترنت موجود هست در مورد گیرنده دیجیتال هم تا الان هیچ مشکلی نداشته و از کیفیت خوبی برخورداره و کاملا ارزش خرید داره ضمنا یک مورد فوق العاده که داره اینه که میتونید روی گشی های اندروید 4.2 به بالا هم کانال های تلویزین رو با استفاده از نرم افزار pad TV و گوشی که otg ساپورت کنه مشاهده کنید که عالی هست"
4.9,"بعد از کلی تحقیق و زیر و رو کردن همه گیرنده های دیجی کالا تصمیم گرفتم این گیرنده رو تهیه کنم الان هم از تصمیمم خیلی راضیم و میخوام تجربه خریدم رو به صورت کامل در اختیارتون بذارم. توی پک این محصول یک سی دی هست شامل درایور و برنامه های ویندوز و اندروید. به سادگی درایور مربوطه رو نصب می کنید و بعدش هم به کمک سریال نامبری که توی سی دی هست برنامه رو نصب می کنید. روی ویندوز 10 به راحتی ستاپ شد و هیچ مشکلی نداشت.  علاوه بر سی دی، یه آنتن آهنربایی کوچک هم توی جعبش هست که نه توی توضیحات نوشتن نه توی عکس هست! اما در جریان باشید که انتن هم داره. ولی انتنش فقط به درد فضای باز میخوره. من با اینکه طبقه چهارم هستم نتونستم با انتنش چیز خاصی بگیرم و خیلی لگ داشت. ولی اگر به یه آنتن قوی وصل کنید حرف نداره! روی دستگاه یک چراغ داره که به ظاهر سوخته و ای کاش سالم بود و موقع وصل بودن به لپتاپ روشن میشد!! در ضمن بسته بندی کالا خیلی بد بود و با منگنه و سلیفون بسته بندی شده بود!! اما گذشته از این مشکلات جزئی، کیفیت تصویر عالی بود. به سادگی ستاپ شد و به شدت user friendly بود. خریدش رو توصیه میکنم"
5,واقعا عالیه هیچ ایرادی نداره کیفیت تصویر عالی شبکه های hd   کیفیتش عالیه ، برای اتصال آنتن هم احتیاج به تبدیل نداره  حتما پیشنهاد میکنم بخرید
