4,نقطه ضعفش فقط نداشتن کنترل هست  یه انتن خوب هم اگه براش بگیرید کاملا کارتون رو راه میندازه
3,نسبت به قیمت کارایی ندارد
3,البته اگه به خود آنتن پشت بام تلویزیون وصل بشه خیلی خوب هست ولی خب کسی که این گیرنده دیجیتال USB مای جیکا رو می خره دلش می خواد که مثل فلش بتونه جا به جاش کنه وو همه جا از جمله تو سفر ازش استفاده کنه من طبقه سوم هست خونه مون و با آنتن خودش که خیلی کوچیک هست امتحان کردم اول بد نبود آنتن دهیش ولی بعد افتضاح شد.
3,درایور ویندوز ۸ و ۸.۱ و ۱۰ ندارد. درایور ۶۴ بیتی از اینترنت دریافت می‌شود ولی آنتن دهی ضعیف است.
5,جنس خوبی داره. من 4 سال پیش خریدم روی یک سری از گوشی ها کار میکنه و روی ی سری ها نه روی گوشی سامسونگ من کار میکنه. روی شیاومی نوت 9 نه متاسفانه. ولی کارمو را انداخت
4,در شهر های بزرگ مثل تهران آنتن دهی خوبی داره ولی در خارج شهر نیاز به آنتن داره
5,موجود کنید لطفا
5,سلام خیلی هم خوبه الحمدلله
1,توصیه نمیکنم 
4,"سی دی داخل پکیج خراب بود  تو اینترنت هم‌نرم افزارشپیدا نکردم به زحمت سی دی تونستم بزارم رو یه لپ‌تاپ بخونه"
3,مجبور شدم واسش جدا گانه یه انتن قدی بگیرم تا شبکه هارو بتونه جستجو کنه انتن خودشو بریزن دور فقط دانگلش به کارتون میاد و مراحل نصب سی دی ش واسه همه اسون نیست
3,"من از تامین کننده  آتی نت خرید کردم دستگاه سالمه و داره کار میکنه ولی گله ای که دارم از این شرکت اینه که ای کاش دستگاه نو برام میفرستادن.معلوم بود قبلا استفاده شده و پشت ویترین در معرض نور خورشید بوده.چون پلاستیک بسته بندیش زرد و کثیف شده و جلد سی دی همراهش هم کثیف و پاره بود. بهرحال من از دیجی کالا خیلی وقته نا امید شدم چون اصلا به نظرات مردم اهمیت نمیده ولی از تامین کننده ها میخوام یکم وجدان رو سرلوحه کارشون قرار بدن"
5,خیلی خوب و باکیفیت
4,حتما باید سیستم مورد استفاده از لحاظ رم و کارت گرافیت خیلی خوب باشه وگرنه ساپورت نمیکنه لب تاب من زیاد خوب نیست اما معمولی که متاسفانه ساپورت نکرد لا لب تاب دوستم که بالاتره تست کردم جواب داد و من مرجوع کردم هیچ کدوم از دوستان یا توضیحات فنی اشاره ای به حداقل نکرده بودن
4,لطفا موجودش کنید ...
5,یک گیرنده ی عالی هم برا لپتاپ و کامپیوتر؟ هم برا گوشی و تبلت. برا گوشی و تبلت باید نرم افزار PadTVHD رو از گوگل پلی نصب کنید و برا لپتاپ هم سی دی داخل بسته رو باید نصب کنی که شامل درایور دستگاه و نرم افزار اجرای دستگاه یعنی ArcSoft Total Media هستش. راستی تو بسته ای که دست من رسید، یه تبدیل OTG هم داشت. فقط ای کاش ارزون‌تر بود.
1,سلام نتونستم درایو نصب کنم از کجا تهیه کنم برنامه دریو رو
1,اصلا کار نکرد مرجوع کردم
3,اسم نرم افزار پخش موبایلش PADTV HD هست
3,والا تعجب میکنم از اینایی که میگن آنتن دهیش ضعیفه من با آنتن هوایی استفاده کردم راحت تمام کانالا رو گرفت البته غیر از کانالای اچ دی چون DVB T2 گرفت روی ویندوز ۱۰ 20H2 هم نیاز به هیچ درایوری نداشت خودش کار کرد البته قبلا گیرنده ایکس ویژن داشتم که خراب شده بود بجاش اینو گرفتم که شاید بخاطر همین درایور نخواست خلاصه سی دی داخل جعبه اش هم اصلا بازش نکردم ببینم چی داخلشه راستی داخل جعبه اش یه تبدیل otg هم بود برای اتصال به گوشی!
3,ریموت کنترل آن برداشته شده
1,"روی دوتا لپ تاپ و گوشی تست کردم خراب بود   مشخص بود که کالا مرجوع شده بود قبلا"
0,تو طبقات بالا خیلی خوب جواب میده.
5,"سلام  گیرنده دیجیتال T119  حرفه ای ترین گیرنده دیجیتال  کامپیوتر هست و تنها مدلیه که با یه تبدیل به OTG یا TYPE C  میتونید رو گوشی اندروید هم استفاده کنید . اکثر نظر ها که این کالا رو توصیه نمیکنن مشکلشون گیرندگی این دستگاه هست . با توجه به سیگنال موجود در مکان شما این گیرندگی متفاوت هست .اگر جایی هستید که سیگنال ضعیف هست حتما نیاز به انتن هوایی دارید .متاسفانه ارسال سیگنال از مبدا قوی نیست و بعضی از مکانها رو پوشش نمیده و عدم پوشش مشکل از گیرنده نیست . هر انتنی که برای تلویزیون معمولی کار کنه , با همون انتن T119 هم جواب میده . Mygica  یکی از معتبر ترین شرکتهای تولید کننده گیرنده دیجیتال در دنیا هست که در امریکا و اروپا نماینده فروش داره و نمیتونه محصول بد تولید کنه . متاسفانه ارسال سیگنال ضعیف باعث عدم رضایت بعضی از دوستان شده . در صورت هر گونه ایراد شرکت فروشنده به خوبی جوابگو هست از نصب تا اجرای نرم افزار . بهتره قبل از خرید از سیگنال محیط مطمین بشید ."
0,"خوبه ولی برای من که لپ تاپم درایو نداره با زحمت نصبش کردم آنتنش هم خیلی قوی نیست"
0,"اصلا آنتن نمیده جاهای مختلف هم امتحان کردیم فایده نداشت"
2,سلام من کمتر از یک هفته این گیرنده رو خریدم، هیچ کاری نتونستم انجام بدم، برای دریافت تلویزیون باید آنتن هوایی داشته باشم، ۲۴۰ هزارتومان آنتن خریدم، خود این دستگاه رو هم ۳۴۰ خریدم، هیچ کانالی نگرفت که هیچ، گیرنده شناسایی نمیشه که هیچ(روی دستگاه های مختلف امتحان شد)، کلا دیجی روی کالا هیچ نظارتی نداره،
0,"بعد دو ماه مصرف، به عنوان یک مصرف کننده که ۱۰ ساله از مارک های متفاوت استفاده نظرم رو در اختیارتان می‌گذارم: ۱. جنسش نه عالیه نه ضعیفه. ۲. باید یک آنتن قوی سیار مثل آنتن 90 که حدود 40 تومنه برایش تهیه کنید تا خوب عمل کنه. ۳. نرم افزارش تو ویندوز سون بهترین عملکرد رو داره ولی کلاً نرم افزار مدیا خیلی قوی نیست و بهتره از نرم افزار های دیگه که قوی تر هستند استفاده کنید. ۴. گاهی تصویر بعد مدتی استفاده تیک میزنم که باید نرم افزار رو ببندید و دوباره اجراش کنید تا درست شه."
4.5,خیلی شیک و زیبا و جمع و جور که به راحتی با آندروید باکس هماهنگ شد و خیلی خوب با یک آنتن رومیزی برقی ، شبکه های hd رو هم ساپورت کرد. یک مبدل otg داره برا وصل کردن به گوشی های اندروید و یک آنتن کوچولوی معمولی که یقینا چندان کاربرد برا همه جا نداره 
4,بیرون ارزون تره
5,"بهترین گیرنده دیجیتال عالی و با کیفیت قابل استفاده در ویندوز و اندروید"
4,7 سال استفاده کردم خوب بود
4,عالیه ولی نویز داره منظورم اینه که یهو یه صدایی میاد ولی در کل خوبه
5,جنسش خوب بود بسته بندیشم عالی
5,بهترین انتخاب با کمترین هزینه
5,سلام خدمت خریداران اگه میشه بعد از خرید این گیرنده بعد از گذاشتن نظر ازش عکس هم بزارید هم از خودش و هم از کیفیت تصویرش تا بتونیم با شناخت  بهتر خرید کنیم . ممنون.
5,فقط میتونم بگم عالی در میان همه
5,پیشنهاد میکنم خریداری کنید 
3,با انتن هوایی هم انتن دهی جالبی نداره.شاید تو منطقه ما اینجوریه ولی من خوشم نیومد
5,از هرلحاظ عالی خیلی سریع وصل شد هم به موبایل هم لب تاب فقط1بدی داره که کانالهای hdرو نمیگیره من تست کردم فقط33کانال گرفت 10 تا تصویری باقی رادیو بود در کل خوب بود با کیفیت بدون قطع وصل
4.9,"من که راضیم ازش... تو ویندوز 10 اول درایور رو نصب کردم.  بعد نرم افزار total media 3.5 رو نصب کردم...  لایسنس این نرم افزار تو سایت ها پیدا میشه... با همین انتن همراه خودش کانل یابی کردم و جواب میده کاملا..."
5,واقعا قدرت مند هست و با کیفیت و نیازتون رو از داشتن تلوزیون رفع میکنه، من خودم دانشجوئم و واقعا خیلی نیازم بود،واسه فوتبال و..،با یه آنتن برقی کاملا جوابه.
3,من چند سال پیش خریدم  سی دی برنامه بعد از نصب بار اول   دیگه نصب نشد  با دوم که ویندوز  جدید نصب کردم  الان هم  هر سایتی  جسجو می کنم درایور  برای دانلود نیست و ......
3,توصیه می کنم بخرید
5,بسیار عالی و کابردی
4,ی کم کار داره تا باهاش یاد بگیرید اماچیز خوبیه
4.1,سلام خدمت دوستان پس از یکسال استفاده عرض میکنم به کامپیوتر و لبتاپ و گوشی وصل میشه اگر خونتون انتن داره بخرید اگر بد انتن میده نخرید کلا ولی درکل من بعد از یکسال استفاده میگم خوب بود بخرید
3,انتن بی خودی همراهش بود ...خودشم که فقط به کامپیوتر میخوره فکر کردم مال تلوزیونه  برام بلا استفاده مونده در خریرم اشتباه کردم مقصر خودم بودم دقت نکردم شایدم واقعا چیز خوبی باشه ولی انتنش به درد نخوره
4,"محصول خوبیه ولی بدون آنتن هوایی یا ی آنتن قوی عملا بکارتون نمیاد روی سی دی نرم افزار لایسنس نداشت برای من ک با لایسنسای اینترنت هم کار نکرد مجبور شدم با بلیز تی وی اجراش کنم ولی در کل خوبه کار راه اندازه انتن خودش خیلی ضعیفه برای من که تو فضای بازم آنتنش جواب نداد اصلا ب هوای انتن خودش نخرین"
0,"اینکه خروجی آنتنش بصورت فیش مادگی هست خوبه ولی آنتنی که همراهشه ضعیفه و سیمش کوتاهه باید آنتن رو جای خوب بزارید تا آنتن بده گیرنده مثل نظرات قوی نیست و معمولیه"
0,"در یک کلام عالیه ، عالیه عالیه  از هر نظر نیازتون رو برای داشتن تلویزیون رفع می‌کنه خودش یه آنتن کوچیک داره که من ازش استفاده نکردم و کابل آنتن هوایی رو وصل کردم بهش ، تبدیل و اینها هم نمی‌خواد  فقط قیمتش بالاست و اینکه توی محتویات درج شده روی بسته اش ریموت کنترل هم هست حتی سنسور اینفرارد مربوط به کنترل از راه دور هم روی دستگاه هست اما متاسفانه ریموت کنترلش توی بسته اش نبود البته که دیجی کالا اشاره کرده که ریموت کنترل نداره  بهر حال من خیلی خوشم اومد و کارمو راه انداخت"
5,نصب اسان و بی درد سر با کیفیت عالی
5,کیفت عالی راحت برای ویندوز ده عالی
3.5,"برای استفاده در خانه باید از آنتن های هوایی خانگی استفاده شود  آنتن خودش برای فضای بیرون خوبه"
4,"هم به کامپیوتر نصب میشه و هم گوشی  میتونین یه آنتن قوی هم واسش بگیرین  پورتش به اکثر آنتنا میخوره"
3,من این رو خریدم خیلی وقت پیش عالیه واقعا. اون سی دی که همراهشه باید باشه چون درایورش هیچ رقمه پیدا نشد انواع برنامه ها و سایتها رو تست کردم و گشتم. چراغش روشن نمیشه و آنتنش با وجود سیم کم با کیفیته فقط کابل قدیمی مناسبش رو نیاز دارید. برنامه توتال مدیا هم از همه جا میشه دانلود کرد. ویندوز مدیا سنتر هم روش جواب میده
4.5,"من با مبدل usb به تایپ c دستگاهو به گوشیم وصل کردم و از اپلیکیشنی که دوستان در کامنت‌ها گفتن استفاده کردم اما دستگاه توسط اپلیکیشن شناخته نمیشه و نمیتونم ازش استفاه کنم!  مدل گوشی samsung A51 هست  اما روی لپتاپ با آنتن خودش به خوبی همه شبکه‌های تلوزیون و رادیو رو دریافت کرد. البته از طبقه سوم در تهران."
4.4,من این دیوایس رو بعد از کلی تحقیق و با استفاده از نظرات شما عزیزان در دیجی کالا برای اندروید باکس خریدم. پس از نصب برنامه padtvhd بصورت اتوماتیک دیوایس شناسایی می‌شود و با قدرت گیرندگی زیادی شروع به ذخیره همه کانال‌ها می کند . فقط باید یک آنتن خوب تهیه کرد و در خارج از خانه یا حداقل پشت پنجره متصل شود چون آنتن خودش خیلی ضعیفه و کار نمیده.
5,"به نظر من قیمتش بالاست ولی عالیه..به گوشی کانکت شد. من با گوشی a50 تست کردم .برنامه pad tv hd رو گوشی نصب کردم با انتن خودش همه شبکه ها رو پیدا کرد .حتی انتن قویتر نیاز پیدا نکردم..بسیار عالی و خوب."
0,با کیفیت فول اچ دی هم میگیره و آنتن دهی بسیار خوبی داشته...
1,"هرکاری کردم یه کانال رادیو هم نگرفت انتن اسکای 99 هزار تومنی هم گرفتم براش هیچچچچچچچچچچچچچ درحالی که انتن شکسته و خراب گیرنده دیجیتال به راحتی میگیره رو تلویزیون ولی این اصلا کار نکرد"
4,"برای گوشی و pc نصب کردم با آنتن هوایی عالیه با آنتن خودش نمیگیره و ضعیفه"
4,"من موفق نشدم کارای نصبش رو انجام بدم دادم به کسی ک انجام داد. ساده نیست واقعا"
5,بسیار کاربردی وبا کیفیت ، بی هیچ نویزی،
4.2,این گیرنده دیجیتال USB مای جیکا با استفاده از برنامه Pad TV HD راحت به گوشی اندرویدی Huawei Y7 Prime 2019 و Honor 8c وصل شد و همچنین با برنامه Total Media 3.5 روی ویندوز 10 نسخه 1909 راحت بالا اومد و کار کرد، روی سی دی همراهش برنامه توتال مدیا و درایور راه اندازی برای ویندوز هست ولی سریال نامبر برنامه Total Media رو نداشت که باید در گوگل سرچ کنید و سریال نامبرهای برنامه توتال مدیا رو راحت پیدا میکنید، همراه این دستگاه ریموت کنترل نبود ولی یک آنتن خیلی کوچیک ضعیف آهنربایی داخل بسته هست که فقط کار راه اندازه و به درد فضای باز و بیرون از محیط بسته داخل ساختمان میخوره و گیرندگی سیگنال کمی داره و شبکه ها را گاهی خوب و گاهی با نویز زیاد و ضعیف بالا میاره، به همین دلیل یک آنتن رومیزی اسکای از همین دیجیکالا سفارش دادم که سیگنال فوق العاده عالی به این گیرنده دیجیتال داد و تعداد شبکه ها افزایش و کیفیتشون هم عالی عالی شد، ممنونم از دیجیکالا و همچنین از شما که نظرم رو خوندین.
5,از خریدم راضی هستم بدون مشکل تمام شبکه ها را دارم
3,"این دانگل رو به tv box اندرویدی وصل کردم و با برنامه padtv hd عالی جواب میده. ضبط هم می کنه که با فرمت ts خروجی میده. با گوشی Pixel 2 هم عالی جواب داد. با مک کار نمی کنه ولی با ویندوز و لینوکس چرا. برندش هم برند معتبری است."
3,یک ماه کارکرد و سوخت
3,"من مدتی که دارم استفاده میکنم ازش راضیم ولی باید آنتن رو در شرایط مناسب دریافت امواج قرار بدید، تا بهترین نتیجه رو بگیرید. باتشکر از دیجی کالا"
3.9,عالی هم به موبایل و هم به کامپیوترو لپتاپ و تبلت وصل میشه و کانالهای فول اچ دی هم میاره و اینکه توو ماشین و مسافرت هم میتونید استفاده کنید بخرید شک نکنید.
2,"روی pc و لبتاب نصب میشه ولی روی گوشی اصلا نصب نمیشه، پشیمونم از خریدش"
4.7,با سلام من این گیرنده را تابستون خریدم البته از شهر خودم کارایش خوبه ولی نمیدونم چرا قیمتش اینقدر بالا رفته من 70 خریدم احتمالا کیفیتش خیلی خوب بوده قیمتش بالا رفته
3,واقعا بدرد نمیخوره . من اصلا نتونستم باهاش کار کنم . اول که کلی سر نصبش گیر کردم . یکم رو ویندوزها و ورزن های 10 بد نصب میشه . بعدشم چون آنتنش کوچیکه اصلا نمیگیره . اگرم وصل بشه با خش خش . برا من که کارایی نداشته و انداختمش یه گوشه
4.5,خوبه.. خیلی. بخرید.
5,من دوتا گرفتم نمیدونم چرا فقط بکیش روی گوشی اوکی نشد فقط با سیستم بالا میاره
3,"حتما قبل از خرید محصول جاهای دیگه سرچ کنید ببینید به مدل گوشیتون میخوره یا نه چون بعضی از گوشی ها رو ساپورت نمی کنه الکی رو دستتون نمونه"
3,"قدرت سیگنال و کیفیت تصویر خوبی داره ولی گاهی صدای تیک پخش میشه که خیلی آزاردهنده س نمیدونم دلیلش چیه"
4.4,"من امروز گرفتمش خونمون طبقه 4 هست ولی با آنتن خوش فقط وقتی کنار پنجره هستم و آنتن اهنربایی شو به پنجره متصل میکنم، شبکه ها را با کیفیت نشون میده در غیر این صورت لگ داره سایر ویژگی هاش خیلی خوبه در واقع اگر آنتن هوایی داشته باشین ، عالیه. یک حسن دیگش نصب روی ویندوز 10 هست که همه محصولات مشابه دیگر این امکان رو ندارن"
0,باآنتن خودش تصویربالانیومدبایدآنتن هوایی نصب کنید
4.6,"محصولی بسیار با کیفیت و تصویردهی شفاف  دارای آنتن کوچک. در طبقات و در داخل به خوبی آنتن میدهد."
3,در کل ازش راضی هستم و کار راه میندازه ولی باید حتما در مکانی باشید گیرنده انتن دهی داشته باشه
5,"بذارید چندتا توضیح بدم راجع به محصول. نسبت به پولش بسیار میارزه. نرم افزاری که به همراهشه قابلیت ضبط تلویزیون رو میده و EPG تلتکست هم داره که البته زبان فارسی رو ساپورت نمیکنه. تصویر خیلی خوبی داره و شبکه های اچ دی رو با شفافیت خیلی بالا نشون میده. آنتنی که همراش هست در نوع خودش از قوی ترین هاست و من کنار پنجره میتونم همه رادیو و کانال های سراسری و استانی رو بگیرم. البته خونه ما آپارتمانی نیست و نمیدونم گیراییش تو خونه های آپارتمانی و چند طبقه چجوریه. ولی فک کنم با یه آنتن هوایی بتونید همه شبکه ها رو بگیرید. نرم افزار محصول هم کنارش ارسال میشه و تنها ایرادی که داره کد فعالسازی داخلش نیست که اونم اینجا براتون از سرزمین دانلود کپی پیست میکنم که دیگه دنبالش نگردید:  Serial: y9b7zf-2a6a629xzr-4p6dyqqu ویندوز ۱۰ رو ساپورت میکنه و تو یک ربع میشه نصب و راه اندازیش کرد. یدونه محل قراردادن آنتن میمونه که اونم باید خودتون بگردید ببینید کدوم سمت از خونه آنتن بهتری میده. تو سی دیش یه اپلیکیشن واسه اندروید هم هست ولی چون گوشی من از otg پشتیبانی نمیکنه امتحان نکردم ببینم با گوشی هم کار میکنه یا نه. تنها ایرادی که بهش وارد میکنن اینه که ریموت داخل پک نیست و من بعد از تحقیق فهمیدم که ریموت از سوی سازنده محصول از پک حذف شده چون برای سیستم های بالاتر از xp کارایی نداره. درضمن بجز نرم افزار خودش که همون توتال مدیا هست، دو سه نرم افزار دیگه هم تو سایتها میشه پیدا کرد که بعضا EPG و تلتکست فارسی دارن ولی به نظر من درمقایسه با سایر نرم افزارها توتال مدیا خیلی بهتره. در کل راضی ام و خرید خوبی بود."
0,کیفیت تصویر خوب فقط با آنتن هوایی باید استفاده شود تبدیل OTG ندارد برای استفاده موبایل.
