3.9,"متاسفانه دیجیکالا نظارت درستی روی فروشنده هاش نداره و نسخه درجه پایین تر رو میدن به مردم چیزی ک تو عکسا مشخصه اینه ک کیبورد بک لایت داره همچنین بعضی نظرا نوشته بودن بک لایت و حسگر اثر انگشت داره که وجود چنین سنسورایی کلی تو قیمت لپ تاپ اثر میذاره متاسفانه از شانس من نسخه درجه پایین ترش ارسال شده و احتمالا مرجوع کنم"
3,"تا میخواستیم بخریم از شگفت انگیز برداشته شد شگفت انگیزش کنید لطفا"
4.75,"سلام ب همه دوستان  من مثل شما هر روز نظرات میخوندم و دو دوتا چارتا میکردم  من این لپ‌تاپ رو رفتم از بازار خریدم  چون تو نظرات ی سری ها نوشته بودن ک صفحه ips نیست و این واسه من مهمه  نقاط قوتش رو گفتم  نقاط ضعف هم نداره  شارژر تو مشخصات نوشته ۵۷ ولی مال من ۶۵ هه  تو بازار اینا ب دو دسته تقسیم میشن سری i5 و i7  سری هفت ها ک یکم گرون تر بودن کاری نداریم  این سری ۵ ها دو دسته میشن  ی مدل هست صفحه ips نیست  اثر انگشت و نور کیبورد نداره و بدنه پلاستیکه  ی سری ها هم همه اینارو داره  فرق قیمتی حدود ۱،۵ تومنی دارن ک ب نظر من میارزه  همونجا هم فروشنده ویندوز و لنتی ویروس نصب کرد بدون دردسر  امیدوارم نظرم واستون مفید باشه"
3,یکی از دوستان نوشته اثرانگشت یا فینگرپرینت داره باید بگم دو مدل توی بازار موجود هست یکی با فینگرپرینت و یکی بدون آن
4,لطفا قیمت بیارید پایین
4,با توجه به پردازگر نسل 11و سرعت رم بالا و گرافیک با کیفیت و رم نسل ۶ و از همه مهمتر حافظه ssd nvme ، سرعت عمل خیلی بالا و بدون تاخیری داره.
4.3,لطفا شگفت انگیزش کنید بخریمش
0,"برای نصب ویندوز، ابتدا با زدن کلید F2 وارد بایوس بشد و ویژگی VDM رو غیرفعال و با زدن کلید F10 تغییر را ذخیره کنید. با کمک برنامه Rufus یک فلش بوت ویندوز درست کنید. File system رو GPT انتخاب کنید تا به راحتی بتونید لپ‌تاپ رو بوت و ویندوز نصب کنید. پیشنهاد میکنم ویندوز ده نسخه pro یا بالاتر نصب کنید. این لپ‌تاپ مثل خیلی از نسل‌های جدید لپ‌تاپ‌هاDVD درایو نداره ولی وزن خیلی کمی داره. دو تا کابل داخل جعبه داره، سعی کنید از کابل فیوزدار استفاده کنید."
5,سلام من ده روزه این لپ تاپ خریداری کردم چرا وارد camera میشم صفحه عکسم کلا تاره و یه سمتش کرمی
3,با توجه به قیمت توصیه می کنم . برای من مدل کامل ارسال شد که دارای اثر انگشت و بک لایت هست . توصیه می کنم تو این رنج قیمت 
4,"سلام، فروشنده Ibuy(ای بای) حسگر اثر انگشت و بک لایت داشت که خوشبختانه تونستم بگیرم لطفا زمان خرید با فروشنده تماس بگیرید و از این آپشن ها مطمئن شوید. در مورد نصب ویندوز هم با یه دی وی دی رام اکسترنال به راحتی میشه نصب کرد البته دو تا گزینه در بایوس باید غیر فعال کنید که دوستان تو کامنت های پایین تر راهنمایی کردند،در مورد درایور ها هم می تونید از لینک زیر استفاده کنید https ://support.Lenovo.com/us/en  بعد وارد قسمت Driver &amp; Software بشید با وارد کردن و جستجو سریال نامبر دستگاه، همه درایورها نمایش داده میشه و بعد می تونید دانلود کنید، ضمنا این مدل لپ تاپ برای کارهای برنامه نویسی و معمولی خوبه و نیاز کاربر رو کاملا برطرف می کنه، موفق باشید."
3.25,دیجی کالا در یک حرکت ناشایست لپ تاپ با صفحه نمایش tn فرستاد به جای ips. بدون بک لایت کیبورد و فینگر پرینت‌.
5,شگفت انگیز کنید
4,لپ تاپ خوبیه
5,"برای بازی عالی روبه خوب نتیجه تست بازی  های (سنگین  نه نیمه سنگین یا ورزشی )روی این لپ تاب ،بازی های سنگین تا سال  17 رو تنظیمات نهایی ،2018 روی زیاد به راحتی، تنظیمات خیلی زیاد اگه سایه  و تنظیمات غیر واجب بازی خاموش کنید، 2019 روی تنظیمات متوسط و کم ،2020 روی کم و بعضا مثل اساسین والهالا یا رزیدنت ایول ویلیج 2021 روی تنظیمات پایین و  720p  نهایتا زیر رزولوشن فول اچ دی باشه برای اجرای کاملا روان ، فیفا و پیس 2021 روی تنظیمات نهایی 1080 به راحتی میاره   واقعا فوق العاده و عالی  تو این قیمت    در کل برای بازی حتی سنگین ترین بازی ها هم جواب گو هست البته رو تنظیمات پایین"
3.75,پیدا کردن فایل irst درایور هارد خیلی سخت بود، این حرکت برای مصرف بهینه در نسل جدید اینتل انجام شده بجز نصب درایور هارد که واقعا عذابم داد از لپ تاپ راضی هستم مشخصاتش تو این رنج قیمت عالیه خیلی خوش دسته سبکه
4,ولی در کل خرید محصول را پیشنهاد میکنم
3.75,جهت نصب ویندوز ، صرفا در بایوس گزینه VDM در تب دوم را Disable میکنیم تا هارد SSD در زمان نصب شناخته بشه وگرنه مشکل دیگه ای نیست. سرعت دستگاه خیلی عالیه . کمی کیفیت دکمه ها و صفحه کلید مخصوصا دکمه پاور مناسب نبود. درایورها هم به راحتی قابل دانلوده و مشکلی نبود.
3.35,در کل خیلی خوبه...
