5,هندفون عالی. فقط یادتون باشه اپ مخصوصش رو دانلود کنید.
5,شارژدهی بسیار عالی و نویز کنسلینگ
1,"من مدتها استفاده کردم و عالی بود. عالی. بعد سونی آپدیت ۱.۴.۲ رو داد بیرون و کشتش. ۸ ساعت باطری نگه می‌داشت، الان سر یک ساعت تموم می‌شه، و مطمئنم به زودی عمرش بسیار کمتر هم می‌شه از اونجایی که اون آپدیت باعث داغ شدنش موقع شارژ می‌شه و عمر باطریارو سریعا کم می‌کنه. اگر ایران نبودیم وارانتی سونی مسئولیتو قبول می‌کرد و تعویض می‌کرد، ولی ایرانیم، واقع‌گرا باشید. به سونی اعتماد نکنید، نخرید نخرید."
4,از همه نظر خوبه فقط یه مشکلی که داره اندازش هستش توی هر گوشی واینمیسه حتما قبل از خرید یک بار تو کوشتون بزارید ببینید راحته و خوشتون میاد بعدش بخرید
5,عالی عالی 
1,هیچ برندی به پای هندزفری سنهایزر، هم از بابت کیفیت ساخت و هم از بابت کیفیت صدا نمیرسه که ۷۸ سال هستش که در زمینه تولید ادوات تخصصی صدا سابقه داره ، یعنی وقتی شرکت سنهایزر شکل گرفت اصلا سونی وجود نداشت، مثل کیفیت تویوتا از ژاپن با مرسدس بنز از آلمان میمونه، دوستانی که درزمینه تخصصی صدا متخصصن خوب میدونن که انتخابشون چیه
1,کمتر از یکسال کار کرد. لای پر قو نگرش داشتم. باتریش ناگهان کاملا بی دلیل  خراب شد. دارم میندازیش سطل آشغال و دارم apple order میدم.
5,من از جای دیگه تهیه کردم و تقریبا همه نیازمو نسبت به یه ایرفون استاندارد تامین کرد، نمیخوام درمورد صدا و مزایا و معایبش چیزی بگم، چون همه جا نوشتن و هست.. فقط خواستم برای اونایی که دنبال جایگزین برای ایرتیپ های نامناسبش هستن، بگم من چون از قبل به خیلی از ایرتیپای مطرح دسترسی داشتم، اگه تونستین ایرتیپ sony ep-exn50 تهیه کنید که اگه نتونستین همون sony ep-ex11 تمام نیازهاتون رو برطرف میکنه، دنبال کامپلی و اسپین فیت و اسپایرل دات نرید هیچکدوم به اندازه ایرتیپهای قدیمی سونی نمیتونه فیتینگ و صدای کامل براتون فراهم کنه.
4,"هندزفری قبلی من بادز بود که خوب این از لحاظ کیفیت پخش از اون سرتره ولی تو مکالمه بادز بهتر عمل میکرد عملکرد بادز ناپایدار تر از این بود و اگه باطریش تموم میشد خیلی طول میکشید تا دستگاه را بشناسه  خلاصه من فقط واسه طراحی خاصش اینا خریدم واقعا یه اثر هنریه مگرنه تو کیفیت با این قیمت واقعا معجزه نمیکنه و اصلا کیفیت پخش به  بیتس نمیرسه و کیفیت مکالمه هم یه هندزفری دور گردنی انکر با یک پنجم‌ این هزینه بهتر عمل میکنه"
5,من این هدفون سونی رو خریدم خیلی خوب در گوش فیکس میشه و مثل ایر داد نمیفته شارژ بالایی داره ولی خوب اگر انتظار چیزی در حدود هدفون های بیتس اصل رو دارید بگم که در اون حد کیفیت صدای بالایی ندارند.
5,وقتی باهاش موزیک گوش میکنی میری تو یه دنیای دیگه
5,عالی
5,"من قبل این ایرپاد پرو داشتم از همه لحاظ این بهتره تووی گوش راحته کیفیت صدا خوبه طبیعتا قیمتشم نسبت به کیفیتش بالاست"
5,کاربرد اصلی من برای ای دیوایس صحبت در جلسه های آنلاین و مکالمات تلفنی رو گوشی، لپتاپ، و تبلت است. این هدفون بدون نقص از دیوایس یه دیوایس دیگر سویچ میکن، بدون باگ. با همه ابزار مکالمه مثل تیمز، میتس، واتساپ، اسکایپ و گوشی خوب کار میکند. د از مسیر گران قیمتی را طی کردم تا به این هدفون رسیدم؛ خرید دو هدفون دیگر B&amp;O و Shokz و هر کدام مشکلات خود را داشتند. مشکلاتی که این هدفون نداشت. از اول همین هدفون رو میخواستم ولی اینجا موجود نبود. محصول را توصیه میکنم
4,"متاسفانه بعد از یکسال باتری چپ یا راست بسته به این که کدوم رو بیشتر استفاده می کنید خراب میشه ولی من تونستم از ایبای باتریش رو بخرم و خودم تعویض کنم که مشکلش برطرف شد. از طریق مالتینا میتونید بخرید نوع باطری z55h 3.85v .29wh"
1,خیلی زود باتریش خراب شد و بدون استفاده شد. با توجه قیمت که من نصف این قیمت فعلی خریده بودم اصلا توصیه نمیکنم. 
3,من واقعا نقد دارم به قیمت های دیجی کالا. دیجی کالا باید قیمت را شفاف بکنه چرا دوبرابر شده؟ قیمت دلاری اش را بگه. شده بعضا یه کالایی می خریم دو روز بعد 40 درصد قیمتش کم شده. این هدفون هیچ چیز عجیب و غریبی هم نیست از لحاظ صدا. بیشتر قیمتش بخاطر عملکردهای لمسی و نویز کنسلینگ هست. استفاده کردم و با هدفون معمولی قبلی ام هم مقایسه کردم دارم میگم. کیفیت شاید در حد زید ده درصد ممکنه فرق داشته باشه. وسوسه نشید خواهشا.
5,لطفا کاور و لاستیک های گوش را برای خرید اظافه کنید
5,همه مشخصاتش عالیه من یک ساله خریدم و یک بارم باهاش به مشکل برنخوردم ، دارای برنامه اختصاصی هستش که باهاش تمام کاراییش رو میشه کنترل کرد ، شارژ وایرلس سریع شارژ میکنه ، تو گوش خیلی راحت هست و اصلا نمیوفته
5,هیچی نمیگم یکبار ولی چیز خوب بخرید
5,سلام و عرض ادب به همه،،،دوستان این هدفون از همه ‌نظر چه کیفیت صدا، چه امکانات، چه نگهداری شارژ، چه کیفیت ساخت عالیه و نیازی به تعریف و تمجید اضافه نداره چون امتحانش رو پس داده و ثابت شده‌اس و تو ویدئوهای بررسیش در اینترنت همه‌چیز مشخصه، که از برند معتبر و اصیل و قدیمی سونی که تخصص اصلیش تولید صدا هست چیزی غیر از این هم انتظار نمی‌ره...(اما یک نکته‌ی خیلی خیلی مهم برای دوستانی که این هدفون رو خریداری کردن و در حال حاضر در حال استفاده هستن) عزیزان؛ حدودا یک ماه قبل یک آپدیت جدید برای این هدفون منتشر شد که قابلیت خیلی خوب و کاربردیِ اتصال به دو دستگاه به صورت همزمان (Multi point) رو به این محصول اضافه کرد، اما پس از آپدیت به این نسخه‌، به دلیل (باگ و مشکلی) که این نسخه‌ی جدید داره، مدت زمان نگهداری شارژ باطری بسیار افت می‌کنه و به نصف کاهش پیدا می‌کنه و حتی گوشی سمت چپ کمتر از یک ساعت شارژ نگه می‌داره...دوستان (توجه داشته باشید) که این مشکل کاملا نرم‌افزاری هست و هیییچ ارتباطی به باطری و خرابی اون نداره و با خاموش کردن گزینه‌ی DSEE Extreme در اپلیکیشن هدفون مشکل حل میشه و احتمالا شرکت سونی هم ظرف چند روز آینده آپدیت جدیدی رو منتشر می‌کنه و این مشکل رو رفع می‌کنه. یکی از دوستان عزیز هم در همینجا ظاهرا به این مشکل برخوردن که فرمودن با نمایندگی تماس گرفتن و بهشون گفتن که باطری خراب شده و باید تعویض بشه که اصلا اینطور نیست و باطری به هیچ عنوان مشکلی نداره و کاملا سالمه، پس بی‌دلیل هدفون رو به تعمیرگاه نبرید و بازش نکنید و فقط همون گزینه‌ای که عرض کردم خدمت‌تون رو در اپلیکیشن خاموش کنید. و اما، اینکه شرکت‌ها و نمایندگی‌های ما، مهندس‌ها و تکنیسین‌ها و تعمیرکارهاشون بدون هیچ اطلاعات و بررسی و تست و غیره فورا و سریعا اعلام می‌کنن که باطری خراب شده و باید تعویض بشه و باعث می‌شن که محصول سالم و نو بی‌جهت و بی‌دلیل باز بشه، واقعا تلخ و دردناکه...و بسیار عجیبه که این عزیزان توجیح نیستن که هیچ باطری شارژی، به یکباره خراب نمیشه و میزان نگهداری شارژش یک‌دفعه از ۱۲ساعت شارژ به ۱ساعت کاهش پیدا نمی‌کنه و هر باطری به مرور زمان از عمرش کم میشه و افت می‌کنه و نه ناگهانی و یک‌باره!!! اون هم باطری که تنها چندماه از عمرش گذشته باشه و ساخت یک کمپانی معتبر باشه و دوتا هم در کنار هم باشه، اما فقط یکیش خراب بشه...!
4,سلام خدمت دوستان عزیز ببینید این هدفون از لحاظ کیفیت صدایی که داره فوق العاده هست ولی بعد از یک سال استفاده هفته پیش که آپدیتش کردم گوشی سمت چپ بشدت از لحاظ باتری افت کرده و بیشتر از نیم ساعت تا چهل و پنج دقیقه شارژدهی نداره که تماس گرفتم با نمایندگی گفتن باید باتری تعویض بشه و اضافه کنم خطاب به اون دوستی که گفتن DSEE Extreme خاموش کنیم من اینکارو کردم هیچ تغییری ایجاد نشد یا باید اپدیت جدید بیاد یا باید باتری عوض بشه که فعلا تویه بازار موجود نیست
2,دیجیکالا هیچ توضیح مناسبی بابت تمام ابعاد نداده و فقط قطر ابتدای حلزون ذکر شده
5,استفاده کردم بدون شک بهترینه
5,"الکی نیست که بهش بهترین هندزفری جهان میگن. چه از نظر صدا و چه از نظر امکانات با اختلاف بهترینه. اکثر امکاناتش توی هیچ هدفون دیگری دیده نمیشه. و همینطور در ارائه هر یک از امکانات به بهترین شکل عمل می‌کنه. اگه یک هدفون کامل میخواید بهترین گزینه است. کیفیت صداش هم از هدفون های پرچمداری مثل jbl club pro plus و Bose quitcomfort و beats و soundcore liberty 3 و airpod pro 2 با اختلاف بهتره و امکاناتی که این بهتون میده قوی تر از بقیه است"
5,"با سلام.  سعی کردم هر چیزی که به دردتون میخوره رو بنویسم  سعی کردم تمامی نکات مهم برای دوستانی که مردد هستند برای خریدن رو در نکات مثبت و منفی بگم. من مدل نسل پیشین، یعنی WF-1000XM3 رو دارم، فکر میکردم زیاد فرقی نداره مدل XM4 که واقعا از فکر اشتباهم به وجد اومدم.  نسبت به WF-1000XM3 از امبینت ساند و نویز کنسلینگ فعال بسیار بهتری برخوردار هستش، البته کیفیت و وضوح صدا و پخش موسیقی بسیار عالیه و خیلی پیشرفت داشته نسبت به نسل قبل خودش. حساسیت تاچ پدهای هندزفری بالاتر رفته و با دقت بیشتری فرامین رو انجام میده. کیفیت مکالمه ی تلفنی نسبت به نسل قبلی خودش فوق‌العاده هستش و در خیابان شلوغ مثل ولیعصر تهران، صداتون بدون نقص به اونور خط میرسه. استفاده از تراشه ی فوق العاده ی V1 هم در پیشرفت کلی دستگاه بی تاثیر نیست؛ تراشه ی مدل قبلی qn1e هستش که زمان خودش (۲۰۱۹)  عالی بود.  در کل این مدل رو باید با پرچمداران کمپانی های سنهایزر و بوز مقایسه کنید، دارندگان آیفون، بهتون خرید این محصول رو توصیه میکنم، پشیمون نمیشید.  و نظر آخر اینکه افرادی که گوش کوچک دارند به ویژه خانم ها، مدل Sony LS900 رو پیشنهاد میکنم."
5,لطفا موجود کنید
5,"من زیاد با مارک سونی حال نمیکنم ولی در این مورد واقعا رقبا حرفی برای گفتن ندارن"
5,چشم بسته بخرید و لذت ببرید چون با اختلاف بهترینه بخصوص بیس عمیق و صدای بی نظیرش
5,هم ایرپاد داشتم هم جی بی ال ولی هیچی مثل این نیست محشره هیچ نقطه ضعفی نداره
4,سلام ،از دیجی کالا بابت پیگیری سریع سفارش تشکر میکنم
4,از خریدم راضی هستم
5,"صدای عالی و نویز کنسلینگ بینظیر.  اگه گرفتید موزیک با کیفیت بالا دانلود کنید که از قدرت واقعیش استفاده کنید.  این صدای ۳۶۰ درجه هم عملا قابل استفاده نیست. فقط تعداد محدودی از سرویس های موزیک ازش پشتیبانی میکنن که باید اشتراکشون رو بخرید. زیاد به خاطرش ذوق‌زده نشید."
5,صدای عالی و کیفیت دیوانه کننده
5,دوستان من این هدفون رو از جای دیگه تهیه کردم . فقط میتونم بگم شاهکاره و بهتر از این نیست. سونی همیشه عالی و سراسر اصالت و کیفیت بوده . دمش گرم
5,هرگز بهتر از این هدفون پیدا نخواهید کرد. من نزدیک ۶ ماهه استفاده میکنم و همیشه ازش لذت میبرم. هم با کیفیت و هم ظاهر خشگلی هم داره. اگه دنبال بهترین هدفون دنیا هستید از این بهتر نیست نگردید من خیلی  تحقیق کردم.
5,چند ماه دارم استفاده میکنم و راضیم ازش. تنها بديش قیمتش بالاشه. 
4,در کل برای موسیقی عالیه اما برای مکالمه نه خیلی
5,من حدود 3 ماه هست خریدم از همه نظر عالی هست فقط کمی بزرگه همینه
0,از نظر کیفیت صدا و نویزکنسلینگ عالی ولی متاسفانه بعد از ۱ هفته استفاده خراب شد
5,الان تقریبا دو ماه هست که دارم ازش استفاده میکنم،‌میتونم بگم برا اونایی که دائما از اینجور گجت ها استفاده میکنن میتونه عالی باشه، ممکنه یکم توی استفاده طولانی گوشتون رو اذیت کنه ولی بهش عادت میکنید،‌ اون سرهای فومی یا پیدا نمیشن یا خیلی سخت گیر میان و یا باید با سری سیلیکونی عوض کنید پس مواظبشون باشید!‌ چون یکی از  امتیازهای سری فومی نسبت به سیلیکونی اینه که عایق بهتری برا صدا هستش،  باتری خیلی خوبی داره میتونم بگم نسبت به گجت های هم رده خودش یه سر و گردن سر تره،‌  زیاد از میکروفونش انتظار نداشته باشید چون توی محیط های پر سروصدا زیاد خوب صدای شما رو برا طرف مقابل فیلتر نمیکنه، برعکس مدل linkbuds S که میکروفون بهتری داره،‌ البته فکر نکنید میکروفون ایرپاد اپل و ایربادز سامسونگ بهتر از این هست!! دیگه خدمتتون عرض کنم که سونی قراره یه آپدیت روش بده که میتونه همزمان به چندین دستگاه بلوتوثی کانکت بشه، موقعی که از گوشتون میخواید درش بیارید اگه خیابون هستید کمی مراقب باشید چون از دستتون بیوفته یکم قل خورش ملسه :)) علاقه زیادی به توی جوب رفتن داره بچه :دی صدای موسیقی عالی ای داره واقعا میتونید از این نظر روش حساب کنید، اگه میتونید یک سال صبر کنید قراره مدل XM5 هم بیاد احتمالا سال دیگه،‌ولی خود همین هم میتونه جوابگوی نیازتون باشه حالت ambient sound و active noise cancelation میتونه خیلی به کارتون بیاد و نسبت به airpod 2 pro و earbuds pro 2 بهتره خلاصه امیدوارم ازش لذت ببرید اگه قصد خریدشو دارید یه لحظه هم شک نکنید...
4,"با سلام خدمت دوستان  بنده این هندزفری رو از جای دیگری خریداری کردم. شرکت سونی برای این محصول سنگ تمام گذاشته ولی حواستون باشه یک عیب بزرگ داره و اونم اینه که وقتی ولوم بیشتر از 60 درصد میشه کیفیت صدا به نصف کاهش پیدا می کنه و این مورد برای کسانیکه به کیفیت صدا حساسند و می خوان همیشه با ولوم بالا گوش بدن فاجعه هستش. ولی تا قبل از ولوم 60 درصد کیفیت ، تفکیک و بیس عالی هستش.  شاید در آپدیت های بعدی این مورد حل بشه ولی خریدش زیاد تئصیه نمیشه."
5,برنامه ای ک روی گوشی نصب میشه(headphone) میتونه بهتر بشه. من فکر میکردم ک صداهای اضافه محیط فیلتر میشه و ارسال نمیشه. اما فقط صدای محیط برای خود کسی ک هنذفری زده شنیده نمیشه نه طرفی ‌ک پشت خطه.
5,من قبل از این هدفون 1more triple drive و buds plus و buds live داشتم ولی این از بقیه اشون بهتره هم سبک هس هم اماکانات خوبی داره البته با استفاده از برنامه اش توی گوش خوب قرار میگیره به گوش فشار نمیاره سری هاش از جنس مموری فوم هست و سه تا سایز داره نویز کنسلینگش خوبه باس خوبی هم داره و صدا رو تا اخر هم ببرید اذیت کننده نیس 
3,ولوم کار نمیکنه 
5,"عالیه  یک بار مشکل پیدا کرد  اونم به خاطر اینکه ضربه خورد و مقصر خودم بودم  در کل فوق العادست"
5,خفن ترین چیزی که میتونین باهاش موزیک گوش بدین همین محصول سونی هستش از دستش ندین
5,"حتما از توی ستینگ بلوتوث قابلیت LDAC رو روشن بفرمائید ، یک کدک ساخت سونی هست که تبدیل به یکی از استاندارد های اندروئید شده اما بطور پیش فرض خاموش هست و از توی اپلیکیشن سونی هم روشن نمیشه ، فقط ستینگ ... کیفیت همسان CD  بهتون میده ، حالشو ببرید ..."
5,"با سلام، کیفیت صدا در حد کمال و حیرت انگیز. من از صدای هدفون بوز واقعا لذت میبرم ولی متاسفانه به خاطر مشکلی که با هدفونهای روگوشی پیدا کردم بعد از بررسی زیاد و مقایسه تصمیم به خرید این محصول سونی فقط برای شنیدن موزیک و دیدن فیلم گرفتم که واقعا از خریدم راضی هستم و از استفاده از اون لذت میبرم. نویز کنسلینگ بسیار عالی انسان را در فیلم غرق میکنه! محدوده واقعی فرکانس باعث میشه فکر کنید در سالن کنسرت در ردیف‌های اول نشسته اید. صدای بیس بدن را از داخل به لرزه در میاره. توصیه می‌کنم بخرید و از زیبایی و تکنولوژی برتر سونی لذت ببرید. درود بر شرکت‌های سازنده ای که در ازای پولی که می‌گیرند کیفیت ارائه می‌کنند. واقعا ارزش خرید داره. با تشکر از دیجی کالا به خاطر ارائه کردن این محصول درجه یک."
5,الان حدود 1 هفته استفاده میکنم،واقعا کیفیت صدا مخصوصا برای گوش دادن به موسیقی عالیه،نکته مهمش اینه که سیلیکون داخل گوش باید فیت گوش باشه وگرنه روی نویز کنسلینگ و کیفیت بیس صدا اثر نامطلوب میزاره.این نکته هم توجه کنید که این محصول جز برتربن هدفونهای بی سیم در سال 2022 هست.
4,با توجه به قیمت و استفاده آن طی این چند روز پس از حرید  راضی هستم ولی نیاز به زمان بیستر برای  از همه قابلیت ها و گاربردهای متنوعی که دارد، خوام بود.
5,فقط واقعا میتونم بگم مرسی سونی.بهترین برند جهان و امتحان خودشو پس داده.بخرید و حالشو ببرید
5,به جرات میگم با آپدیت هایی که داده بهترین مکالمه رو به شما میده  موزیک عالی راحتی توی گوش از بادز دو پرو هم بسیار راحت تر  بی نظیره
5,تازه فهمیدم سونی چه برندیه
5,ی ماهی هست دارمش فوق العادس فقط روز اول هنگام خرید تو find device موقعیتش مشخص بود ولی تو این چند روز هر کاری می کنم با اکانت جمیل یا خود سونی نتونستم وصل بشم.
5,محصولات سونی عالیه
2,"هولوگرام مخدوش بود و اسم فرد دیگری روی کالا چسبانده شده بود. وقتی کالا را باز کردم کاملا معلوم بود که قبلا بسته بندی باز شده و چسب ها مجدد چسبانده شده بودند. کالایی که دست من رسید noise cancelling اصلا کار نمی کرد. تمام اقداماتی که در سایت سونی بود را انجام دادم ولی فعال نشد."
5,"2 ماهی هست استفاده میکنم قبلا Airpods 2 New Generation داشتم که آرگونومیک برای گوش بهتر از این محصول سونی بود ولی از نظر کیفیت قابل مقایسه نیست کیفیت صدای سونی بی نظیر"
4,همچی تمومه فقط میکروفن میتونست بهتر باشه تو این رنج قیمت، بقیه چیزاش از همه رقیبا بهتره.
5,"در یک کلام یه بار خرید کن و یه عمر از حاصل انتخاب خوبت لذت ببر... سونی سلطان صدا... اینکه هم دیگه پرچمدار سونیه"
5,"سلام دوستان من ایرپاد سمت راستمو گن کردم هر چقدر گشتم نتونستم پیداش کنم کسی نظری داره بده یا اینکه تکی هم میتونم جایی جور کنم؟"
