5,"درود بر همه ی دوستان بعد چند ماه استفاده اینو براتون مینویسم  ایر پاد پرو هیچ حرفی برای گفتن در کنارش نداره فقط و فقط هجم صداش بالا تره ولی کیفیت سونی خیلی بهتره خیلی از هر لحاظ من جفتشو دارم و بدون تعصب نظر دادم و با پرچم دار وان پلاس هم مقایسش کردم اونم در حد ایرپاد پرو‌ بود و کیفیت صداش به سونی نمیرسه صدای ۳۶۰ دنیایی هستش برا خودش  فقط توجه کنید اگه گوشتون کوچیکه به هیچ عنوان توصیه نمیشه برای خانوم ها بعید میدونم گذینه ی مناسبی باشه  باور کنید با هر بار استفاده کلی به من لذت داده صدای دل نشین بیس عمیق و صدای تفکیک شده ای داره  کیفیت مکالمش شاید جز بهترین ها نباشه ولی خب خوبه ولی نه زیاد  امیدوارم تونسته باشم راهنماییتون کرده باشم"
4,با توجه به قیمت با کیفیت است.
5,سلام بسیار خوب و قابلیت زیاد و بدرد بخوری داره
5,عالیه بهترین هدفون وایرلس هستش تو گوش راحته و کیفیت بسیار عالی ای داره و صدا حتی وقتی روی 100 درصد هست دیستورت نمیشه و نویز کنسلینگ عالی ای داره
5,من هدفون سنهایزر مومنتوم ۳ رو تست نکردم تا بگم این ایرفون بهترینه.. ولی در مقایسه با اپل ایرپاد پرو اصلا یک درصد هم شک نکنید که سونی فوق العاده باکیفیتتره. یک روز هردوتاش دستم بود و به وضوح کیفیت WF-1000 xm4 بالاتر بود. البته قیمت دلاریش هم خیلی بیشتر از ایرپاد هست!!
5,از همه‌نظر فوق‌العاده اس یک مقدار قیمتش‌بالاست اما به کیفیت و صداش‌می‌ارزه
5,"این هدفن الان تو گوشمه ، قطعا کلی روش فکر و کار کرده سونی  واقعا یک اثر هنری هست !!! اگه یوتوب بگردید تو دنیا هدفونی توگوشی باکیفیت تر ازین نداریم و تقریبا همه تو یوتوب اعتراف کردن !!صداش از هدفنهای حرفه ای که روی سر میادم غنی تره ! هم باس عالی داره هم نویز کنسلینگ خفن طوری که صدای کولر و باد و صحبت اطرافیان واقعا نمیشنوید ....بار اول که نویز کنسلینگش تجربه کردم  چون یکهو فعال شد فکر کردم برق رفت   چون باد کولر میومد اما صدا قطع شد ! یکی دوروز طول میکشه چم و خمش پیدا کنید ! تو اتصال به گوشی شیاومی و تبلت  و سورفیس هشت  خیلی راحته و سه تا اپ پر از امکانات داره ...صدای مکالمش و نویز کنسلینگ میکروفونش برای تماس تلفنی هم شاهکاره اما اما صداش  تو موزیک واقعا یک کنسرت لایو  هست  بعضی وقتا بیس اش بهم این احساس میده که داره زلزله میاد ! اگه براتون بیس قوی مهمه باید این بخرید و شک نکنید بهترین دنیارو دارید میخرید ....سری به سایت سونی بزنید فقط رنگ سیاهش انتخاب کنید ، رنگ نقره ایش بیشتر شبیه رنگ خاکستری کت شلوار معلمای بچگیامون  هست و زود  کثیفی جذب میکنه   بخوام نمره عادلانه بدم  از بیست نمرش بیست هست"
4,"اواین چیزی که باید بدونید اونهایی که نخریدن: اگر گوشهاتون کوچکه (معمولا سری های اس یا کوچکتر استفاده می کنید) این هدفون رو نخرید...خیلی ساده ست! اگر لینک بادز اس به بازار ایران بیاد، اون گزینه ی بهتریه برای شما اونهایی که خریدن: اگر حالت استاندارد قرار گرفته شده در گوش، براتون اذیت کننده بود و در مکانی که افتادن ایرفون ها خطرناک هست قرار نداشتید، کمی بچرخونیدش به سمت مخالف و از داخل گوشتون شل تر کنیدش، تا حدی حجم صدا و نویز کنسلینگ رو از دست میدین اما برای استفاده طولانی مدت راحت تر میشه همچنین میتونید سری هاش رو تغییر بدید به مدل نازکتری مثل اسپین فیت (که در بازار ایران ندیدم جایی)  سیصد و شصت ریلیتی آدیو: چهارتا سرویس استریم هستن کلا که ترک هایی با این فرمت ارائه میدن همه اشتراکی. و ترک های بسیار محدودی ارائه میدن که عمدتا پاپ و چیپ هم هست! امیدوارم در آینده اسپاتیفای این قابلیت رو اضافه کنه و تنوع بهتری پیدا کنه  ایرفون هایی که داخل گوش کیپ میشن، بابت ایجاد فشار منفی داخل گوش، نسبت به اونهایی که روی گوش می ایستن، زودتر خسته کنندگی ایجاد می کنن. به این توجه کنید. یادتون باشه برای توجیح خرید چنین هدفون ای، حتما باید به موسیقی بسیار با کیفیت دسترسی داشته باشید و شرویس های استریم خودتون رو همیشه روی بالاترین کیفیت قرار بدین. با دستمال مرطوب تمیزش نکنید کیس اش مقاوم به آب نیست اگر قیمت ها در بازار ایران منطق داشت، مومنتوم سه به این مدل برتری داشت. اما این محصول در برابر قیمت فعلیش با تخفیف ارزش خرید خیلی خوبی داره خصوصا اگر توی گوشهاتون راحت قرار بگیره. منتظر نسل پنجم سونی هستیم با بهترین تغییرات"
4,کیفیت ساخت و صدای این گوشی بی نظیره .حجم  صدا بالاست ولی کیفیت هنوز عالیه.دقت صداها و تفکیک عالیه .و صدا مثل اب زلال و شفافه .صدایی بی رنگ و بی الایش .این گوشی برای افرادی که حفره گوش بزرگی دارن خوبه . و برای گوشهای کوچیک و با حفره کوچک نه.احتمال افتادن از گوش در این هدست وجود داره .باید مراقب کیس بود .نویز کنسل خیلی خوبه .در استفاده زیاد از این گوشی گوش ها خسته میشن چون یکم بزرگه و طراحیش میتونست مثل لینک بازهای جدید این شرکت میتونست خوب باشه.این گوشی واقعا زیباست .ولی ارگونومیک نیست برای گوش.وقتی داخل کیس کیره شروع به شارژ میشه و این امکان نیس که تنظیم کنی داخل کیس باشه و شارژ نشه .امکان جلو بردن تراک وجود نداره .و فقط میتونید عوضش کنید .این گوشی بسیار شیکه . و کاملا پیشنهادش میکنم.اگه برای موسیقی و کیفیت صوت میخین تنها گزینه‌س . ولی اگه برای پادکست و کیفیت برات خیلی اهمیت نداره خیلی گرونه .کیفیت مکالمه خیلی خوبه ولی عالی نیست .گوشی t15هایلو با قیمت ۵۰۰ و شارژدهی بالا و قرارگیری در گوشی عالی و کیفیت خیلی خوب برای پادکست و حتی موسیقی عالیه .از خرید این گوشی راضی هستم در کل ولی بهتره نیازتون رو بسنجید .
5,لامصبا ۶ میلیون و خورده ای داری پول هدفون میدی اونموقع توقع دارین بد هم باشه
4,اگر کیفیت صدای عالی میخواین خیلی عالی است. اگر به هر دلیل بلوتوثی میخواین این مدل عالی است.  در مجموع بهترین در حال حاضر  اگر وضوح و‌کیفیت صدا و‌بلوتوث بودن براتون خیلی مهمه این مدل  قطعا بهترین گزینه است. 
4,توی گوش ثابت میمونه
0,"چیزی که در ابتدا توجه آدمُ جلب می‌کنه کیفیت ساخت بالاست،درب کیس در زمان باز بودن مقداری شل هست و با کوچکترین تماسی بسته میشه،آهنربای هندزفری به شدت قویه و محاله هندزفری از داخل کیس بیرون بیوفته حتی در صورت زمین خوردن کیس..بدنه هندزفریُ وقتی کف دست میگیری درشت و حجیمه اما وقتی درون گوش قرار داده میشه اونقدرها بزرگ به نظر نمیاد..درون گوش بسیار محکم قرار میگیره و بعید می‌دونم به این راحتی ها بدون تماس دست و چیزی بیرون بیاد،خیال آدم از این بابت باید کاملا راحت باشه..انتخاب سری مناسب سایز گوش باعث میشه به نحوی در گوش کیپ بشه که بدون پخش موسیقی هم تقریباً هیچ صدایی از اطراف قابل شنیدن نیست،اپلیکیشن سونی هم یه قسمت برای تست کیپ بودن هندزفری داره که جالبه. در حالت پخش موسیقی بسیار بسیار کیفیت و شفافیت و تفکیک صدا بالاست،من از بخش های تخصصی صدا و موسیقی اطلاعاتی ندارم اما در مقایسه با هندزفری های سامسونگ live و buds و همینطور موتورولا البته قدیمی که داشتم و ارپاد پرو که چندین بار استفاده کردم کیفیت پخش موسیقی بالاتره قطعا،اما در مورد ارپاد پرو کاملا مطمئن نیستم...تنظیمات جالبی داره،یکیش قطع موسیقی به صورت خودکار زمانی هست که شروع به صحبت می‌کنی که این آپشن قابل غیر فعال کردنه و دیگه اینکه نویز کنسلینگ دارای چهار حالت در موقعیت های مختلف هست،یکی در حالت نشستن یکی در حالت راه رفتن،دویدن و در وسایل نقلیه،قابلیت تشخیص این حالت هارو به صورت خودکار داره و چنانچه تنظیمش کنید در هر حالت می‌تونه نویز کنسلینگ فعال یا غیرفعال کنه و یا به حالت انبینت بره..با تنظیم در قسمت های مختلف بر روی نقشه هم می‌تونه برخی تنظیمات در محل های مشخصی به حالتی که براش تعریف کردی در بیاره..برد ارتباط بین هندزفری و گوشی کاملا مناسبه و از مدل های سامسونگی که در بالا ذکر کردم بیشتره،بلندی صدا هم بسیار خوبه و گوش با بالاترین حد صدا اصلا اذیت نمیشه..در کل از هر نظر بسیار خوبه اما شاید با قیمت کمتری ارزش خرید داشته باشه."
4,عالی
5,سونی بهترین مارک هدفونه بدون کوچکترین شکی ،هزینه میکنین ولی امکانات و کیفیتی بهتون میده ک تو هیچ هدفونی پیدا نمیکنین،فوق العاده ارزش خرید داره ،نویزکنسلینگ بی نظیر کیفیت پخش عجیب و غریب ،هر اهنگی گوش دادین تا الان با ابن دوبرابر با جزییات میشنوین ،بی نظیر
4,من برای استفاده هنگام دویدن گرفتم قبلش بوز داشتم از گوشم میوفتاد خداروشکر این ثابت میمونه اما حجم صدای هیجان انگیزی که لازم داری هنگام ورزش بهت نمیده متاسفانه
5,بهترین airbud که میشه خرید
5,به عنوان کسی که هم ایرپاد پرو اپل ، هم گلکسی بادز پرو سامسونگ و هم پاوربیتس شرکت بیتس رو تست کرده، این بهترین تجربه ای بود که تونستم از یک ایرپاد برای گوش دادن به انواع سبک های موسیقی مخصوصاً الکترونیک دریافت کنم، صدا به بهترین نحو پردازش میشه و غنی تحویل داده میشه این به لطف درایو بزرگ این هدفون هست که حسابی قراره سوپرایزتون کنه. با قیمتی که الان داره ( حدود 6.5 ) پیشنهادش میکنم.
5,از نظر کیفیت و صدا عالی هست و توی خریدش شک نکنید. فقط شانس من، روز بعد سفارش تخفیف ویژه خوبی روی این کالا اومد.
4,عالی
5,بعد یه ماه استفاده میتونم بگم که فوق العاده راضی بودم!
0,"با عرض سلام و خسته نباشید خدمت دوستان  من نسبت به خرید این هدفون سونی خیلی خیلی تحقیق کردم و کلی سوال داشتم و بررسی های یوتیوبی زیادی دیدم  چون خودم تمام هدفون های سامسونگ و اپل رو دارم و استفاده میکنم به قطع میتونم بگم از نظر کیفت صدا و قدرت بیس واقعا هدفون خوبی هست و از همه سر تره برای افرادی که اینقدر سخت گیر باشن و بتونن مثلا فرق بین هدفون هارو تشخیص بدن ولی در کل نسبت به کارایی و قیمتی که داره میشه گفت که هدفون سامسونگ بهتر باشه برای استفاده عمومی  ولی از لحاظ تخصصی هیچ کدوم از هدفون های سامسونگ و اپل با این هدفون سونی اصلا قابل قیاس نیست  من قطعا از خریدم پشیمون نیستم ولی توصیه ای که به افرادی که میخوان این هدفون رو بگیرند دارم اینه که اگر در کل کیفیت صدای بسیار بالا و بیس قوی میخوان حتما ارزش داره ولی اگر صرفا مثلا تغییر خیلی محسوسی با بقیه هدفون ها میخوان چیز خیلی زیادی نیست که بشه به صورت عادی تشخیص داد  در مورد اندازه صدا هم بگم که به نظر من میتونست بیشتر باشه ولی طبیعتا بعد از یه مدت خستگی رو براتون داره چون از لحاظ نرمی خارج میشه ولی بازم آدم شاید بعضی وقتا بخواد ولوم رو خیلی بالا ببره متاسفانه با این هدفون همچنین قابلیتی نخواهد داشت که بتونید صدای بسیار بالایی داشته باشید  با تشکر از دیجیکالا"
5,من ایرپادپرو داشتم و گوش راستش خراب شد.اینو خریدم و خیلی خیلی بهتر از اونه.سامسونک بادز لایو و شیایومی هم دارم ولی اصلا قابل مقایسه با این نیستن.ممنون از دیجی کالا
5,خوبه اما یکم گرونه
5,عملکرد عالی
4,"Soundcore liberty 3 pro رقیبش قیمت کمتر ، ارزش خرید بالاتر"
5,خیلی کیفیت صدای خوبی داره و شگفت زدتون میکنه
4,"من مدتهاست که در حال پیگیری خرید یک ایربادز مناسبم که محدودیت باطری اذیتم نکنه و طوری باشه که برای دوچرخه سواری و ورزش هم با خیال راحت ازش استفاده کنم و نگران افتادنش هم نباشم  این مدل همه چیزش عالیه کیفیت موزیک و بیس و 360 reality کیفیت میکروفون در مکالمات و خیلی از امکانات دیگه و آپشن های نرم افزاریش که واقعا اینجا جاش نیست واردش بشم فقط کافیه اسمش رو سرچ کنید میبینید که اکثر سایتهای تخصصی به عنوان بهترین از هر لحاظ اسمش رو در رده یک آوردن.  -------------------------------------------- آپدیت بعد از ماه ها استفاده مداوم متاسفانه حسگر لمسی یکی از گوشی هاش قاطی کرده و هی اشتباهی فکر میکنه روش لمس شده و باعث دردسر میشه و وسط مکالمه مشکل ایجاد میکنه و فقط میشه آهنگ گوش کرد"
5,"عالیه من قبلا گلگسی بادز نسل ۱ داشتم ، اون رو باید هر ۴ روز یکبار شارژ می کردم ولی این رو هر ۲۰ روز یکبار شارژ می کنم وقتی شروع به صحبت کردن می کنید به صورت خودکار آهنگ رو نگه میداره و صدای محیط رو براتون واضح می کنه و در پایان مکالمه دوباره موزیک رو پخش می کنه  کیفیت صداش واقعا محشره و بیس موزیک رو به معنای واقعی میرسونه ، خیلی راحت با ایفون و اندروید سینک میشه اگه وقتی هدفون داخل محفظش هست از دستتون سُر بخوره و بیوفته روی زمین بخاطر وجود آهنربای قوی ، هدفون ها به بیرون پرت نمیشن و برای تست برد هدفون هم خدمتتون بگم اگه گوشی رو بزاری انتهای خونه همه درهای تو مسیر رو ببندی و بری تو بالکن وایسی باز هم قطع نمیشه صدا حتی یک لحظه هر کی خرید مبارکش باشه"
5,کیفیت صدای بسیار خوبی داره تو گوش هم خوب وایمیسته و نگران نیستی که بیافته شارژشم به نسبت اکثر ایرفون ها بیشتر بازدهی داره فقط شاید این مقدار هزینه برای ایرفون معقول نباشه اما لذت موسیقی رو دوچندان میکنه
5,"راضیم کیفیت خوبی داره زیباست بیش از یک ساله دارمش و هیچ ایرادی پیدا نکرده"
4,"اگه این هدفون رو بهترین جهان میگید. پیشنهاد میکنم حتما هدفون بوز هم مورد برسی قرار بدید.   Bose QuietComfort Earbuds"
5,خوبه واقعا از ایرپاد پرو خیلی بهتره
5,از خرید این هدفون پشیمان نخواهید شد . اگر مشکلی در قطع و وصل پخش موسیقی هنگاه صحبت کردن دارید بخاطر هوشمند بودن این هدفون میباشد. میتوانید این قابلیت را در تنظیمات نرم افزار اختصاصی این هدفون غیر فعال کنید. قابلیت نویز کنسلینگ عالی درحد wh1000xm4 بزرگ که روی گوشی هست تشکر از دیجی کالا و تامین کننده برای ارسال به موقع. بسته بندی کاملا نو و آکبند بود.
5,  عالی عاالی 
5,حرفی برای گفتن باقی نمی‌گذارد
4,بسیار با کیفیت .البته من ب علت عملکرد ضعیف باتری مرجوع کردم (۳.۵ الی ۴ ساعت پلی موزیک داشت)ک با ۸ الی ۱۲ ساعت اعلان شده خیلی فاصله داشت.
5,"بیس عجیبی داره خستت نمیکنه حتما گارانتی دارش رو بگیرید طول میکشه بهش عادت کنی یه سبک خاصیه باطریش عجیب خوبه واقعا خوبه افسوس و حیف بعد کلی انتظار برا موجود شدنش با گارانتی گوشی چپش برا کوشم کوچیکه شاید بفروشمش اگر ایرتیپ بزرگ تر براش پیدا نکنم"
4,با کلی ایرادی که داشت مرجوعی ثبت کردم ولی دیجیکالا قبول نکرد، متاسفم واستون
