4,فعلا که خوبه با قیمت مناسب
5,کاربردی ومقاوم
5,کم نظیره این فلش
4,فلش با این قیمت عالیه
3,فلش معمولی باسرعت نرمال
5,من از دیجی کالا رازی هستم
4,سرعت قابل قبول داره و بدنه فلزی محکم داره 
1,"12  گیگ اهنگ میخوام بریزم ۵۰ بار کنسل شده  برندا بهترو بخرید  پول بیشتر بزارید از همین دیجیکالا جنس بهتر بگیرید"
3,خوب
4,نسبت بقیمت کیفیت خوبی دارد
4,نسبت بقیمت بصرفه بود ممنون
5,سرعت خوب کیفیت ساخت خوب
5,یک هفتس خریدم فعلا که خیلی خوب بوده
3,از نظر اینکه به جا کیلدی وصل میشه و گم نمیشه خوبه ولی موقعه انتقال فایل خیلی نوسان داره و موقعه انتقال یه فیلم بالای 10-15 بار بین سرعت 0-20 مگ نوسان میکنه.
4,در کل خوبه 
2,سرعتش خیلی کمه
4,سرعتش پایینه ولی بد نیست 
5,من از راضی هستم کارمو راه انداخت
4,خوب و بادوام
4,خوبهههههههه
5,نسبت به قیمتش عالیه
5,عالی
5,خوب بودمثل همیشه
5,نسبت به بقیه فلش ها هم قیمت مناسبتری داره و هم گارانتی عمر داره !
5,نسبت به قیمت واقعا عالیههه
4,سرعتش پایینه خوب ولی خوشگله 
5,عالی.        
1,اصلا راضی نبودم سرعتش خیلی پایین بود مرجوع کردم دیجی کالا میگه پولشو پس نمیدیم و کالا رو براتون پس میفرستیم قبلا دیجی کالا خدماتش بهتر بود کاری میکنن آدم دیگه اینجا خرید نکنه
5,چندین ماهه دارم استفاده میکنم آخ نگفته 
3,فلش سالم بود و خوب کار کرده تا الان من یکسال خریدم
0,سرعت خیلی بالایی نداره اما کار راه بندازه...
4,خوب بود بد نیست در واقع ولی قابل استفاده هست ممونم از سازندش
4,فلش خوبیه، گارانتی خوبی هم داره، سرعتش معمولیه... بدنه خوبی داره. در کل ارزش خرید داره. 
1.9,یک ماه نیست استفاذده میکنم ولی کاملا خراب شده و رو هیچ سیستم عاملی بالا نمیاد
3.2,فلشه خوبیه و داشتن گادانتی مادام از مزایایی که این برند داره، البته من تو پیشنهاد ویژه گرفتم که عالیه
4,کیفیت خوب و قابل قبولی داره
0,امروز تموم موارد باشد بهتر میشود
0,نسبت به قیمت و حافطه و جنس خیلی مناسب است
4,قیمت مناسب عالی ارزش خرید دارد کیفیت خوب
4.5,نسبت به قیمتش و حافظه اش ارزش خرید را  دارد .
3.2,نسبت به قیمتش می ارزه
5,من قبلاً هم گرفتم از این فلش واقعا خوب و به صرفه
3,آی پی ام گارانتی معتبر و خوبی هست و در اکثر شهر ها هم نمایندگی گارانت داره همین خیال آدمو از بابت خرید راحت میکنه
3,چیز خاصی ندارد ولی اذیت کن هم نیست
0,باتوجه بی قیمت کیفیت خوبی داره
4.4,"فلش خوبیه این مارک خیلی خوب خودشو نشون داده حتما از این مارک بخرید"
3,فلش قشنگیه اما سرعتش مشخص نیست
