5,عالی بود
5,عالیه عالی پیشنهاد میکنم
5,با این میزان قیمت بسیار خوب است 
5,کارت خوبی هست
4,درود بر عزیزان بنده چند ماهی هست این کارت رو دارم کار راه بندازه بازی ها رو رو 60 فریم با کیفیت 1080 خوب اجرا میکنه ولی نتونستم مدل سوپر رو پیدا کنم عملکرد اون به نسبت این مدل واقعا بالاتره و صرفه اقتصادی بهتری داره
5,این کارت رو دو سال پیش خریدم و هر روز ازش بالای ۱۵ ساعت کار سنگین میکشم.ولی هنوزم عین روز اولش کار میکنه و هیچ مشکلی حتی افزایش دما هم براش پیش نیومده.پیشنهاد میکنم بجای خرید برندهای متفرقه که الان تو بازار زیاد شده برندهای مطمعن مثل گیگابایت و ایسوس بخزید.من MSI هم داشتم ولی خیلی زود براش مشکل دما یا هنگ کردن و ریست شدن سیستم پیش میومده
5,من این گرافیک رو چند روزی هست که خرید،البته نسخه بدون گارانتی و ارزونتر، از هر نظر خوبه،ویچر ۳ رو با گرافیک اولترا رزو ۴کی راحت اجرا میکنه،دمای کارت خیلی پایینه صدای فن اصلا نمیاد،با یه کوچولو اورکلاک بین ۳۱و۳۲ هش میده با ۹۶وات مصرف و دمای ۶۴
