5,پیشنهاد میکنم
5,بسیار عالی  پردازنده قوی صفحه نمایشگر با ابعاد و کیفیت خوب
5,عالی
5,تبلت خوبی هست
5,بهتر از چیزی بود که انتظار داشتم . برای پسرم خریدم اندازه مناسب داره و سبک هست  . خیلی راحت باهاش میشه کار کرد
5,سلام. لطفاً هرچه سریع‌تر موجودش کنید. مدت‌هاست میخواهم تهیه کنم ولی موجود نیست.
5,لطفا نسخه ۲۵۶ گیگش رو موجود کنید
5,لطفا موجود کنید
5,عالی
4,دوسش دارم
5,سلام من این ایپد رو دقیقا 2 ماه پیش خریدم خیلی رازی هستم به دلیل پردازنده عالی برای گیم و کارهای روزمره عالی هست تنها مشکلی که داره نخوردن سیمکارت که چون ریجستر نمیشه با سیمکارت هیچ فایده ای نداره از نظز من بهترینه
5,عالی ولی گران
5,بسیار زیبا خوش اندازه و با کیفیت ساخته شده
5,"مدتها منتظر موجود کردن محصول بودن اما به محض اینکه از بازار خریدم دیجیتال کالا آورد . بهر حال در مقایسه با انواع تلبت air and pro این دستگاه ویژگی های را داراست که منحصر به فرد میکنه ، اندازه و وزن بسیار مناسب آن باعث میشه به راحتی در کیف جا بشه و بدون احساس وزن زیاد بتونید بعنوان کتابخوان ازش استفاده بفرمایید . همه ی قابلیتای خوب آی‌پد را داراست .  اما در صورتی که کار گرافیکی می‌کنید یا فیلم زیاد می بینید احتمالا این دستگاه برای شما کوچک باشه  در کل برای خرید آی‌پد حتما بر اساس نیازتون انتخاب کنید"
5,سلام خیلی وقته منتظر خرید این تبلت هستم لطفا موجود کنید
5,سلام دیجی کالا من خیلی این تبلتو نیاز دارم میشه موجود کنید
5,لطفا موجود کنید
5,موجود کنید لطفا
5,موجود کنید لطفا
5,لطفا سریعتر موجود کنید رنگ طوسی
5,ولی واقعا عالی کاش سیم کارت خورش بیشتر موجود بودتو بازار
5,در کل خودم بعد کلی تحقیق خریدم و قیمت اینجا از بازار چند میلیون ارزون تره تو خریدش شک نکنید
5,تشکر از دیجی کالا دستکاه بسیار خوب و فرندلی است به موقع به دستم رسید پکیج سالم و اوریجینال و خوش دست پیشنهاد میکنم حتما بگیرید مخصوصا با این حافظه ۲۵۶ گیگابایتی
0,هنگام استفاده از گیم زود داغ می‌کنه حتما براش فن خنک کننده تهیه کنید اگر از گیم زیاد استفاده میکنید در مجموع یه تبلت جمع و جور بدرد بخور هستش من پیشنهاد میکنم
5,عالیه هم شارژش هم کیفیتش
5,واقعا از هر لحاظ عالیه 
4.4,از همه نظر شاه کار و به درد بخوره (یکم باتریش ضعیفه)
5,لطفاً سیم‌کارت خور این مدل را موجود کنید
5,کسانی که استفاده روزمره دارن و میخوان متن بخونن و فیلم ببینن و بازی کنند بسیار مناسب و خوش دسته مهمتر از اون حمل کردنش در طول روز خیلی راحت و بی دردسره
5,سالم و با بسته بندی خوبی رسید، برگه گارانتی هم همراهش بود
5,لطفا موجود کنید نمیخوام برم از بیرون بخرمش مدت خیلی زیادیه منتظر هستم موجود کنید
5,لطفا زود موجود کنیییییییییییییییییییییید
5,"به نظر من اگر دنبال یک کنسول پرتابل هستید آیپد مینی ۶ یکی از بهترین گزینه هاست. مزایا: استفاده از متریال خوب و کیفیت ساخت عالی که باعث میشه موقع استفاده از آیپد مینی حس خوبی رو به آدم بده. استفاده از پردازنده A15 bionic که هر کاری رو انجام میده و تا به حال هیچ پردازنده ای نتونسته این پردازنده رو شکست بده. و همچنین اندازه کوچیکش باعث میشه که راحت تر ازش استفاده کرد برعکس آیپد های بزرگتر معایب: متاسفانه آیپد مینی ۶ یک ایراد بزرگی داره و اون هم صفحه نمایشش هست یا همون مشکل (jelly scrolling) هست  که البته باید اینو بگم که زیاد هم اذیت کننده نیست و افراد کمی متوجهش میشن و بعدیش هم 120HZ نبودنش هست که بعد چند روز آدم عادت می‌کنه."
5,موجوود کنییید
5,100% ارزش خرید داره به شرطی که قیمت فضایی نزارن براش از لحاظ کیفیت و امکانات پیشرفت خوبی داشته و کاربردی هستش . البته باید به ابن نکته توجه کرد که معمولا ipad  برای کسانی که طراحی دیجیتال میکنن و کارای ادیت انجام میدن خیلی بهتره و در دسترسه همه جا همیشه و امیدوارم که همراهش لوازم جانبی هم موجود کنه دیجی کالا
5,موجودش کنییییید
5,از نظر مشخصات سخت افزار که خوبه باید عملکردش دیده بشه
4,این تبلت به نظرم نسبت به ابعاد و امکانات و کیفیت و تعییر نسبت به نسل قبل زیاد بوده فوق العاده است ایشالا با قیمت هوایی راهی بازار نشه و قیمت خوبی داشته باشه،  تشکر از دیجی
