1,دو بار این لپ تاپ رو سفارش دادم، هر دو بار هم یه لپ تاپ اشتباه ارسال شد که مشخصاتش با چیزی که من سفارش دادم خیلی فرق داشت. با اینکه مشکل اطلاع داده شده بود، جوابی که از دیجی کالا گرفتم این بود که مشکل از طرف اونها نیس. حداقل در این مورد نه تنها اثری از مشتری مداری مشاهده نشد، بلکه سلب مسئولیت هم شد
5,عالی
5,این لپ تاب یکی از بهترین های بازاره مخصوص کارهای گرافیکی سنگین و گیم توی این بازه قیمتی خیلی خوب و عالیه پیشنهاد میکنم
5,من از دیجی کالا نخریدم از بازار خریدم ولی لپ تاپ عالی هست بسیار پیشنهاد میکنم
5,سلام هزینه کالا معمولا نسبت به سایت های دیگه گرونتر هست و در ندارد اعتباری هم مبلغی رو بابت هزینه های جاری کسر میشه که بهتره جهت رقابت بیشتر و افزایش خرید تدابیر در این دو موضوع اندیشیده شود.
5,بسته‌بندی لپ تاپ کاملاً پلمپ پک لپ تاپ برای خاورمیانه بود که از امارات وارد شده بود مانیتور ۱۴۴ هرتز که بسیار با کیفیته و برای این سیستم راضی کننده است  تنها مشکلی که من از این لپ تاپ دیدم درایورهای لپ‌تاپ بود ، که خیلی وقت بود آپدیت نشده بود ، و برای آپدیت کردن درایورها از طریق اپلیکیشن مای ایسوس میتونید اقدام کنید
5,"همه چیز عالی فقط تنها ایراد افتادن اثر انگشت روی لپ تاپ است که خیلی به سختی پاک میشه بعد از نصب ویندوز ۱۱ وای فای نمیشناسه و باید حتمن با کابل به اینترنت وصل شید و اپدیت کنید تا درایور وای فای نصب بشه همچنین درایور  گرافیک"
4,سرعتش عالیه
