5,خیلی عالیه
5,مودم خوبی هست فعلا یک سه روزه دستم رسیده و lte ایرانسل انداختم توش با اینکه ما جایی هستیم که ۵۰۰متر انطرف تر انتن نیست خوب داره کار میکنه  ۲بار انتن پرید و خاموش روشن کردم درست شد فقط
5,خوب
1,با اینکه سعی کردم وسط خونه بزارم ولی باز توی اتاق خواب آنتن نمیده، خونه هم خیلی بزرگ نیست. فکر کنم بردش ۱۰متر باشه قبلاً L01 داشتم ۷ طبقه پایین تر ، از بیرون خونه هم وصل میشد
5,"سلام  دوستان عزیز برای خرید این مودم شک نکنید یکی از بهترین های حال حاضر بازار است و میتوانید انواع سیم کارت رو برروی آن قرار بدید و با توجه به محلی که هستین از کیفیت و قدرت این مودم استفاده کنید. توجه کنید تا می توانید مودم را نزدیک به پنجره و در نقاط بالا قرار بدهید تا براحتی بتوانید سیگنال های لازم رو از دکل مخابراتی دریافت کند. البته در بخش مدیریتی خود مودم قسمتی است که میتوانید سیگنال دریافتی رو طی زمان 10 ثانیه چک بکنید و محل مناسب برای قرار دادن مودم را پیدا کنید. برای استفاده از باند 5GHz حتما باید دیوایس شما از این باند پشتیبانی کند در غیر اینصورت در لیست wifi های خودتان مشاهده نخواهید کرد. در تست دانلود یک فایل 1 گیگی در مدت زمان کمتر از 2 دقیقه تمام شد و در برنامه SpeedTest به سرعت دانلود 103 مگابیت بر ثانیه رسیدم. بدرود..."
5,من چند سالی مودم td lte ایرانسل سری فیوژن دارم این مدل B612 رو گرفتم برا مغازه که میشه گفت سرعت اتصال به وای فای به مراتب از سری فیوژن بهتر هست 
4,مودم خوبیه فقط کسی راه حلی برای dns ایکس باکس سراغ داره بگه ممنون میشم
5,با سلام من این مودمو حدود یک هفته هست که خریدم اول از طراحیش بگم که ابعاد معقولی داره به صورت ایستاده قرار میگیره پنج چراغ led داره سه تا برای آنتن یکی برای وایفای و یکی هم برای روشن بودن اتصال اینترنت، دوتا دکمه هم بالاش داره یکیش فکر کنم برای wps و دیگری هم دکمه پاور هست که باید چند ثانیه نگهش دارین تا خاموش یا روشن بشه، زیبا هست بنابراین هر جایی قرار بدین دکورتونو خراب نمیکنه، کیفیت ساخت مناسبی هم داره زیاد داغ نمیکنه فقط یکم گرم میشه که طبیعیه، پسوورد وایفای و تنظیمات پشت محصول نوشته شده، محتویات جعبه خود مودم و آداپتور و فاقد سیم lan هست، آرم پشت محصول soyealink هست که انگار هواوی برای دور زدن تحریمها مودمو با این مارک روونه ی بازار کرده، یک اپلیکیشن هم بنام Ai life داره که در ابتدا کار نمیکرد ولی یکی از دوستان لطف کرده بود داخل پرسشها گفته بود ریجنو روی هنگ کنگ بزاریم درست میشه که اینکارو کردم و اپ کار کرد خیلی قابلیت های جالبی داره مثلا یه قسمت میتونین نقشه خونه و متراژ و محل قرار گیری مودمو بهش بدین و بهتون میگه کدام نقاط خونه آنتن وایفای خوب و کدام نقاط بد هست یک سری تنظیمات دیگه هم مثل مقدار مصرف یا تعداد دستگاه های متصل هم داره، برسیم به سرعت و آنتن دهی باید بگم من نزدیک ده سال از اینترنت adsl استفاده میکردم که این سال آخر نمیدونم دلیل اصلی چی بود ولی به علت کندی سرعت واقعا اذیت کننده و عملا غیر قابل استفاده بود به همین دلیل برای اولین بار سمت اینترنت td lte اومدم و الان از سیم کارت ایرانسل استفاده میکنم از لحاظ سرعت واقعا راضیم داخل بازی کالاف موبایل پینگ ۵۰ الی ۹۰ میده سرعت دانلود از سایت های داخلی خیلی خوبه اما از سایت های بین المللی و استفاده از vpn سرعت کمی کاهش پیدا میکنه، قابلیت نصب vpn داره اما برای بازی با ps5 و اتصال dns مطمعن نیستم باید تحقیق کنین چون من ندارم که امتحان کنم، عکس تست سرعت هم میزارم زمانهایی که استفاده از اینترنت بیشتره سرعت حدود ۲۰ الی ۳۰ هست اما اواخر شب به ۵۰ الی ۶۰ Mb میرسه، سرعت آپلود هم داخل عکسها مشخصه، نویز و قطعی فعلا ندیدم، آنتن دهی تو منطقه ما بد نیست ما طبقه دوم هستیم پیشنهاد میکنم مثل من تمام نقاط خونه رو امتحان کنین برای من در بعضی نقاط دو چراغ آنتن و در بعضی نقاط سه چراغ روشن بود ولی اینو اضافه کنم مثلا جایی سه چراغ آنتن پر بود و سرعتش با جای دیگه از خونه که اونجا هم سه چراغ پر بود فرق میکرد پیشنهادم اینه که نقاط مختلف خونه امتحان کنین و تست سرعت بگیرین تا به بهترین جا برسین در کل از خرید این مودم راضی هستم به نظرم اینکه میشه از اپراتورهای مختلف استفاده کرد یک مزیت بزرگ هست، باید دید در طولانی مدت هم عملکرد خوبی داره یا خیر، ببخشید نظرم خیلی طولانی شد امیدوارم بهتون کمکی کرده باشم ممنون
5,کیفیت کالا خیلی خوبه.
5,این مودم عالیه. یک ساله استفاده میکنم شاید چهار یا پنج بار خاموش روشن کرده باشم. سرعتش از گوشی یکم پایینتر هست البته فکر میکنم برای سیم کارت اینترنت ثابت باشه چون ظرفیت این مودم ها بالاتر از سرعت نت ایران هست.
4,دستگاه خوبیه و چون آنلاک هستش برای جاهایی که برخی سیم کارتها پوشش ندارن، میشه از سیم کارتهای شرکتهای جایگزین استفاده کرد
5,عالی
4,الان دو روزه دارم از tdlte ایرانسل استفاده میکنم و توی نقشه مناطق تحت پوشش دقیقا روی مرز قرار داریم. با تست سرعت از speedtest.net پینگ 40 تا 60 و سرعت دانلود 30 تا 45 مگابیت و آپلود بین 4 تا 8 مگابیت دارم و راضیم. شاید بعدا که خواستم برای گیم هم استفاده کنم از آنتن لگاریتمی هم استفاده کنم.
4,دوستان عزیز من این مودم ۳ سال هست دارم مودم فوق العاده هست همه جا دنیا میتونی ببریش و ازش استفاده کنی فقط تنها عیبش اینکه تا شعاع ۱۰ متری از جایی که قرار داره رو پوشش میده
5,"جایی که من زندگی میکنم آنتن دهی tdlte ضعیفه اما این مودم در حال حاضر به خوبی کار میکنه و سرعت تا ۱۸ مگابیت بهم میده فعلا خوبه و تز خریدم خیلی راضی هستم. راه اندازی بسیار آسانی داشت سیم‌کارت رو در شیار مخصوص میزارید و مودم رو روشن میکنید در اولین اتسال اتومات صفحه وب تنظیمان دستگاه میاد و رمز وای فای و مشخصات دلخواه رو قرار میدید و راه اندازی انجام میشه"
4,یه مقدار گرمتر از مودم های td lte دیگه هست که دلیلشو نمیدونم ولی در کل راضیم
5,همه جور سیم کارت بهش میخوره . پیشنهاد میشه
1,دستگاه اصل نیست متاسفانه دیر متوجه شدیم. این رسما کلاه برداریه با توجه به این که مشخصا توی توضیحات و اسم کالا نوشته شده هواوی
5,عالی - اولین مودمی بود که سر تا سرخانه را پوشش داد
4,به نظر خوب میاد
5,کیفیت و قدرت مناسب 
5,سرعت بالا آنتن دهی خوب اما قیمت گران
4,"کار راه اندازه،  با سیم تمام اپراتورها کار میکنه. و اما... ارسال بد بود. من یه مودوم با گوش گیر سفارش داده بودم، پَگ گوش گیر کثیف و چرب بود و گذاشته بودنش روی جعبه مودوم و همه رو کثیف و چرب کرده بود. ای کاش ازش عکس میگرفتم و اینجا میزاشتنم. خواهش میکنم به ارسال نظارت بیشتری بکنید"
3,دوستان توجه بفرمایید که توی این مودم و تمامی مودم های هواوی و زیر مجموعه ان به هیچ عنوان نمیتونید DNS استفاده کنید نه روی دیوایس نه روی مودم به این معنا که شما از کنسول و اکانت مایکروسافت به هیچ عنوان نمیتونید استفاده کنید و متاسفانه چنین نکته مهمی در هیچ جا ذکر نشده و بنده حتی با گارانتی idh تماس گرفتم اطلاع نداشتن!!! گفتن مودم رو بیار حضوری رفتم و بعد از یک ساعت گفتگو و تست کردن توسط خود نمایندگی پذیرفتن!!
5,عالی
4,ما طبقه دوم ساختمان هستیم و اطراف ساختمان ما باز نیست به خاطر همین آنتن دهی خوبی نداره و فقط سه خط آنتن پر میشه سرعت دانلود تا 15 مگابیت و آپلود زیر 1 مگابیت هست به خاطر آنتن دهی بد پینگم تو کالاف میانگین 60 هست البته همه این چیزایی که گفتم با وای فای هست و هنوز از کابل لن استفاده نکردم تنظیمات پیچیده ای نداره فقط یه رمز میزاری و استفاده میکنی
4,كيفيت خوب
5,بهترین مودم آنلاک توی این رنج قیمت تمام فرکانس های tdd و fdd رو روی تمام سیمکارت های ایران ساپورت می کنه وای فای ax داره (که البته برای ۹۹ درصد کاربردی نداره)
4,کیفیت ساخت خوبی دارد و تا برد ۱۳۰ الی ۱۴۰ متر مربع را پوشش میدهد.
5,در کل سرعتش از گوشی کمتره ولی اینترنتش خیلی ارزون میوفته و بنظرم ارزششو داره 
0,عالی خوب مودم خوبیه
4,کلا خوبه
5,دستگاه خیلی قوی هست گارانتی هم داره کلا پسر من خیلی تحقیق میکنه تا یه وسیله بخره واقعا راضی هست ممنون از دیجی کالای عزیز و ارسال به موقع بچه های من با کالاهای دیجی بزرگ شدن تشکر
5,با تست هایی که گرفتم با سیمکارت های مختلف کیفیت قابل قبولی ارائه داد ... از این مودم انتظار چیز فراتر از اینترنت ایران نداشته باشید ... سرعت در حد سیمکارت های موبایل هست هرجا انتن موبایل بهتر باشه سرعت بهتری میگیرید
4,کیفیت متوسط
5,"ابتدا عرض کنم  من با گارانتی دوساله ایزی خریدم اما فروشنده لطف کردن و با گارانتی سه ساله فرستادن (با همون قیمت دوساله ایزی)     این مودم رو در حال حاضر سیم تی دی نداشتم اما با سیم ۴ جی شاتل (که رو همه اوپراتور ها وصل میشه)  تست کردم . عالی بود  سرعت تا حدود صد مگابیت رفت  البته با انتن دهی حدودا ۶۵ درصد که خیلی برام جالب بود. پینگ هم خوب بود که در عکس کیتونید مشاهده کنید اما به محض اتصال گوشیم به وای فای این مودم و باز کردن برنامه ال لایف خودش مودم Cep3 رو شناخت .  امکانات کاملی برنامش داره بخصوص قابلیت اوپتیماسز کردن انتن دهی که میتونید در جاهای مختلف خونتون تست بگیرید و سیو کنید و بهترین موقعیت انتن دهی رو انتخاب کنید.   من منوی کد دستوریشو پیدا نکردم اما قابلیت ارسال و دریافت پیامک داره . آپدیت: تاریخ گارانتی ایزی رو که در سایتش چک کردم مشاهده کردم تاریخ انقضای گارانتی تا اخر 1403 هست یعنی گارانتی دو سال هم نداره همچنین برروی جعبه مودم درج شده با عضویت در کلاب ایزی 1 سال گارانتی افزایش پیدا می کنه که امکان عضویت در کلاب بعلت عدم پشتیبانی از ارسال ایمیل فعال سازی و ارور های ایمیل شرکت ایزی مقدور نشد لذا در جمع بندی گارانتی ایزی رو بهتون پیشنهاد نمی کنم."
5,کارایی عالی
4,"یکی از بهترین مودم های بازاره ولی قیمتش کمی زیاده این مودم خودش آنلاک هستش و نیاز به هزینه اضافی  برای آنلاک کردن نیست"
5,تنها ضعفش پنل مدیریت هست 
5,خیلی خوبه که لاک نیست
5,"سلام من حدودا ۵-۶ ساله که از سرویس TD-LTE استفاده می‌کنم. مودم قبلی من TF-i60 H1 (b612) ایرانسل بود که متاسفانه از دستم افتاد و دیگه سیم کارت نخوند و تعمیر نشد. اینبار دوباره خواستم TF-i60 H1 ایرانسل بگیرم که با کمی تحقیق متوجه شدم b622 از b612 بهتر و جالبتر اینکه ارزونتر هم هست!!! به همین علت این مودم رو خریداری کردم و واقعا عالیه، نکته ای که باید بهش اشاره کنم، روی جعبه این مودم رو حتما بخونید، برای من یک برچسب خیلی خیلی کوچولو برای فعال سازی گارانتیش زده بودن که اگه روی جعبرو نگاه نمی‌کردم عمرا متوجه می‌شدم. توی منطقه ما پوشش دهی ایرانسل کمی ضعیفه و بدون نصب آنتن خارجی ماکسیموم 10 مگابیت دانلود و پینگ 110-140 می‌داد، برای همین آنتن اکسترنال لگاریتمی که از مرحوم مودم قبلیم به جا مونده بود رو به این مودم متصل و تنظیمش کردم و حالا با آنتن اکسترنال پینگ 80-90 و سرعت دانلود 25-42 مگابیت می‌گیرم. و یک مشکل دیگه که من رو خیلی اذیت کرد، راه اندازی اپلیکیشن مودم بود، چون که این مودم به دلیل تحریم ها توسط خود هوآوی تولید نشده و توسط سویالینک که یک شرکت چینی هست تولید شده، نصب و راه اندازی این مودم روی اپلیکیشن AI Life هوآوی کمی پیچیده و اذیت کنندست و من در نهایت نتونستم اپلیکیشن مودم رو روی اندروید راه اندازی کنم، ولی تونستم روی ios به راحتی فقط با نصب اپلیکیشن مودمم رو شناسایی و اپلیکیشن رو راه اندازی کنم. همچنین برعکس مودم TF-i60 ایرانسل، درون جعبه این مودم کابل LAN وجود نداره، برای همین اگه می‌خوایید مودم رو با کابل به کامپیوتر و لپتاپ و تلویزیون و کنسول و سایر دیوایس ها وصل کنید، حتما اگه کابل LAN ندارید، کابل LAN هم تهیه کنید. در نهایت این مودم به نظر من از مودم b612 یا همون TF-i60 خیلی بهتره و پیشنهاد می‌کنم."
4,اگه میخاین از دست ADSL راحت شین حتما پیشنهاد میکنم البته حتما از سیم‌کارت TD LTE استفاده کنید که مقرون بصرفه تره
4,چند روزه زدم به برق و کار میکنه مشکلی نداره فعلا.خیلی راحت تنظیماتش انجام شد.انتن دهیش از موبایل قوی تره و تاثیر میزاره.من همیشه از موبایل قدیمی که داشتم هات اسپات میکردم.اپ Ai life رو دانلود کنید و باهاش خیلی راحت به مودم وصل شید.تا جاییکه فهمیدم اگر بازم از این مودم یا مشابهش داشته باشید به هم وصل میشن و شبکه بزرگتری رو میسازن
5,به خاطر آنلاک نبودن خیلی مزیت داره و سیم کارت انواع اپراتورها رو جوابکو بوده و انتن دهی خوبی داره.
2,"من این مودم رو چند ماهی میشه خریدم از دیجیکالا اگه تو اتاق باشه تو اتاق دیگه انتن خیلی قوی ای نداره. سیم کارت وقتی تو گوشی هستش حتی سرعتش بهتره وقتی توی این مودم هست و بدی دیگه این مودم اینه که خیلی پیش میاد کانکشن قطع میشه و بعد یک دقیقه دوباره وصل میشه. انگار که مودم کلا خاموش روشن میشه."
5,"من این مودم رو تهیه تقریبا میشه گفت بهترین مودم فورجی  که میشه به سرعت نزدیک به 150 هم دسترسی پیدا کرد بدون هیچ دردسری میشه گیم بازی کرد"
5,عالی‌‌‌‌‌‌‌‌‌
4,با سیم کارت، lte ایرانسل خوب کار کرد با سیم کارت های دیگه فرقی احساس نکردم
4,این مودم بدون نیاز به تنظیمات اضافی، به راحتی وصل میشه ولی من تو یکی از بهترین نقاط تهران از نظر آنتن دهی و با سیم‌کارت ایرانسل تستش کردم و سرعت بالای 3 مگ ازش ندیدم درحالی که با گوشی تونستم به راحتی تا 7 8 مگ دانلود کنم
2,"وقتی سیم کارت رو گذاشتم و مودم رو به برق زدم چراغ اینترنتش قرمزه و انتن اصلا نمیده!!!  در ضمن دستگاه رو تپی ساتشرکت برای گارانتی ثبت کرده بودم"
5,به نظر من مودم خوبی است، کیفیت مطلوبی دارد و آنتن‌دهی آن نیز حتی در جاهای کم آنتن مناسب است.
5,بهترین مودم برای استفاده خانگی ، خیالتون راحته که با همه سیم کارت ها و اوپراتور ها هم کار میکنه ، قدرت گیرندگیش هم تو نقاط با سیگنال ضعیف خیلی خوبه . کلا خیالت از بابت همه چی راحته و لازم نیست گیر دردسر و مشکلات مودم های لاک شرکتی بیافتید .
4,مودم خوبیه لاک نیست سیمکارت راحت وارد و خارج میشه تنظیماتش سادست و کیفیت و سرعت خوبی هم ارائه میده انتن خارجی هم که میخوره و وایفای 5GHz هم داره موقع استفاده هم کم داغ میکنه در حد گرمای معمولی و هم سیمکارت 4G و هم TDLTE رو ساپورت میکنه
5,عاولی
3,"دو ماه این مودم  b622 داشتم چون تنظیمات محدود شده سرعت زیر ۱۰ میگرفتم  بعد رفتم مودم b612 H1 گرفتم سرعت تا ۴۰ مگ رفت رو حالت CA گذاشتم حالت Mimi 4*4 هم داره که مودم ۶۲۲ نداره  البته پوشش منطقه ما ضعیف هست  فقط بسته های tdlte ایرانسل به صرفه هست  با *20# با خط ایرانسل از پوشش دهی ایرانسل مطمئن بشوید  در کل اگه پوشش منطقه ضعیف h1 بگیرید  اگه پوشش منطقه شما قوی هست b622 بگیرید"
3,پورت تلفن در نظر گرفته شده روی محصول با فریم‌ور همخوانی نداشته و قابلیت بهره‌برداری ندارد
4,از وقتی گرفتمش راحت شدم ولی بدنه اش از پلاستیک خشکه و موقع خاموش شدن صدا میده. 
5,سیمکارت روی مودم نبود.مجبور شدیم جدا بخریم.سرعتش هم انقدری نسبت به مودم قبلیمون (براتلفن ثابتبود) بالا نیست
5,با توجه به محدودیت های فعلی بازار گزینه خوبی است.
4,درکل برای افراد غیرحرفه‌ای ای خوبه 
5,از خریدم راضی هستم و توصیه میکنم
5,"مودم هواوی ولی بخاطر تحریم هواوی با اسم دیگه  به تولید میرسه  هم ۴g و هم td lte ساپورت می‌کنه واوی فای ۵ گیگاهرتزی   دو تا انتن خروجی extrnal داره میتونی انتن لگاریتمی بزنی بهش جاهای بد آنتن قشنگ انتن بده واقعا کمتر از b612 نداره"
3,سرعت بسته به اپراتور
5,من ازش بعنوان روتر وای فای 6 استفاده می کنم و سرعت بالایی داره
4,بعضی وقت ها قاط میزنه که باید حتما روشن و خاموش کنید که با ریست اسکوژل میشه درستش کرد
5,بسیار خوب 
4,با توجه به عدم وجود مودم های خوب متاسفانه در حال حاضر این مودم خوب است.
4,خیلی خوبه راضی ام ازش
5,خوب عالی 
5,سرعت خب
5,ای کاش فروشنده ها یا دیجی کالا یه توضیحی بده که این مودم رو هواوی تولید کرده یا نه؟ تو دیدگاهها دیدم که نوشته بودن به خاطر تحریم با مارک دیگه به فروش می رسه درحالیکه اگه اینجوری باشه پس چه جوریه که مارک خود هواوی هم تو بازار هست و یه خورده از این مدل مارک دیگه گرونتر هست؟ شفاف سازی هم از حقوق مصرف کننده هست که باید دیجی کالا تلاشش رو تو این زمینه بیشتر کنه
5,عالی و بیست
5,"کلی گشتم تا اینو پیدا کردم. مشکلم رو حل کرد. سرعت 200mbبا سیمکارت همراه اول با سرور داخلی گرفتم. با دیتا ایرانسل سرعت 80mb. با رایتل هم 25mb. با فیلتر شکن هم سرعت 110mb با سیمکارت همراه اول. با دیتا ایرانسل 45mb. با رایتل هم 18mb."
3,عالی
4,مودم ساخته شده سویالینک (تحت لیسانس هواوی هست) روی بسته بندی آرم و برندی از هواوی ذکر نشده. اما از نظر ساختاری با هواوی 622 کاملا یکسانه فقط به جای لوگوی هواوی روی بدنه +4G درج شده. خیلی تحقیق کردم برای خرید. برخی S1 ایرانسل رو پیشنهاد دادن اما تعدادی از دوستان داشتن و راضی نبودن ازش. بنابراین همین B622 رو خریداری کردم. سرعت خوبی هم با lte ایرانسل ازش گرفتم
