5,خیلی عالیه
4,"من سیم ایرانسل TD LTE توش انداختم و با توجه به اینکه خونه ما تقریبا بیش از 90 درصدش تو پوشش اپراتور ایرانسل بود از این سیم استفاده کردم. دم پنجره دو آنتن از سه آنتن فول هست که در بعضی مواقع هم دو آنتنش یهو میشه فول و سه آنتن. سرعت و کیفیت پایداری ارتباط بسیار خوب بنظر رسید. یک نکته رو هم اضافه کنم درخصوص دوستانی که نسنجیده و غیر علمی نظر می دهند و آن هم این که سرعت تی دی ال تی ای ایرانسل که به گفته خود اپراتور از 1 تا 80 مگ هست؛ واقعا بستگی به منطقه و خلوتی دکل در اون منطقه و امواج و نویز در اون منطقه هست. ممکنه یکی 80 مگ رو بزنه و یکی مثل من در  منطقه ای که هستم در بهترین حالت و خلوتترین حالت ممکن 40 تا 45 مگ رو بزنم. می خوام بگم (سرعت) به خیلی چیزها بستگی داره و ممکنه در اون لحظه که دارید تست می کنید حتی سرعت اینترنت کشور دچار اختلال باشد. لذا لطفا سریع نظر ندهید که چون من توش TD-LTE  انداختم و بیشتر از 20 مگ نداد و موبایلم مثلا با اینترنت سیم کارت 40 مگ می ده، بنابراین این مودم داغونه. در کل می تونم به این مودم نمره قبولی رو بدم. راجب اون مسائلی که دوستان دیگر در کامنت ها گقتن بابت عدم فقدان فیچر لاک کردن روی یک باند و دی ان اس و ... همش درست هست و این امید هست که با آپدیت فریمور درستگاه در ماه های آینده، این کمبود ها نیز مرتفع بشه. بسیار از اون چیزی که فکر می کنید، کارتون رو راه میندازه. ارادت"
4,"خوب بود سرعت خوبی میده رو td ایرانسل و پایداره سرعتش رو fd چون منطقه ما شلوغه یکم پایین میده سرعتو مشکل dns رو هم با میکروتیک میشه حل کرد"
5,از خرید راضی هستم
5,کیفیت ساخت بسیار خوب
5,پیشنهاد میکنم بخرید
4,با توجه به قدرت انتن دهی و تعاریفی که ازش خونده بودم  ، خریدمش.
5,ازخریدم راضیم
5,"کسانی که ایکس باکس دارن میدونن که برای استفاده از کنسول به دلیل تحریم حتماً باید DNS بزنن روی کنسول وگرنه امکان بازی کردن و لاگین شدن وجود نخواهد داشت. وقتی با مودم های هواوی چه مدل B612 و چه مدل B622 اینترنت رو به ایکس باکس بدید به هیچ عنوان DNS ست نمیشه. مودم 612 رو میشد با گزینه Bridge Mode دستکاری کرد و کاری کرد تا DNS رو بشناسه اما گزینه Bridge mode از تنظیمات 622 حذف شده و شما به هیچ عنوان با هیچ اپراتوری نمیتونید به ایکس باکس متصل بشید. تنها راهی که برای اتصال به ایکس باکس هست خرید یک روتر و تنظیم DNS روی روتر هست و لاغیر. کسایی که این مودم رو برای گیمینگ با کنسول میخرن در کنارش حتماً باید روتر بذارن. این مودم هیچ نقصی جز این موردی که گفتم نداره و نهایت سرعت ممکن رو به شما میده. روی TDLTE مبین نت با آنتن فول من 40 مگابیت گرفتم روی TDLTE ایرانسل با آنتن فول 75 مگابیت گرفتم"
5,"این مودم با این قیمت فقط برای سیم کارت TD LTE ایرانسل ارزش خرید داره و عکس تست سرعتشو گذاشتم عالیه سرعت ۸۰ مگابیت اون هم در ساعت پیک ترافیک و در زمان های خلوت سرعت بالای ۱۰۰ مگ میده آپلود هم بین ۵ تا ۱۰ مگابیت میزنه این مودم برای سیم کارت معمولی ارزش خرید نداره که این همه هزینه کنید مودم های ۲ میلیونی هم جوابگو هستند  و این مودم ارزون ترین مودمی آنلاکی هست که از TD LTE ایرانسل پشتیبانی میکنه و اکثر مودم های آنلاک بازار که پشتیبانی از TD LTE جز ویژگی هاشون ذکر شده از TD LTE ایرانسل پشتیبانی نمی کنند چون باند ۴۲ که ایرانسل استفاده میکنه رو ندارند اکثرا باند ۴۰ رو دارن که بدرد نمی خوره مثل تمام مودم های تی پی لینک و بیشتر TD LTE های ایران رو باند ۴۲ و ۴۳ هستند که این مودم به خوبی پشتیبانی میکنه"
4,یک انتخاب خوب ولی باقیمت بالا
5,به نظر من تو رنج قیمت خودش عالیه از i60 هواوی بهتر و ارزون تره ،من از سیم کارت td lte ایرانسل استفاده میکنم و خارج از منطقه تحت پوشش هستم ولی تو تست سرعت تقریبا ۶۰ مگ بر ثانیه ثبت شد.سیم همراهم که عالی آنتن میداد و اون هم ۵۰ مگ رو ثبت کرد
5,"دوستانی که گفته بودن نمیشه دی ان اس را در روتر عوض کنند اشتباه کرده بودن  این هم راه حلش  وارد بخش apn شده و یک پروفایل جدید می سازید ، بعدش در انجا ipv6 را غیرفعال می کنید و فقط ipv4 را می گذارید ،و روتر را ریست می کنید ، بعد از ان در ویندوز یا ایکس باکس راحت از دی ان اس مورد نظرتون تستفاده می کنید  یکم کار حرفه ای هست ولی کاملا جواب میده من بعدش راحت تونستم به ایکس باکس لایو و در پی سی به ea با دی ان اس وصل بشم"
3,یه هفته اول خیلی خوب بود سرعت بالا ولی بعدش نمی دونم چرا اینقدر ضعیف شد شاید نت و خیلی ضعیف کردن نمی دونم
4,با اینکه نسبت به B612 آپدیت شده ولی حسن خیلی بزرگ B612 این بود که مدیریت نرم افزاری و فرکانسی خیلی خوبی داشت که متاسفانه این مودم نداره. یک نکته خیلی خیلی خیلی مهم به خریداران این مدل بگم که حواستون به جا زدن و بیرون آوردن سیم کارت یا عوض کردن اون از درگاهش باشید که پین های خیلی نازک و بسیار الکی داره و لبه برآمده سیم کارت به پین ها گیر نکنه که اگه یکیش بشکنه دیگه مودم آنتن نمیده و کار نمیکنه و مثل من نشید که بعد از دو هفته مودمتون بره گارانتی! گارانتی هم میگه واسمون بفرستین تهران و حداقل 10 روز تعمیرش زمان میبره؛ این نکته رو کمتر جایی دیدم بهش اشاره کنن، خلاصه که حواستون باشه
5,از بهترین مزیت های این مودم میتوان به وای فای آن اشاره کرد که وای فای ۶ است و از دو فرکانس رادیویی ۲.۴ گیگاهرتز و ۵ گیگاهرتز  پشتیبانی میکند. امروزه تمامی دستگاه های که در بازار هستند از جمله لپ تاپ ها ، تبلت ها ، گوشی های موبایل و حتی تلویزیون ها همگی از وای ۶ استفاده میکندد و سرعت بالا در انتقال اطلاعات بدون وقفه مهمترین بخش برای آن ها است
3,"داخل کارتن کابل شبکه نیست،فقط مودم و آداپتور ۲۴وات با سیم ۱.۵ متری و یه راهنما. روی کاور جعبه یک مارک هواوی هست ولی رو خودش مارک سویا لینک که در اصل برا دور زدن تحریمِ صادرات مارک فرعی زده. ابعادش یکم بزرگه، ۱چراغ پاور، ۱ وای فای، ۳ تا برا آنتن داره که بهتر بود چراغهای آنتن بیشتر بود مثلاً ۴،۵تا. بالاش دوتا کلید داره یکی خاموش روشن که باید چند لحظه نگه دارید اونیکی هم فکرکنم رستارته، ۱جای سیمکارت سایز نانو زیرش. هم سیمکارت گوشی (FD) میخوره هم اینترنت ثابت(TD)  پنل کاربری امکاناتی مثل نصب vpn، کنترل والدین که میشه دسترسی به اینترنت بعضی دستگاه هارو ساعت و روزهاشو تعیین کرد، sms، انتخاب فقط 4gیا3g و... داره ولی بعضی امکانات مثل انتخاب دستی دکل و باند نداره. نرم‌افزار AI Life هم داخلش اسم و عکس مودمو میاره ولی کارنمیکنه. ۲تا شبکه وای فای داره که یکیش۲.۴و ۵ گیگاهرتز اتوماتیکه یعنی اگه نزدیک مودم باشید و گوشیتون جواب بده خودش روی 5g میره و وقتی دورتر باشید میشه 2.4، اون یکی هم فقط5g. درکل بُرد مفید 5g مودم درحد یک یا دو اتاقه و بعدش ضعیف میشه ولی ۲.۴ بیشتره. از لحاظ سرعت اینترنت از انتظارم یکم پایینتر بود مخصوصا سرعت آپلود،البته بستگی به اپراتور و پوشش هم داره، گذاشتم جلو پنجره که معمولا ۳چراغش روشنه(حدودا۶۰،۷۰ درصد آنتن) با سیم گوشی و نسل ثابت تست کردم و عکساش گذاشتم. گوشیم سرعت بهتری نسبت به مودم با همون سیمکارت داد البته گوشی Cat20 هست نسبت به مودم کهCat6+ هست. مکان تست هم حاشیه شرق مشهد. (تو تنظیمات Internet Connection مودم برا ایرانسل بنظرم بهترهGPRS رو پاک کنید و بجاش Internetبنویسید و قسمت Authentication هم بزارید Auto)"
5,"من این مودم رو برای دانلود بازی و آنلاین بازی کردن با نت 4g خریدم به امید اینکه سرعت و پینگم خوب باشه . برای دانلود بازی سرعتش خوبه اما به هیچ عنوان به سرویس ایکس باکس لایو و پلی استیشن متصل نمیشود و هر چقدر هم که dns ست کنید فایده نداره دوستان  با هیچ سیم کارتی نمیتونید با این مودم آنلاین بازی کنید  سه مدل سیم کارت تست کردم با گوشی بدون مشکل میتونید آنلاین بازی کنید ولی با مودم فقط میتونید دانلود کنید و اصلا وارد اکانت نمیشه  خلاصه حیف این همه پول که بابت این مودم دادم  مودم از طرف آمریکا تحریمه شاید بخاطر همین به ایکس باکس لایو متصل نمیشه  اگه دنبال سرعت دانلود خوب میگردین این مودم عالیه ولی اگه دنبال بازی های آنلاین هستین با پینگ پایین متاسفانه این مودم با هیچ dns سازگار نیست"
5,از همه نظر عالی، پیشنهاد میشه
5,چون سیم کارت  TDLTE اجباری در کنار مودم من خودم نمی پسندم بنا به دلایل شخصی ...پس این مدل مطمئن خریدم عالیه و بعد سیم کارت ایرانسل رو جدا به بسته خودم ثبت نام کردم و خریدم که بهتر و مطمئن تر شد
5,در حال حاضر قعطا بهترین مودم آنلاک موجود در بازار ایرانه
5,عالی بود من پیشنهاد میکنم خیلی خوبه من راضی هستم 
5,همه سیم کارت هارو ساپورت میکنه در ضمن وقتی اون منطقه 5G دریافت بشه یه باند جدید به وای فای اضافه میشه که نشون میده 5G هم میگیره
4,همه چیزش عالی فقط قیمتش ی مقدار بالاست
5,مودم بسیار باکیفیت و خوبیه خیلی راه اندازی ساده ای هم داره فقط قیمت TDLTE در مقایسه با adsl یکم بالاتره
3,b612  ( همان i60 ) و این مودم جدید ( b622 ) رو با هم تست کردم  سرعت دانلود این مودم بیشتر از 20mb/s  نشد در همان مکان و همان سیم کارت سرعت مودم i60  قدیمیم به 45mb/s  رسید   امکانات پنل i60  زیاد هست و البته برای کاربر معمولی چندان بدرد بخور نخواهد بود ولی سرعتش بیشتر از b622  هست b622  وای فای دوبانده داره که بازهم برای کاربری معمولی تفاوت آنچنانی نداره 
