5,اگه دنبال یه ایرپاد خوب برای اندروید هستید حتما پیشنهاد میشه .  تو بین اندرویدی ها بهترین هست
3,محصول خوبیه اما گوشی سمت راستش مشکل داشت مرجوع کردم...!
4,همه چیزش عالیه بخصوص برای آنهایی که گوشی شیائومی دارند، من که با پوکو اف۳ همه امکاناتش را استفاده میکنم
4,بعد از دو روز استفاده باید بگم بهترین ویژگی این هدفون باطری عالی و فوق العاده خوبی هست که براش در نظر گرفتند، چون گوشی من شیائومی  11T هست خیلی راحت متصل شد. برخلاف نظر دوستان کیفیت پخش صدای شفاف و بالایی ندارد! فعال کردن نویز کنسلینگ تا حدودی کمک می‌کنه ولی باعث بالارفتن مصرف باطری میشه. برای مکالمه طرف مقابل احساس می‌کنه صداش روی حالت اسپیکر هست.  طراحی عالی داره هم خیلی شیک و هم ارگونومی که تو گوش خوب قرار میگیره و در حین کار روزانه یا مثلاً دوچرخه سواری بیرون نمیاد و در حد رطوبت و نه خیس شدن ضد آب و گرد و غبار هست. توصیه میکنم اگر دنبال یک هدفون خوب و نه عالی هستید.
4,خیلی عالی و برا مکالمه و موزیک 
3,خود هندزفری سالم بود ولی آنباکس شده بود و لیبل گارانتی هم کامل پاک کرده بودن و من هم مرجوع کردم
4,تنها عیبش اینه که دیگه صدای خودتو بم میشنوی
