5,خیلی خوب و سرعت مناسبی داره
5,هم قدرتش زیاده هم نسل تازه هستش هم قیمتش عالیه حتما پیشنهاد می کنم
5,"خدایی دیجی کالا از روزی که پست رو ول کرد تا الان کارش کالی شده  زده بود ۵ میرسه دستم ولی ۲ رسید  ایول بهتون"
5,من واسه گیم خریدم تو بازیا بیشتر از ۶۰ درصد توانش استفاده نمیکنه فعلا واسه همه بازیا جوابه یه خوبی ای هم که داره اینه که سی پی یو داغی نیست کلا و لازم نیست برا خنک کننده خیلی هزینه کنید
5,کاملا نو و بدون خط و خش بود باکس خوب و معقولی داشت که با بالشتک محافظت شده بود بعد از یه ماه استفاده هیچ‌مشکلی ازش ندیدم برای گیم استفاده میکنم جواب داده و مشکلی نداره.
4,"سالم بود به طور عجیب دماش بالاتر از 50 نمیره تو هیچ تستی فن اش ag400 دیپ کول"
5,قدرت متوسط روبه بالایی داره، اما نمیشه روش زیاد حساب باز کرد، بهینه اس. برای بازی میشه ولی نه بازی های رده بالا. نسبت به قیمتش خوبه چون هم جدیده و هم بهینه از نظر مصرف انرژی و تولید گرما. 
3,در کل سی پی یو ضعیفیه و من 12400 رو توصیه میکنم
5,فروشنده بسیار عالی ارسال کرده بود واقعا ممنونم دوست من
5,من تست کردم عالیه و حرف نداره و مثل آب خوردن همه چیز را سریع پردازش و اجرا می کنه
5,عالیه این سی پی یو نسل جدید با مادربرد ddr5 ست کنید حالشو ببرید
4,خوب بود بسته بندیش افتضاح بود
5,نسبت به قیمت کارای خیلی خوبی داره و تقریبا یک پردازنده اقتصادی و مناسب هستش
2,اشتباه منو انجام ندین،پول بیشتر هزینه کنین یه پلمب بخرین،این مدل ها معلوم نیست نو هستن یا دست دوم،نو هم باشه با اون بسته بندی افتضاح که فقط یه پلاستیک معمولی دورش پیچیدن و چسب زدن حتما در طول ارسال فاتحه اش خونده میشه،حتما سری آنبرد دار بگیرین
5,سیپیو خوبی هستش و کار راه اندازه و دست فروشنده هم درد نکنه توی جعبه خوبی ارسال کرده بود برام و اینم بگم با توجه به اینکه CPU های تری جعبه و فن ندارند و به صورت عمده وارد بازار می‌شوند، و همچنین به دلیل عدم پشتیبانی شرکت سازنده، ارزان‌تر هستند. درحالیکه CPU های باکس معمولا قیمت بالاتری دارند. البته به این نکته توجه کنید که پردازنده تری اورجینال، یعنی پردازنده‌ای که از ابتدا و توسط شرکت سازنده به صورت تری وارد بازار شده است، دست دوم نیست و کاملا نو هستن
5,"اینتله دیگه چه احتیاجی به نظر داره میان رده خوب و اقتصادی"
5,تو یه نایلون فرستادن ولی خوبیش اینه که اصلا استفاده نشده و خط و خش نداره قدرتش خیلی بالاست
3,مشخصات خوبی داره سیپیو من خط خش نداشت هنوز که تست نکردم انشالله سالم باشه
4,بدون جعبه بود
5,پردازنده قوی هستش نسبت به قیمتش   و بستگی به نیازتون من برای گیم ادیت خریدم کارم را افتاد ولی این هم بگم که در خرید گرافیک دقت کنید آخه با بعضی از کارت گرافیک ها گلوگاه ایجاد می‌کنه در کل نسبت به قیمتش در حد i5 نسل 10 هستش
5,عالی و بسته بندی خیلی خوبی داشت
5,این پردازنده در مقایسه با نسل های قبل بشدت پیشنهاد میشه فقط توجه داشته باشین تری هست( بدون فن و بسته بندی)
1,من یک ماه پیش این cpu و خریدم و الان بدون هیچ دلیلی ، سوخت
3,در مشخصات این محصول نوشته پردازنده گرافیکی دارد در حالی که فاقد پردازنده گرافیکی است
4,بدون مشکل به دستم رسید. متشکرم.
5,"ارزانترین سی پی یو گیمینگ نسل های جدیده که واقعا واسه هر گیمی کافیه. اگه می‌خواین بیشتر هزینه کنید 12500 گزینه بهتریه ولی همین کافیه. به نظر من یه مقدار از هزینتون بزارید واسه فن سی پی یو خوب، من gammaxx 400 xt گرفتم 1.5 که خوب خنگ می‌کنه و راضیم ازش"
5,خوب و عالی بود 
5,موجود کنید جان مادرتان
5,همانند توضیحات درج شده در مشخصات محصول. 
5,سالم و بسته بندی مناسب ارسال شده بود.
4,دوستان نسبت به قیمتش قدرتش خیلی عالیه در حد i5 11400f با دو ملیون کمتر.خیلی خنکه.من تو وارزون 2 کیفیت فورکی با 6700 xt  هفتاد فریم میگیرم.البته در نظر بگیرین تو خرید کارت گرافیک دقت کنین که دچار گلوگاه نشه.خلاصه به نظر من خرید اقتصادی عالی حساب میشه
5,سرعت عالی. حرارت بسیار کم
3,"دوستان وقتی F در انتهای نام پردازنده باشد یعنی فاقد گرافیک آنبورد می‌باشد!  این پردازنده 4 هسته حقیقی و 4 رشته دارد که یک پردازنده (میان رده) محسوب می‌شود در مقایسه با i5 و i7 که یکی از دوستان اشاره کردند ، مشابه i5 نسل 9 یا 8 (4core) ، و فکر نمی‌کنم بالا تر از نسل 8 i7 باشد! البته نسل جدید (۱۲) قابلیت های جدیدی مانند باس رم بالاتر و pcle 4 را خودش پشتیبانی می‌کند نسبت به نسل های 10"
5,درحدi5نسل۱۱ و i7نسل۱۰
4,خوب
3,تو این رنج اوکیه
5,بهترین انتخابی بود که داشتم و از خرید پشیمون نیستم ممنون از شرکت مستر کامپیوتر
5,در خریدش شک نکنین
5,با مادربرد H610 و  یدونه هارد NVMe استفاده کنین و لذتش رو ببرین ، ویندوز 11 مثله هلو روان و اجرای بازی و نرم افزارها هم بسیار پرسرعت . 
5,درود بر عزیزان چند وقتی میشه این سی پی یو رو دارم برای کار های روزانه عالیه به شدت بهینه و کم حرارته برای کار های سنگین هم جوابه ولی به شرط داشتن اس اس دی و کارت گرافیک قوی
4,تشکر میکنم از دی جی کالا برای پشتیبانی خیلی خوب و جلب رضایت مشتری.. من این سی پی یو رو میشناختم و صحبت خاصی در موردش ندارم.. کمتر و بیشتر از مشخصات فنی خودش مورد قابل بحثی نداره .. اگه موجود بود در صورت نیاز بخرینش
2,یک روز از تحویل فاکتور زود تر ب دستم رسید هنوز تستش نکردم روی پوسته خط خش داره و خیلی زنندس عکسشم گذاشتم
5,"برای بیلد های اقتصادی عالیه، ارزشش نسبت به قیمتش بالاست و این مدل به دلیل سری اف بودن و بدون جعبه بودن، ارزون تره. سری اف یعنی گرافیک آنبوردش غیر فعاله و اگر نیاز خاصی به گرافیک آنبورد ندارین، بهتره که همین سری رو بخرید."
5,"نسل ۱۲ از زمین تا اسمون با نسل ۱۱ فرق داره مثل اب خوردن از i5 نسل ۱۱ برتری میگیره فقط هواستون باشه هر فنی به نسل ۱۲ نمیخوره حتما‌مادر بوردتونو چک کنین"
5,خیلی سی پی یو قوی است از تمام نسل های سری ۱۱ هم حتی i5 و i7 سرتره من بدون باکس فن خریدم اگر فن خریدید جدا گانه حتما فن اینتل فابریکی خودش رو بگیرید
5,کلا این سیپیو رو بدون فن سفارش ندین چون فن خارجی دو برابر فن استوک خرج داره ولی در هر نظر از 4770 من خیلی سره تو طراحی یه بعدی خودشو خیلی نشون میده.
4,پردازنده قوی درکنارلیتوگرافی ساخت ومصرف برق بهینه با قیمت مناسب
