5,واقعا کیفیت و اصالت عالی هست 
5,تجربه ی یک محصول اصیل با طراحی بی نظیر پارچه ی شارژر
4,عالی بود 
5,"کمپانی سنهایزر فوقالعاده ست، من دنبال صدا باکیفیت و تفکیک صدا و بیس بودم ک اینو خریدم، خیلی تحقیق کردم بین سونی xm4 و مونتوم گیر کرده بودم ک درنهایت اینو گرفتم،صدای باکیفیت و بیس نرم خوبی داره ک میتونید از نرم افزارش قدرتش رو زیاد کنید،توی کامنتها خوندم ک خیلی ها میگن گوشی سمت چپش از کار افتاد، برای من یک ماه نشد ک این اتفاق براش افتاد ولی با آپدیت جدید اوکی شد  دوستان اگر دیدین یه گوشی کار نمیکنه یا شارژ نگه نمیداره بخاطر اینه ک خوب شارژ نمیشه،باتری مشکل نداره، بعد از اینکه کیس شارژ شد هندزفری رو داخل بگذارید و درب کیس رو باز بذارین تا شارژ بشه بازم اگه شارژ نشد ایرتیپ هاش رو جدا کنید بعد بگذارید داخل کیس  مگه میشه هندزفری به این قولی با این کمپانی قدر خراب بشه اصلا احتیاج ب گارانتی نداره،لوگوی سنهایزر خودش گارانتیه سونی خیلی بازی قیمتی داره تو ایران از ۹ تا ۱۵ تومن واقعا میمونی چه قیمتی بخری ک سرت کلاه نره ولی من با توجه به قیمت جهانی ب دلار و ویدئوها اینو گرفتم، نویز کنسلینگش جالب نیست،معمولیه ولی من برای صدا گرفتم و نویزکنسلینگ برام اهمیتی نداره و اصلا استفاده نمیکنم"
5,سلطان تمام هندزفری های بازار و جهان
5,فقط چون باطری گوشی و پایه لیتیومی هست بهتره هنگام شارژ گوشی ها را روی پایه نگذارید و بیش از ۸۰ درصد شارژ نکنید تا طول عمر باطریها بیشتر شود
3,انتخاب خوبی هست
3,با اینکه کم استفاده کردم بعد از ۱۰ ماه گوشی سمت چپ از کار افتاد نمیدونم کجا باید ببرم درستش کنند
5,یکی از بهترین earbud های حال حاضر که وجود داره که با sony wf-100xm4 و bose quietcomfort 2 قابل مقایسه هست
5,اگر برای گوش دادن به موسیقی این هدفون رو انتخاب کنید انتخاب عالی هست که هیچ نقصی نمیتونید ازش بگیرید، اکولایزر خوب، تنظیم بر اساس شنوایی شما، صداهای واقعی و بیس بینظیر اونو واقعا بهترین هدفون وایرلس برای گوش دادن به موسیقی میکنه، برای صحبت کردن هم کاملا عالیه حتی توی باد شدید یا پشت موتور، تنها دوتا ضعف میشه بهش وارد کرد اول قاب بزرگشه که مثلا داخل جیب کاملا حس میشه و دوم فناوری حذف نویزش معمولیه و شگفت زدتون نمیکنه اما خیلی توی گوش راحته، بلندی صداش کاملا مناسبه، سرعت کانکت شدنش کسری از ثانیه است و حتی موزیکای بی کیفیت رو هم خوب پخش میکنه
1,"بعد از 9 ماه گوشی سمت چپی صدای تق تق میده و میزان صداش به شدت کم شده انگار باتریش خراب شده باشه من قبلاً هم سنهایزر سیمی CX.1.5 باسیم داشتم اونم بعد یکسال یکی از گوشی هاش از کار افتاد ! با اینکه طرفدار سنهایزرم ولی تو هندزفری خییییلی آزاردهندس که این همه پول بدی و به این راحتی هندزفریت بلا استفاده بشه!"
2,من خریدم بعد از شش ماه باطری یکی از گوشی هاش خراب شد. 
1,"گارانتی نداره بعد از یه مدت صدای تق تق می ده وقتی نویز کنسلینگ فعاله و قابل تعمیر هم نیست متاسفانه  حداقل با گارانتی از جای دیگه بگیرید"
4,همانطوریکه احتمالا توی یوتیوب دیدین این هدفون (ایرفون) به عنوان بهترین و با کیفیت ترین تو دسته بندی خودش معرفی میشه. واقعا هم همینطوره کیفیت ساخت و کیفیت صداش خیلی عالیه شارژ دهیش هم عالیه، فقط قیمتش میتونست کمتر از 13 تومان هم باشه.
1,بررسی بعد سه ماه هم می گذارم. درسته کامنت ها همه منفی دادن اما واقعیت اینه که اگر میخواهید بخرید باید اینها رو بدونید. الان بعد 3 ماه روی گوشی چپ که دیجیکالا نپذیرفت ایراد داره همچنان وایت نویز دائم داره روی حالت نویز کنسلینگ واقعاً سردرد دارم میگیرم همیشه نویز کنسلینگ خاموش میگذارم. صداش اما هنوز خوبه. حالت APTX ADAPTIVE هم فعال میکنید خش خش میکنه وقتی دوتا دیوایس وصل میشه. خلاصه اینکه انتظار این موارد رو نداشتم. نظر قبلی : یک ماه استفاده کردم و خلاصه نظرم رو میگم. صدا خوبی داره یعنی چندروز استفاده کنید به محض استفاده همه دستگاه های دیگه متوجه میشید (بادز ها فقط نه هدفون های روگوشی که لیگ جدایی هستند) مولتی پوینت خوب وصل میشه ولی حین وصل شدن خش خش میکنه و بعضی وقتها حین گوش دادن بلوتوث دستگاه ها نویز ایجاد میکنه. اما مشکل اصلی که مرجوع هم کردم و دیجیکالا نپذیرفت اینه.این دستگاه در تمام فروم ها بگردید میبینید. بعد چند هفته استفاده اگر واقعاً استفاده کنید (ورزش تماس آهنگ روزانه 4 5 ساعت حداقل) کانال های نویز کنسلینگ و صدای اصلی میگیره میدونم باید مبرین زیر توگوشی سلیکون رو بردارید که مقداری از مشکل حل بشه ولی کثیفی بیشتری رو دارید میبرید توی دستگاه و زودتر خراب میشه. یک ماه برای این قضیه زوده من روی ایرپاد پرو یک سال طول کشید به این وضع بیفته. به هر حال این چیزی هست که اکثر ما توجه نمیکنیم بهش موقع خرید. اگر بقیه دستگاها رو شش ماهی یک بار باید با شوینده تمیز کنید این رو باید ماهی 3 بار تمیز کنید ( فروم ها رو بخونید گفتن چطور تمیز کنید اکیداً الکل استفاده نکنید چون با چسب چسبیده همچیش وا میره) من انتظارم از جنس پرمیوم این نبود این اواخر روزی سه بار تمیز کردم ایرتیپ رو تمیز کردن ایرتیپ ها کار رو درست نکرد و برگشت به 60 درصد صداش ظاهراً باید خودمون هر هفته تا تهش رو باز کنیم با هویه قلع باز سازی کنیم(توصیه نمیکنم نخرید راحت ترید ،بعضی وقتها حتی صدا به صفر رسید فقط یک ساعت توی گوش باشه و ورزش کنید فقط صدای صوت صوت گوش رو کیپ میکنه و آذار دهنده میشه)
5,اگه دنبال یه هدفون بی سیم با صدای عالی بیس عالی میگردی همینو بگیر که برای من همینا مهم بود دیگه نچرخ اما یکم احساس میکنم راحت نیست شاید عادت ندارم یا باید  اندازشو عوض کنم ولی در کل عالی
5,راضیم ازش یک هفته دارم 
2,مشکل داشت مرجوع کردم
5,من توی یوتیوب با هدفون سونی Wf-1000xm4 مقایسه کردم و دیدم خیلی باهم تفاوت دارن ، گرچه خب هزینه بیشتر می‌کنی ولی یک بار میخری و تا عبد استفاده میکنی . اگر کسی مشکلی با هزینش ندارع و دنبال یه هدفون خوب و با کیفیت بهترین گزینه براش همینه
3,من مرجوع کردم مدل بالاتر از برند بهتر گرفتم
1,پلمب اصلی Sennheiser باز شده بود و دوبار پلمب شده بود!
3,از قابلیت «نویز کنسلینگ» این مدل هدفون انتظار بیشتری داشتم؛ ولی متاسفانه با گذاشتن هدفون، باز صدای اطراف به گوش می رسید…
5,"عالییییی بدون هیچ ایرادی"
5,"سال قبل سونی اکس ام فور را گرفتم که الان با توجه به پایین آمدن دوام باطری آن، سنهایزر مومنتوم سه را تهیه کردم و یک ماه است که از آن استفاده می‌کنم. از نظر کیفیت صدا و موسیقی از سونی بهتر است، نویز کنسلینگ آن هم برخلاف ریویوی بعضی از سایت‌ها، دست کمی از سونی ندارد، فقط باید بادزها در داخل گوش کامل کیپ شده باشند. وجود باله بر روی بادزها کمک می‌کند که وقتی آنها را داخل گوش می‌کنیم و به سمت عقب گوش می‌چرخانیم، دیگر از گوش نیفتند. برای انتقال داده از طریق بلوتوث از کدک اپتکس استفاده می‌کنم که رضایت‌بخش است. در آپدیت جدید فیرموِر، علاوه بر اضافه شدن مالتی پوینت، امکان انتقال داده‌ی بیست و چهار بیتِ های رزولوشون هم فراهم شده است که فقط با اپتکس ادپتیو کار می‌کند که با اینکه گوشی من اس بیست و دو اولترا است، آن را پشتیبانی نمی‌کند. به سطح بیس سونی عادت کرده بودم که خوشبختانه در نرم افزار سنهایزر هم زیر اکولایزر، گزینه بیس بوست وجود دارد و آن را فعال کردم و به صدای گرم و قدرتمند مورد علاقه‌ام دست پیدا کردم و از آن کاملا راضی هستم."
5,لطفا موجود کنید ترجیحا سفید
5,به گواهی تقریبا همه بررسی کننده های یوتیوب ، این هدفون یکی از بهترین هاست. کیفیت صدای بینظیر  ، وضوح صدای عالی و باس خیلی خوب دارد ، باتری و امکانات عالی .میکروفون جهت تماس عالی هست و anc خیلی خوب دارد .برنامه در بعضی جاها ضعیف عمل میکند .  نسبت به هدفون وان مور و بادز سامسونگ ، ضعیفتر فیت میشود و من سامسونگ رو بیشتر میپسندم . صدا بهتر از آن دو هست ولی نه آنقدر که ارزش اینهمه هزینه بیشتر را داشته باشد ، مخصوصا در قیاس با هدفون وان مور ...
5,بنظرم یه هدفون فوق العاده عالی 
5,"دوستان ، حتما یادتون باشه که نرم افزار و اپلیکیشن مخصوص این هدفون که اسمش هست : Sennheiser Smart Control رو ، روی گوشی تون نصب کنید . چون واقعا اپلیکیشن فوق العاده کاربردی و عالی داره .  بدون نصب نرم افزار ، نمی تونین از قدرت واقعی این هیولای ترسناک ، به خوبی اطلاع پیدا کنین و استفاده کنین .  ببینین ، اکولایزری که در داخل اپلیکیشن هست ، فوق العاده مهم هست . یعنی با تغییر دادن اکولایزر ، کلا ماهیت صدا ، عوض میشه و تفاوت زیادی پیدا می کنه . مثلا چیدمان اکولایزر ، برای آهنگ های پاپ و تکنو و هوی متال و سایر انواع موسیقی ، باید عوض بشه تا نهایت استفاده رو ببرید . برای آهنگ های مختلف ، باید آنقدر با اکولایزر نرم افزار ، وَر برید که صدای دلخواه رو پیدا کنید . اون وقت هست که در لذت موسیقی غرق خواهید شد و صدای هدفون ، شما رو شگفت زده خواهد کرد .  برای کسانی که حوصله کَلَنجار رفتن با اکولایزرِ اپلیکیشن رو ندارن ، به طور خلاصه ، تجربه ی سه ماهه خودم از کار با اکولایزر رو میگم . این الگو ، برای بالای نود درصد انواع و اقسام موزیک ، بهترین صدا رو ایجاد می کنه : Bass : -4dB Mid : 0 Treble : 4dB باس روی منفی چهار دسی بل ، مید روی صفر یعنی خط وسط و ترِبل روی چهار دسی بل . البته این مسئله یک مقدار شخصی هست . برای من که این مناسب هست . حتی می تونین اینجوری هم تنظیم کنین که این هم مناسب هست : Bass : -3dB Mid : 0 Treble : 3dB"
5,اگه Beoplay Ex رو فاکتور بگیریم که قیمتش ۱۵۰ دلار بیشتر از اینه و اونم تا حدودی کیفیت صدای بهتری داره، در مجموع میشه گفت بهترین هدفون ترو وایرلس بازاره!
5,"keyfiyatesh khyli khobe  seda va hamechish aliye"
5,کیفیت صداش نسبت به نسل قبل خیلی پیشرفت کرده و کیس شارژش هم تایم شارژ خوبی میده ولی کم کسی حاضره بابت کیفیتش 11/5 هزینه کنه
5,من خریدم خیلی راضیم ازنظرکیفیت صداعالیه ازسونی هم کیفت صداش بهتره هم وزنش سبکتره ازلحاظ قیمت  ازسایتای دیگه مناسب تره
5,"این هدفون دقیقا هم رده سونی WF-1000XM4 هست و در بعضی از موارد از اون هم بهتره ولی قیمتش توی دیجی کالا دو برابر سونی هست اصلا خریدش الان منطقی نیست"
5,بخرید من خریدم راضیم
