4,"درود دوستان  با توجه به قیمتهای بازار  ارزش خرید بالایی داره من واسه ترید گرفتم عالی بود کیفیت صفحه نمایش عالی داره  پشیمون نمیشید خلاصه که کار رو براتون درمیاره"
5,برند بسیار خوش نام و کیفیت بسیار عالی و امکانات فوق العاده ای داره.برای اونهایی که تولید محتوا می کنند و معمولا به دو مونیتور نیاز دارند و مخصوصا برای مهندسین معمار و عمران و نیز گرافیستها در این رنج قیمت اولین انتخاب خواهد بود. خیلی سریع ارسال شد و هیچ مشکل مخصوصا از نظر سوختگی پیکسل نداشت. ضمنا از نظر مصرف بسیار کم مصرف و وضوح و کیفیت رنگ بسیار عالی داره. حتما توصیه می کنم بررسی بکنید . ارزش خرید بالایی داره و پشیمون نمی شید.
4,من این مانیتور رو برای تکمیل ستاپ تریدم به عنوان مانیتور کمکی گرفتم .اولش نگران کیفیت تصویرش بودم .بعد که اومد کنار مانیتور اصلیم که سامسونگ ۳۲ اینچ و 4k بود تصویرش واقعا مناسب به نظر میومد و اصلا تو ذوق نمیزد و خیلی مناسب کارم رود ولی چون پیکسل سوخته داشت مرجوع کردم .و منتظرم بعد از مرجوعی دوباره یه دونه سالمش رو سفارش بدم .
5,"سلام به همه عزیزان کیفیت صفحه نمایش این مانیتور خیلی خوبه  سه نوع خروجی به شما میده من خودم از میکرو یو اس بی استفاده کردم که برای من عالی شد، براحتی تونستم تبلت را به مانیتور وصل کنم ... کیفیت اسپیکر این مانیتور خیلی خوبه تنها نکته منفی که دیدم جنس پلاستیک استفاده شده برای مانیتور هست که البته از نمای روبرو اصلا دیده نمیشه ... در کل نسبت به قیمت خیلی عالیه و ارزش خرید داره، مخصوصا برای دوستانی که ترید انجام میدن."
5,"سلام به کاربران عزیز دیجیکالا. من این مانیتورو در تاریخ 29 آبان 1402 با گارانتی 40 ماهه آونگ به قیمت 11 میلیون و 750 هزار تومان خریداری کردم‌. برای وصل کردن به کنسول ایکس باکس سریز و پلی استیشن 5 گرفتم..که خدایی کیفیت خوب و قابل قبولی به کاربر میده. امکانات و تنظیمات خود مانیتور برای دسته گیم خیلی متنوع و کاربردیه.. از اون چیزی که فکرشو میکردم بزرگتر بود..فکرشو نمیکردم این اندازه باشه. خیلی خوشگله و با میز و دکور اتاقم هماهنگ و ست شده خیلی. اما باید دید تو کارایی بلند مدت چطوریه..ایشالا دوباره کامنتو ادیت میکنم و نظرمو بهتون میگم.. موفق باشید. ادیت کامنت بعداز حدود 20 روز اول اینکه از کیفیت بالای اسپیکرای این مانیتور تعجب میکنید..من تاحالا از 30 درصد بیشتر نتونستم بیشترش کنم. دوم اینکه خدایی تنظیمات کامل و جالب و بهینه ایی داره. به کسایی که میخان تولید محتوارو شروع کنن یا گیم بزنن پیشنهادش میدم."
5,بنظرم برای کار طراحی و گیمینگ عالیه.من باهاش طراحی میکنم با اینکه فول اچ دی هست اما اصلا کیفیت پایینی رو حس نمیکنید توی تصویرش و باتوجه به قیمتش در خریدش شک نکنید.
3,مانیتور به دستم سریع رسید اما ۳ تا پیکسل سوخته داشت
4,خوبه بد نیست 
5,کیفیت تصویر و صدای خوبی داره، همراهش یک عدد کابل HDMI هم رنگ رنگ مانیتور (سفید) وجود داره
5,بنظرم مناسبه
5,خیلی عالی بود واقعا، کارت گارانتی هم بود همراهش، کاملا سالم هم بدستم رسید، من برای ترید گرفتم که خیلی خوبه برای گیم هم جواب میده در حد نیمه حرفه ای البته
5,سلام.نسبت به قیمتش خیلی خوب هستش.اسپیکرش خیلی کیفیت بالایی داره.من برای ترید گرفتم.
5,مانیتور خوبیه من از کیفیتش راضی ام
4,کیفیت تصویر و صداش عالیه
5,"کیفیت تصویر عالی، رنگها کالیبره و نزدیک و واقعیت و کنتراست مناسب بدون اغراق در حد و اندازه سری پرو آرت ایسوس. چشم خسته نمیشه ازش.تقریبا برای هر کاربری ای مناسب و دلپذیر هست. تجربه سینماتیک و تاخیر ۱ms موشن بلور در گیم ارائه میده. ارتفاعش خیلی کوتاهه و نیاز به خرید پایه مجزا هست. ضمنا برخلاف اکثر مانیتورهایی که داشتم هم محل قرارگیری پورت ها و هم رابط کاربری کاملا در دسترس و بی دردسره. برای زیبایی بیشتر توصیه میشه والپیپر انجین نصب کنید و لذت ببرید قیمت دیجی کالا همیشه مناسب تره و پیکسل سوخته هم نداشت"
5,خیلی خوبه بعد از ۶ ماه استفاده اونموقع من ۱۲ تومن خریدم و راضیم 
4,کسانی که در بازارهای مالی ترید میکنن این مانیتور مناسب می باشد
5,نسبت به قیمت واقعا ارزش خرید داره.
3,"من این مانیتور برا کنسول ps5 خریدم که متاسفانه  فول تصویر نمیشه و تصویر کوچیک میشه فول تصویرم که میذاریم دچار افت شدید کیفیت میشه  عملا این مانیتور به درد من نخورد برا کنسول اصلا مناسب نیست"
4,خوبه
2,بد نیست
5,از خریدم راضی بودم
5,بهترین خریدی بود که انجام دادم
