5,چند ماه دارمش.فوق العادست
4,"Cpu حرفی برا گفتن نداره اما وات خروجی پردازه گرافیکی محدود شده نسبت به ۳۰۶۰ راندمان پایین تری ارائه میده درسته سر تره تو مشخصات اما عمل خیر البته در این سیستم سیستم کولینگ و خنک کاری نسبت به rog ضعیف تر  سعی شده لپتاپی در حد امکان سبک و اقتصادی با مشخصات مناسب عرضه بشه   کیفیت ساخت tuf ها و مشخصاتش خوبه اما کامل نیست.  صفحه نمایش فوق العاده ای ندارد کیفیت ۱۴۴ هرتزی و محدوده رنگ کمتر نسبت به مدل صفحه نمایش ۳۰۰ هرتزی کالا تو ذوق میزنه  اما همه چی بستگی به خواسته هاتون از یه سیستم داره شاید کسی مهم نباشه براش بقیه چیزا اولویت باشن"
5,این سیستم را 51 خریدم . واقعا محشر است.واقعا قوی و روان
5,لپتاپ خیلی خوبیه من ازش خیلی راضی بودم.
5,همینطور که نوشتم با این نقاط قوت هیچ لپتاپی با این قیمت نیست و نقاط ضعفش صفحه کلید که rgb  نداشته باشه مشکل خاصی نیست یه مقدارم داغ میکنه که با یه کول پد حل میشه
5,لپ تاپ خوبیه
5,عالی ولی حیف که کیف و موس همراهش نیست و 52 ملیون فقط خود لپتاپ زیاده
