5,"این ویدیو پروژکتور برای افرادی که زیاد فیلم میبینند بسیار مناسب هست . کیفیت تصویر در حالتی که فایل با کیفیت پخش شود و تصویر روی سطح مناسب مثل دیوار سفید و یا پرده اصلی پخش شود بسیار عالی است . حین دیدن فیلم صدای فن پروژکتور مزاحمتی نداره ، و صدای اسپیکر خودش به تنهایی برای مشاهده فیلم کافیه .  مسلما برای کاربری در نور زیاد و روز مناسب نیست .  برای گیمینگ هم خیلی خوبه ، فقط با توجه به تاخیر چند صدم ثانیه ای که داره، برای بازی هایی که ری اکشن بسیار فوری نیاز هست شاید اذیت کنه . اما برای بازی هایی مثل فوتبال یا شوتر خوبه و لذت بخش هم هست .  ریموت کنترل ساده ای داره و طراحیش هم زیباست . رابط کاربری ساده ای داره و بخوبی میشه توی محیطش کار کرد.انواع و اقسام نرم افزارهای اندروید هم روش نصب میشه . ابتدا بخاطر شارژی بودنش ناراحت بودم اما بعدا متوجه شدم اگر باتری داشت بعید میدونم بیشتر از ۱ ساعت جوابگو بود . فیلم و عکس از تصاویرش گذاشتم اما باید توجه کرد که روی پرده معمولی پنجره انداختم و اگر تصویر روی پرده اصلی یا دیوار بود کیفیت به مراتب و قابل ملاحظه بالاتر بود.سایز این تصاویر ۲ متر در ۴ متر هست ."
5,عالی
5,عالیه و جالب
3,"سلام  کیفیت خوب فقط در تاریکی محض  در روز و روشن شدن لامپ افتصاح دوستان که قصد خرید دارن و میخوان در روز کار کنن حتما ۳۰۰۰ لومن خریداری کنن .  به کنسول بازی وصل کردم خوب بود  فلش زدم و فیلم ها رو عالی و روان پخش میکرد.  موس بیسیم وصل میشه کرد برلی راحتی کار . در کل برای استفاده خانگی بد نیست...."
4,بهترین انتخاب برای اتاق خواب ولی خب قیمتش واقعا بالاست برای چیزی تو این رنج و مشخصات
3,نورش یه خورده کمه ولی مشکل بزرگش اینه خیلی برای نصب روی سقف خوب نیست و بهتره در مرکز پرده یا دیوار قرار بگیره. چون اگه روی سقف نصب کنید، یه قسمت از تصویر تار میشه و اگه اون قسمت رو تنظیم کنید، جای دیگه تصویر تار میشه.
5,"با سلام این نظر رو بعد از ۵ ماه استفاده دارم عرض میکنم. برای خریدش شک نکنید. بی نهایت با کیفیت و عالی و تصویر بی نقصی رو بهتون ارائه میده البته بنده یه مشکلی که باهاش دارم اینه که تصویر صفحه گوشی رو وقتی میخوام باهاش پخش کنم مدام گیر میکنه و تکه تکه و با سرعت پایین پخش میکنه ولی با نرم افزار Eshare که تو خود دستگاه هم نصب هست فایلها رو بصورت خوب و بی نقص پخش میکنه و من حتی فایل ۴کی هم باهاش دیدم و عالی بوده. البته گوشی من s21 سامسونگ هست با آیفون خانومم امتحان کردم اونم تو پخش تصویر گوشی مشکل داشت ولی در مجموع عالیه فقط حواستون باشه که حتما باید تا حدود زیادی محیط تاریک باشه که بتونید بالاترین کیفیت رو ازش بگیرید. باند خودشم کیفیتش فوق العاده هست. اگه اسپیکر دارید که میتونید بهش وصل بشید و همزمان فیلمم ببینید ولی اگه ندارید الکی هزینه نکنید. چون کیفیت باندش عالیه. ضمنآ کیفیت تصویر روی دیوار صاف و سفید با پرده هییییییچ فرقی نمیکنه من خودم همراه با دستگاه پرده برقی هم خریدم ولی هیییچ فرقی تو کیفیتش نداره برای کسی که دیوار صاف و خلوت نداره واجبه ولی اگه دارید اونم الکی هزینه نکنید. امیدوارم همه هموطنانم بتونن از بهترین و با کیفیت ترین محصولات و چیزی که دلشون میخواد داشته باشن و لذتش رو ببرن. با تشکر."
4,من قبلا T2Max داشتم و تصمیم گرفتم این مدلو تهیه کنم نسبت به قبلی صدای خیلی بلند تر و بهتری داره روشنایی هم بهتر شده اما کلا این مدل ها سدر فضای تاریک و شب جوابه 
4,این پروژکتور روشنایی نسبتا خوبی دارد اما زیاد برای نور روز مناسب نیست که از مشخصات دستگاه هم همین انتظار می‌رفت. واسط کاربری آن بسیار خوب است و حتی با دیوایس های اپل هم میتوانید به راحتی روی آن استریم کنید. تنها مشکل آن این است که از عدسی مناسبی برای پخش نور استفاده نشده است. بهتر بگویم تصویر فقط وقتی که مستقیما از روبرو پخش شود تمام قسمت‌های آن فوکوس است. به محض اینکه کمی سر پروژکتور را بالا میدهید (که تقریبا همیشه لازم است این کار را بکنید) اطراف تصویر از فوکوس خارج میشود. وزن پروژکتور هم بسیار زیاد است و اگر میخواهید از سه پایه استفاده کنید حتما یک سه پایه محکم و حرفه‌ای تهیه کنید. خلاصه از خاصیت پورتابل بودن فقط یک دسته دارد که آن را قابل حمل میکند. وگرنه به علت وزن بالا و شکنندگی بنده و همچنین نیاز به آداپتور به هیچ عنوان پرتابل نیست. 
5,بسیار عالی
5,"سلام دوستان   کیفیت خوبی داره اما نه برا محیط های روشن  و نسبت به مدل T6 MAX این مدل بهتره هر چند که توی قیمت هستن   و این فیلمی که گذاشتم ، داخل اتاق کاملا تاریک ..‌..  راستی اسم این سریال هم    سریال دندان شیرین  Sweet Thooth  امید وارم  در خریدتان کمکی کرده باشم ."
5,خوبه من راضی هستم
5,در تاریکی تصویر خوبی میدهد،با توجه به قیمت فعلی گزینه بسیار مناسبی هست،روی آپشن تنظیم پخش با زاویه خیلی حساب نکنید ، روی دیوار سفید خوب هست ولی برای پخش با کیفیت به پرده نیاز دارید ، با توجه به عدم وجود پایه جلویی برای تنظیم شیب پایه مناسب تهیه کنید
4,ارزش خرید دارد
5,"خرید این پرژکتور را توصیه می کنم  الان با توجه به قیمت سرسام آور تلویزیون و امکان خرابی و هزینه تعمیرات  بهتر هست در کنار تلویزیون هر کس یکی از این مرژکتور را در منزل داشته باشه"
5,با تشکر از موجود نمودن آن
3,صدای فن زیاده
4,در اتاق نسبتا تاریک  در سایز تصویر حدود ۶۰ اینچ کیفیت و نور بسیار مناسبی دارد .هرچند با افزایش سایز تصویر تا ۱۲۰ اینچ از میزان نور کاسته می شود اما همچنان قابل قبول است.
4,از نظر کیفیت تصویر در اتاق کاملا تاریک عالیه. واقعا ازش لذت می برید ولی اگر قیت زیر 5 میلیون تومان بود لذتش بیشتر می شد. تا 110 اینچ بزرگش کردم باز هم کیفیت عالی بود. به تمام وسایل از قبیل کامپیوتر و تلویزیون وصل می شود. به وای فای هم وصل میشه. حتی موس و کیبورد بیسیم هم بهش وصل کردم و آنلاین فوتبال از سایت تلوبیون دیدم. مثل یک گوشی اندروید می توانید سایت های اینترنتی رو مرور کنید. هر برنامه اندرویدی رو میتونید روش نصب کنید. یک سری وسایل جانبی از قبیل رم ریدر و کابل HDMI و سه پایه دوربین هم براش بخرید
5,عالی
5,"من برای آموزشگاه گرفتم و راضی هستم... البته باید دید در طولانی مدت چه طور خواهد بود."
4,"من این دستگاه را با اختلاف قیمت یک میلیون و دویست هزار تومان ارزان تر ، بصورت پلمپ و آکبند (در 2 جعبه) با همین گارانتی از نمایندگی لومنز خریداری کردم. بسیار دستگاه خوبی است. تصویری بسیار بزرگ در حد سینما ، با کیفیت عالی به شما تحویل خواهد داد. البته هرچه محیط تاریک تر باشد کیفیت تصویر شما بهتر خواهد بود. من پرده ضد انعکاس و ... نداشتم و تصویر دستگاه را روی دیوار خانه که سفید هست می بینیم. در فاصله 3.5 متری تصویری با ابعاد 2.5*1.5 به شما تحویل میده.این دستگاه عملا tv box  هم هست. من تلویبیون رو روش نصیب کردم و از طریق اینترنت ، فوتبال رو به بزرگی و  کیفیت سینما پخش کرد. بعد از روشن کردن دستگاه و بالا آمدن سیستم عامل، بصورت اتوماتیک تصویر تنظیم میشه و فوکوس مناسب انتخاب میشه. البته امکان تنظیم دستی هم دارید. کیفیت نمایش متن هم بسیار شفاف و چشم نواز هست منتهی فضا بایستی تاریک باشد،  هرچه تاریک‌تر بهتر. پس از نظر بنده مناسب کلاس درس و  آموزش نیست.  این یک دستگاه تمام عیار خانگی است که به راحتی سینما را به منزل شما خواهد آورد. کیفیت صدای بلند گو خوب هست و بلند ، اما اگه دنبال صدای فراگیر و دالبی هستید بایستی با بلوتوث یا سیم خروجی صدا به سینمای خانواده متصل بشید . هارد اکسترنال به راحتی وصل میشه و مثل صفحه کامپیوتر شخصی می تونید انواع فرمت ها را از روی هاردتون پخش کنید. ۱۶ گیگ حافظه داخلی داره. ۲ گیگ رم. کنترل دستگاه خیلی روان نیست.  اگر موس بلوتوث دار نصب کنید دیگه عالیه. اطراف دستگاه حتما باز باشه و تبادل هوا را رعایت کنید و الا به دستگاه آسیب وارو خواهد شد.اگه روی پایه نصب کنید بهتره."
4,"طی روز چندان قابل استفاده نیست و حتما باید اتاق تا حد امکان تاریک باشه برای استفاده، اما در شب خوبه. به گمانم در صورت استفاده از پرده مخصوص کیفیت تصویر بهتر بشه، من روی دیوار میندازم فعلا.  برای فیلم دیدن مناسبه چون ابعاد تصویر مناسبی بهتون میده، برای بازی نه چندان چون فریم ریت و رزولوشن بالایی نداره. بزرگترین نقطه قوتش داشتن سیستم عامل اندروید تی وی هست و بلوتوث و وای فای قوی و بدون اشکال.  ای کاش ۲تا پورت hdmi میداشت تا میشد راحت دو دستگاه بهش وصل کرد. اما بازم خوبه چون امکان mirroring از طریق وای فای رو داره. در مجموع انتظار کیفیت تصویر چندان بالا نباید داشته باشید، کار راه انداز و شیک و جمع و جور هست."
5,خوب و زیبا و فوقالعاده کاربردی
