1,لپتاپ معیوب بود و صفحه اش کار نمیکرد
5,نسبت به قیمت کانفیگ مناسبی داره کیفیت ساخت بالا 
4,از هر نظر لپتاپ خیلی خوبی هست تنها ایرادی که به نظر من داره نداشتن کیبورد مجزا برای تایپ اعداد هست
4,من تازه خریدم اولین چیزی که نظرمو جلب کرد بسته بندی بود که پلمپ بود. سیستم عامل داشت خیلی خوب میشد ..هنوز باهاش کار نکردم بتونم نظر کامل بدم ولی در کل که خوبه
5,سلام این لپ‌تاپ یک لپ تاپ خوبه و همین دیروز به دستم رسید و تا الان که باهاش کار کردم اذیتم نکرده نمیشه گفت لپ تاپ خفنیه ولی نسبت به قیمتش خیلی خیلی خوبه بازی هایی مثل god of wor یا سایبرپانک و یا snow runner و beamng drive را بدون لگ برای من بالا میاره با fps خوب مخصوصا روی گرافیک اولترا لگ تو این لپ‌تاپ نمیشه دید
5,همه چیز توی لپتاپ عالیه فقط خود به شخصه از حرارت می ترسم و مساله دیگه ای هم که هست بخاطرrtx3050شاید  vramکم بیارید
