4,"اون دوستی که میگفت گرافیک انبردش iris نیست  باید بگم این لپتاپ یه دونه رم ۸ داره فقط ولی گرافیک intel iris xe که رو cpu هست نیازمند رم دوال چنل هست یعنی شما باید یه رم ۸ دیگه بهش اضافه کنی که گرافیک iris فعال بشه در غیر این صورت گرافیک انبرد قدیمی UHD بجاش فعاله که قدرت خیلی کمتری داره ولی برای کارهای سبک و روزمره جوابه"
4,در این رنج قیمت یکی از بهترین لپ تاپ هاست و دیجی کالا هم قیمتش از جاهای معتبر دیگه مناسب تر هست
4,تا الان راضیم ازش. نرم افزارهای ک من استفاده میکنم ب خوبی اجرا میشن. ی مقدار رم کم میاره ولی اوکیه
5,از خرید خود راضی هستم و توصیه میکنم بخرید
4,لپ تاپ خوبیه
4,لب تاپ زیبابی هستش، بر خلاف چیزی که توی نظرات خوندم خیلی اثرانگشت میگیره به خودش و سخت هم لکه هاش پاک میشن. فینگر پرینت نداره، و بر خلاف چیزی که توی تمام سایت ها بع عنوان گرافیک این دستگاه Intel iris نوشته شده گرافیک آنبوردش با نصب خود نرم افزار اینتل هم iris تشخیص داده نشد. البته توانش با چیزی که توی مشخصات درج شده یکی هست منتهی عنوانش iris نیست. در مجموع حتی با وجود قیمت خیلی بالا باز هم من ازش راضیم...
4,به نسبت قیمت و سخت افزار و در مقایسه با رقبا ارزش خرید بالایی داره
4,معمولی
5,"نسل دوازده هستش با پسوند u1235 تو بنچمارک مقایسش کردم با 11300hک خیلی قویه از اکثر جهات برتر بود پشتیبانی از رمddr5هم داره قابلیت ارتقا هم داره رمش  گرافیکش انبرده ک اگه خیلی اهل گیم و..  نباشید قابل حله یو اس بی 3.2داره ک اگه هارد اکسترنالتون پشتیبانی کنه خیلی سرعتش خوبه در مقایسه با سری های  kمخصوصا k513 1441 از لحاظ سخت افزاری یه کمی قویتر و بروزتره و این یعنی پشتیبانی طولاتر فقط سه تا نقطه ضعف داره کیبوردش بک لایت نداره  جنس بدنش المینیوم نیست گرافیک انبرد با این قیمتی ک خود دیجی تامین کنندشه عااالیه و مقرون بصرفا"
