5,خیلی عالیه کارایی بسیار عالی
5,خیلی فوق العاده اس
3,"۳ هفته ای کار می کنم باهاش ، خوبه ، کار راه انداز ، شارژ خوب نگه میداره وای تو همین کارهای ساده هم بعضی وقتها گیر داره ، موس برا چند ثانیه قفل میشه هنگی دارخ"
5,  خوب
5,واقعا مقرون به صرفه است  قیمت استثنایی و در  نهایت کیفیت عالی بود 
5,بسیار راضی ام ممنون
5,من این مدل را از بازار و از نمایندگیش خریدم . خیلی سبک و کار راه بینداز است . cpu سلرون هست و مال سال 2020 است و جدید و قدرتمند است . هارد و رم رو ارتقا دادم . عالی شد و بسیار باریک و جمع . جور هست سبک . سری ساخت لتیتیود دل هست که سری حرفه ای و مقاوم دل هست . ویندوز اورجینال و صفحه فول اچ دی ش هم به نظر من از مزایای این مدل ارزان قیمت است .  ممنون
