5,یه نسخه از legio 5 معمولی هست که اونم ۳۰۷۰ هشت گیگه رمش ۳۲ و ای ۷ مدل ۱۲۷۰۰ هستش بدون هیچ تفاوتی و قیمتتونم گرون تر بقیه ی جاها هست داستان این لپتاپ و قیمتتون چیه توضیح بدین لطفا اگر شد بخریم!
5,من 24 اسفند 1401 خریدم و ازش خیلی راضی هستم. فقط وزنش خیلی زیاده
4,"این لبتاب کاربری گیمینگ اش بسیار لذت بخش تره تا مولتی مدیاش. اگر از لب تاب های قدیمی سری Nj ایسوس به این سیستم کوچ میکنید صفحه نمایشش آنچان نظرتون رو جلب نمیکنه ولی اسپیکر این سیسمتم حتی از تبلت های سری یوگای لنوو به شدت ضعیف تره. در کل Legion 5 pro مدل 2022 یک روح قدرتمند در کالبندی معمولیه"
3,لطفا موجود کنید زودتر
4,لطفا رنگ خاکستری موجود کنید تا بخریم.
5,واقعا به جرات میتونم بگم بی نقص ترین و کامل ترین لپ تاپ بازار سری لژیون 5 پرو هستش. وقتی باهاش کار کنید طولانی مدت پی میبرید به ارزشش.
5,"سلام  تخفیف بدید بخریم  من پولم رو جمع کردم  این مدل رو بخرم"
5,چیه هر هفته قیمتو میبرین بالا این ۵۵ اینا بود هفته پیش شد ۷۰ الان کردین ۷۲ باو فکر ما هم باشین دیگه
5,نسبت به قیمت و حتی تا چند میلیون بالاتر بهترین لپ تاپ موجود بازار هست، با تحقیق خریداری کردم و اصلا پشیمون نیستم.
5,اگر آف بخوره قطعا میخرمش
5,"این لپ تاپ عالی هست و از خریدش پشیمون نمیشید من خودم میخوام بخرم"
